start	end	text
0	18000	Welcome to today's TerraTalk. I am the host for today, Zhang Yanyong. Today, we are very honored to invite Dr. Hong Shaoming, a physical psychologist, to introduce his research interests to us.
18000	25000	Today's research topic is the complexity of unconscious processing. What else do we need to be conscious of?
26000	42000	Before starting today's lecture, let me introduce Shaoming first. Shaoming graduated from the Department of Psychology of NTU. After obtaining a degree, he obtained a Doctoral Degree in Neuroscience from Duke University, Singapore National University Medical School.
42000	53000	After obtaining a Doctoral Degree in Singapore National University Medical School, he came to the University of California, L.A. to do post-doctoral research.
53000	64000	For most of his research, he asked the question, what is consciousness? Can we process unconscious information? What is the relationship between attention and consciousness?
65000	81000	In order to answer these questions, he spent a lot of time designing experiments. His research tools include psychological and physical methods, magnetic reflection, and recently he has also started to use a brain map and eye tracking devices.
82000	97000	Before we welcome Dr. Hong Shaoming, I would like to ask everyone to mute their microphones so that our speakers can hear our applause.
97000	101000	Let's give a round of applause to thank Shaoming for bringing us today's lecture.
127000	139000	What do you want to explain behind the experiment? What do you want to explain? I would suggest that you pause between the entire research and let everyone ask questions. You can ask more details, etc.
139000	145000	If there are no questions, let's start.
146000	150000	As Dr. Hong mentioned, today we are going to talk about the complexity of unconscious processing.
151000	156000	In the end, I want to spend a little time to discuss if I can prove that unconscious processing is really very complicated.
157000	167000	What do we want to do with consciousness? Why don't our brains be like a computer? We receive an input, process it, and then throw the output out.
167000	172000	We don't need to be surprised by the outside world. Why do our brains need to be surprised by the outside world?
173000	174000	In the end, there will be a little discussion.
175000	190000	As usual, I usually define what consciousness is before I talk. At least what is consciousness in this framework of discussion?
191000	195000	The consciousness I want to discuss is basically related to the content, not the state.
196000	197000	These two are more common.
198000	201000	The meaning of the content is, for example, if I pick up this cup now, I don't know if you can see me.
202000	208000	Anyway, when I pick up the cup and I am conscious of this cup, it means that this cup has entered my consciousness.
209000	212000	The state is, for example, I am very bored now, and after five minutes you may fall asleep.
213000	216000	After you fall asleep, before you have a dream, you are in an unconscious state.
216000	219000	The state is not what we are going to talk about today.
220000	226000	It's all about the sensory stimulus that didn't enter your consciousness.
227000	230000	The consciousness we are going to talk about today is also focused on visual awareness.
231000	235000	We often talk about visual awareness.
236000	251000	I will mix visual awareness with consciousness.
252000	255000	When I say consciousness, I am basically talking about visual awareness in this talk.
256000	261000	The experiments I will show you later and the research I usually do are mostly focused on the visual level.
261000	267000	It doesn't mean that these things can't be discussed in the sense of hearing or touch.
268000	270000	It's just that today's focus is on visual awareness.
271000	276000	Why am I interested in the study of unconscious processing?
277000	282000	One of the points is that according to the information theory,
283000	289000	they have a little estimate of the amount of information we receive every second of our eyes and the content we can probably realize.
289000	293000	The amount of information that the eyes can receive is about 10 to 80 bits, so it's a lot.
294000	295000	We can receive so much information every second.
296000	298000	But the content of our real consciousness is a bit controversial.
299000	302000	It's about a few dozen to a few hundred, up to a thousand bits per second.
303000	305000	You can see a very, very, very big difference.
306000	308000	Simply put, of course, the message is transmitted.
309000	312000	From the moment your eyes receive the message to the moment you realize it,
313000	315000	a lot of information is lost.
316000	320000	Another possibility is that when we process external information in the brain,
321000	324000	even if we process it, the information has never entered our consciousness.
325000	327000	But it's still processed by our brain, and it might still affect our behavior.
328000	331000	What I'm interested in is what kind of information these messages are.
332000	335000	What kind of unconscious content can the brain process?
336000	339000	What kind of information can affect our behavior after processing?
340000	342000	Today's menu is very simple.
343000	344000	I'm talking about three things.
345000	350000	First, I'm going to talk about some early research.
351000	352000	I'm going to talk about some early research.
353000	357000	I want to convince you that a lot of things we think we've seen,
358000	359000	or we think we've realized,
360000	361000	like the two words I just said, I'm going to mix them up.
362000	364000	We don't actually realize or see these things.
365000	369000	These are classic psychological or intellectual research.
370000	373000	Second, I'm going to talk about my main research.
373000	376000	Do we just ignore the things we don't see?
377000	378000	No.
378000	380000	We found in a lot of research that the information we don't see,
381000	382000	the information we don't realize,
383000	385000	your brain can still process it, and it can further affect your behavior.
386000	389000	Finally, let's spend some time talking about why we need to see,
390000	391000	why we need to be aware of,
392000	393000	why we need to feel the outside world,
394000	395000	why we need to have experience.
396000	398000	You can feel it from the use of label symbols,
399000	400000	from the first to the third,
400000	403000	which is more and more speculative.
404000	406000	The third is basically my own personal guess.
407000	408000	You're welcome to jump in and discuss.
409000	410000	For the preliminary part,
411000	415000	I'm going to spend some time convincing you that a lot of things we think we've seen,
416000	417000	but we haven't.
417000	419000	The first is a very common example.
420000	421000	When we look at a picture,
422000	425000	we intuitively think that our visual system or our eyes
426000	429000	are like a camera or a camera.
430000	431000	We look at all the details.
431000	432000	For example, if you look at this picture now,
432000	433000	you'll see an animal in the middle,
434000	435000	a lot of flowers and grass,
435000	436000	and I've seen a lot of details.
437000	438000	The next thing I'm going to show you
438000	440000	is a bit like what we used to play when we were kids.
441000	442000	It's called...
444000	445000	I kind of forgot what it's called now.
445000	446000	But anyway,
446000	448000	what I'm going to show you is that I'm going to move this picture
449000	450000	to one of the places,
450000	452000	and then I'm going to move this original picture and the changed picture
452000	454000	back and forth.
454000	456000	If you look at this picture now,
456000	458000	you can remember all the details,
458000	460000	or you can capture all the details in your eyes.
460000	461000	Once I move it,
461000	463000	you should be able to see it very clearly.
463000	465000	Let's try to see if you can see it.
465000	466000	At this time,
466000	468000	we're going to use the YES function we just talked about.
468000	470000	There should be a hand symbol on the far left of your screen.
470000	471000	When you see
472000	473000	where these two pictures are different,
473000	475000	please press YES right away to let me know.
475000	476000	Okay, let's get started.
480000	482000	These are two different pictures.
482000	483000	There's one little thing that's different.
484000	485000	We have a person who is very good at it.
485000	486000	I saw it in an instant.
492000	494000	Okay, then...
494000	495000	He pressed NO again later.
495000	498000	So now it looks like everyone hasn't seen it yet.
498000	500000	I'll give you another ten seconds.
500000	501000	Then I'll announce the answer.
503000	504000	Oh, some people saw it.
504000	505000	Great.
507000	508000	Then I'll announce the answer.
508000	509000	The answer is here.
509000	510000	This point is different.
511000	514000	So this is called change blindness.
514000	515000	What does this mean?
515000	518000	When we think our visual system
518000	519000	sees the outside world,
519000	521000	it will actually capture all the details.
521000	522000	It's not.
522000	524000	Your visual system will actually ignore a lot of details.
524000	527000	What we think we see is actually not what we see.
527000	529000	So when I make a little change,
529000	531000	I'll show you what's the difference between the two pictures.
531000	532000	You actually can't find it.
532000	534000	Okay, that's the first example.
534000	535000	The second example,
535000	536000	in fact, it's still the same.
536000	537000	Okay, that's the first example.
537000	538000	The second example,
538000	539000	in fact, it's still change blindness.
539000	540000	I think this example is very cool.
540000	542000	It's a progressive change blindness.
542000	544000	Okay, this is actually a video.
544000	546000	I'll play this video later.
546000	548000	It will change slowly.
548000	550000	It's a dynamic thing.
550000	552000	Once you see any change,
552000	553000	please press YES right away.
553000	555000	Okay, let's get started.
561000	563000	It's actually a constant process of change.
563000	565000	You might think this is a static picture.
565000	567000	No, it's a video.
571000	573000	Do you see any difference?
573000	574000	Because I've seen it many times.
574000	575000	Now I can clearly see that
575000	578000	it's not the same as it was at the beginning.
578000	581000	Okay, I'll give you five more seconds.
581000	582000	Did you see it?
582000	585000	Some people started to see it.
585000	587000	Okay, I'm going to stop here.
587000	590000	Our video has been broadcast here.
590000	593000	This is what the video looks like at the beginning.
593000	595000	And this is what it looked like just now.
595000	597000	You can see that the color is very different.
597000	599000	This is a progressive change blindness.
599000	601000	In fact, this thing is right in front of us.
601000	603000	But such a big color change,
603000	606000	my visual system can't capture it.
606000	608000	Again,
608000	609000	many times we think
609000	611000	we have seen some changes in the outside world.
611000	613000	Or we actually see the outside world very clearly.
613000	617000	In fact, it may not be true.
617000	620000	Let's show you another more famous example.
621000	623000	I want to broadcast the video first.
623000	624000	After the broadcast,
624000	629000	I'll talk about what this phenomenon is.
629000	632000	What you have to do in this video is
632000	633000	to count the people who are wearing white clothes.
633000	635000	Maybe some people have seen it here.
635000	637000	Because this is really very famous.
637000	639000	People who study psychology must have seen it.
639000	641000	Anyway, others, you can try it first.
641000	642000	What you have to do later is
642000	645000	to count the people wearing white clothes.
645000	648000	How many times have they played basketball?
648000	649000	It's that simple.
649000	651000	Let's get started.
679000	689000	I don't know if you have successfully counted 15 times.
689000	692000	Now the key question is
692000	696000	Did you see a big star on the screen just now?
696000	698000	If you see it, please press Yes.
698000	699000	If you don't see it, please press No.
699000	702000	I want to see your answers.
710000	712000	I will continue to broadcast the video.
712000	715000	It seems that half of the people here have seen it.
715000	716000	Half of the people have seen it.
716000	717000	Half of the people have not seen it.
717000	718000	I will continue to broadcast the video.
718000	724000	Let's take a look at what happened in the middle of the video.
724000	727000	What happened in the middle of the video
727000	733000	when you were counting the people wearing white clothes?
734000	740000	This is a classic psychological phenomenon called
740000	743000	Inattentional blindness.
743000	745000	For example, when your attention is focused on
745000	748000	counting the people wearing white clothes,
748000	751000	even if something strange happens in a very close place,
751000	753000	you still can't see it.
753000	757000	You can't bring these things into your consciousness.
757000	759000	This is called Inattentional blindness.
759000	762000	You can't see these things without attention.
763000	765000	This phenomenon is very famous.
765000	769000	This phenomenon is called Invisible Gorilla.
769000	773000	It is a visual stimulus that is very easy to see.
773000	776000	However, under a slightly difficult situation,
776000	779000	this visual stimulus disappears in front of you.
779000	781000	Finally, I want to talk about a more recent experiment.
781000	783000	Although this experiment is very recent,
783000	786000	the questions answered or the questions you want to answer
786000	789000	are related to something that has been discussed for many years
789000	792000	in the field of neuroscience, psychology, and neuroscience.
792000	798000	Is it true that our eyes feel those colors?
798000	800000	Let me put it this way. Is it true?
800000	803000	In physiology, if you know,
803000	806000	the amount of tracking cells around our eyes is
806000	808000	much less compared to our fovea,
808000	811000	which is right in the middle of the eye.
811000	814000	In other words, if you look at it from a physiological point of view,
814000	817000	the things we see around our eyes should not be very saturated.
817000	819000	The color we see should not be very saturated.
819000	821000	It's a little blurry and black.
821000	824000	But subjectively, we don't feel it.
824000	826000	Subjectively, we think,
826000	828000	I also see the color next to it.
828000	829000	For example, there is a lake next to me.
829000	831000	I also see the color of that lake.
831000	833000	Our subjective experience seems to be a little inconsistent
833000	835000	with the evidence in physiology.
835000	836000	In the past few decades,
836000	838000	there have been many experiments that want to explain to everyone that
838000	841000	you feel like you can see the color of your corner of the eye.
841000	843000	In fact, it is not necessary.
843000	846000	This experiment was published two years ago.
846000	848000	Basically, the whole process of the experiment
848000	850000	is very similar to the traditional experiment.
850000	853000	It's just that they used a VR system.
853000	854000	The question they want to ask is,
854000	859000	if you say you can see the colors around your eyes,
859000	863000	why don't I change it secretly?
863000	865000	If you can see those changes,
865000	866000	that means you can really see it.
866000	868000	Because you really read those colors.
868000	869000	If you can't see it,
870000	874000	maybe the colors you see around your eyes and corner of your eyes
874000	876000	are not as rich as you think.
876000	877000	Their method is very simple.
877000	879000	It's a VR, a virtual reality goggle.
879000	880000	After putting on the goggles,
880000	884000	I will ask them to look at a scene.
884000	886000	For example, here is a rural scene.
886000	887000	Some small houses and so on.
887000	889000	They don't have to do anything.
889000	891000	Their job is,
891000	892000	I might give you a few seconds.
892000	895000	You're just looking around.
895000	896000	In the last trial,
896000	899000	they will slowly turn the places
899000	903000	outside your eyes into black and white.
903000	908000	The amount of changes will be from the most difficult to the simplest.
908000	910000	The simplest is 10 degrees.
910000	912000	The most difficult is 32.5 degrees.
912000	914000	32.5 degrees is the center of your eyes.
914000	916000	About 30 centimeters out of your hand,
916000	919000	there is color in the middle circle.
919000	920000	The rest is colorless.
921000	927000	So even the least obvious situation
927000	929000	is obvious to us.
929000	930000	If you imagine that
930000	934000	the 30-centimeter circle in front of you is colored,
934000	935000	and everything else is black,
935000	936000	will you notice it?
936000	937000	People instinctively say yes.
937000	939000	How many people noticed it at this time?
939000	940000	About 20%.
940000	943000	So about 80% of people didn't notice it.
943000	948000	Only the 32.5-degree corner in the middle is colored.
948000	950000	The rest is not colored.
950000	951000	The rest is not colored.
951000	952000	Most people will say,
952000	953000	I didn't see it.
953000	954000	It's the same as before.
954000	955000	There is color.
955000	957000	It's normal.
957000	958000	This once again proves that
958000	960000	what we thought we saw,
960000	962000	for example, in this situation,
962000	965000	is the color of the corner of our eyes.
965000	966000	We really didn't see it.
966000	967000	Because if we didn't see it,
967000	968000	once it's changed,
968000	970000	we should be able to notice the change.
970000	972000	But we can't.
972000	978000	Through these four different demonstrations,
978000	980000	I want to convince you that
980000	981000	in everyday life,
981000	982000	when you open your eyes,
982000	984000	many things you think you've seen,
984000	985000	you've noticed,
985000	988000	are actually not there.
988000	990000	If you are convinced that
990000	992000	many things in the outside world,
992000	993000	for example,
993000	994000	we're talking about the visual world now,
994000	995000	many things in the visual world
995000	998000	haven't really entered our consciousness.
998000	999000	For me,
999000	1001000	the next instinctive question is
1002000	1004000	what happened to the things you didn't see?
1004000	1006000	Have they been processed by our brain?
1006000	1008000	Or did our brain choose to see some things
1008000	1011000	and throw away the rest?
1011000	1014000	This is the main part of today's lecture,
1014000	1016000	which is my own research.
1016000	1017000	Here,
1017000	1020000	I've chosen two studies to discuss with you.
1020000	1023000	The first study is related to the attraction of the face.
1023000	1024000	We want to show that
1024000	1025000	the attraction of the face,
1025000	1028000	even when you don't see that face,
1028000	1029000	can also be extracted.
1029000	1032000	It will affect how you distribute your attention.
1032000	1033000	The second study I want to talk about
1033000	1035000	is a little more complicated,
1035000	1037000	which is the processing of language.
1037000	1038000	I want to show that
1038000	1039000	the processing of language,
1039000	1042000	even when you don't see the key word
1042000	1044000	or some sentences,
1044000	1046000	you can still extract
1046000	1048000	the words you can't see.
1048000	1050000	These grammatical errors
1050000	1052000	will be processed by your brain
1052000	1054000	and further affect your behavior.
1054000	1055000	It's very abstract now,
1055000	1058000	but it will be clearer as time goes on.
1058000	1059000	First, let's talk about
1059000	1063000	the study of the attraction of the face.
1063000	1065000	Why are we interested in this?
1065000	1068000	The study of the attraction of the face
1068000	1070000	has a long history.
1070000	1074000	There are many theories.
1074000	1075000	Objectively,
1075000	1077000	if we don't care about any theory,
1077000	1079000	from the perspective of a normal person,
1079000	1082000	how do we know that a face is beautiful?
1082000	1083000	Objectively,
1083000	1086000	we need a kind of conscious deliberation.
1086000	1088000	In other words,
1088000	1090000	we need to be mindful
1090000	1092000	of every face we see,
1092000	1093000	and then say,
1093000	1094000	I like this face.
1094000	1095000	It's attractive to me.
1095000	1096000	I don't like this face.
1096000	1098000	We need to look at each face,
1098000	1100000	spend some time and effort
1100000	1103000	to judge whether it's beautiful
1103000	1105000	or not.
1105000	1106000	However,
1106000	1108000	this kind of intuitive thinking
1108000	1110000	is contradictory to the results
1110000	1113000	or answers given by traditional psychology.
1113000	1114000	What does this mean?
1114000	1115000	In fact,
1115000	1117000	psychology basically implies
1117000	1119000	a very automatic
1119000	1122000	or even very internal
1122000	1125000	or very small
1125000	1129000	mechanism to deal with the attraction of the face.
1129000	1130000	What does this mean?
1130000	1132000	For example,
1132000	1133000	many studies,
1133000	1135000	including recent or earlier studies,
1135000	1136000	found that
1136000	1139000	a very short presentation time,
1139000	1140000	that is, I show you a face
1140000	1141000	and the time is very, very short,
1141000	1143000	can let you judge
1143000	1144000	whether it's attractive to you or not.
1144000	1145000	We're talking about short,
1145000	1146000	short to, for example,
1146000	1147000	this is 100 milliseconds,
1147000	1148000	that's 0.1 seconds,
1148000	1149000	and there are even some
1149000	1150000	that are short to 13 milliseconds,
1150000	1152000	that's 75 hertz of a computer frame,
1152000	1153000	which is a flash.
1153000	1154000	In fact,
1154000	1155000	in such a short time,
1155000	1156000	the audience can still judge
1156000	1157000	whether this face is beautiful
1157000	1158000	or not for him.
1158000	1160000	This seems to imply that
1160000	1161000	we don't actually need
1161000	1163000	the so-called deliberation,
1163000	1164000	don't have to spend a lot of effort
1164000	1165000	to look at that face,
1165000	1168000	judge whether I like it or not.
1168000	1169000	In addition,
1169000	1171000	earlier baby studies also pointed out that
1171000	1173000	if you show the baby some pictures,
1173000	1174000	pictures of the face,
1174000	1176000	the baby will prefer
1176000	1178000	a face that is more attractive to them.
1178000	1179000	These attractive faces
1179000	1180000	are of course also defined
1180000	1181000	by adults,
1181000	1182000	which is a more beautiful face.
1182000	1183000	Show the baby
1183000	1184000	and find that they will spend more time
1184000	1185000	staring at those
1185000	1187000	more beautiful faces for them.
1187000	1188000	Okay,
1188000	1189000	this implies
1189000	1193000	whether to judge
1193000	1195000	or read something,
1195000	1196000	whether a face is beautiful,
1196000	1198000	is a very early
1198000	1199000	study,
1199000	1201000	or even an early process.
1201000	1202000	Okay,
1202000	1203000	this is basically the basis
1203000	1205000	of our experiment.
1205000	1206000	If there are
1206000	1208000	these past research foundations,
1208000	1210000	then we propose an assumption
1210000	1212000	that perhaps the attractiveness of the face
1212000	1214000	can be read by us
1214000	1216000	when you have not seen the face at all.
1216000	1218000	How do we prove this?
1218000	1220000	Here I have selected a few experiments
1220000	1221000	to explain to you.
1221000	1222000	Okay,
1222000	1223000	this is our assumption.
1223000	1226000	The first question we ask is
1227000	1229000	whether the beautiful face you can't see
1229000	1230000	has some advantages.
1230000	1231000	What does this mean?
1231000	1233000	In fact, if you know a little bit about
1233000	1236000	the psychology of the human face,
1236000	1237000	many studies say
1237000	1238000	that beautiful faces
1238000	1239000	have many advantages.
1239000	1240000	For example,
1240000	1241000	in general,
1241000	1242000	people will spend more time
1242000	1243000	paying attention to these faces,
1243000	1244000	spending more time
1244000	1246000	looking at these faces.
1246000	1247000	What we are actually asking here
1247000	1248000	is something similar.
1248000	1249000	Is it possible that
1249000	1250000	these beautiful faces
1250000	1252000	even if they are hidden by us,
1252000	1253000	I will talk about
1253000	1254000	how we hide them later,
1254000	1257000	it will still show some advantages.
1257000	1258000	The way we ask here is
1258000	1260000	whether these beautiful faces
1260000	1261000	after we hide them,
1261000	1262000	it will still be easier
1262000	1264000	to enter our conscious state.
1264000	1265000	In other words,
1265000	1266000	when in unconscious state,
1266000	1268000	its processing may be more efficient
1268000	1270000	or simply faster.
1270000	1271000	I will explain later
1271000	1272000	what is this
1272000	1274000	intraocular suppression.
1274000	1275000	Let's talk about
1275000	1277000	the general way we use
1277000	1279000	is to find a face database.
1279000	1280000	Here I just want to tell you
1280000	1281000	that the faces we use
1281000	1284000	are all emotionally neutral.
1284000	1285000	They are all faces
1285000	1287000	that the collector has never seen.
1287000	1288000	The important thing here is
1288000	1291000	that these faces are relatively neutral.
1291000	1292000	Some collectors even told me
1292000	1293000	that sometimes our faces
1293000	1294000	look a little scary
1294000	1295000	because I don't want them
