start	end	text
0	3000	整理&字幕 由 Amara.org 社群提供的字幕
30000	33000	整理&字幕 由 Amara.org 社群提供的字幕
60000	63000	整理&字幕 由 Amara.org 社群提供的字幕
90000	93000	整理&字幕 由 Amara.org 社群提供的字幕
120000	123000	整理&字幕 由 Amara.org 社群提供的字幕
150000	153000	整理&字幕 由 Amara.org 社群提供的字幕
180000	183000	整理&字幕 由 Amara.org 社群提供的字幕
210000	213000	整理&字幕 由 Amara.org 社群提供的字幕
240000	243000	整理&字幕 由 Amara.org 社群提供的字幕
270000	273400	整理&字幕 由 Amara.org 社群提供的字幕
300000	302660	我們的核心溫度就是我們的核心溫度
302660	304660	基本上都是 37 度 C 不會變
304660	306660	那好 OK
306660	308660	那有這個模型之後
308660	310660	我們就要想要了解說
310660	312660	在什麼樣的情況之下
312660	315460	我們的核心溫度會開始產生變化
315460	317460	那這個地方我會用一點點數學
317460	319460	不過不用擔心這個數學
319460	321460	其實沒有什麼高深學問在裡面
321460	323460	那基本上就是想要告訴我們說
323460	326460	我們的核心溫度如何隨時間變化
326460	328460	所以左邊這個我這邊寫了一項
328460	330460	像叫底梯 core 底梯
330460	332460	它意思代表就是說
332460	335460	我們的核心溫度如何隨時間變化
335460	337460	那核心溫度它可以上升
337460	339460	也可以下降
339460	341460	那什麼東西會讓它上升呢
341460	343460	第一個就是我們的新陳代謝率
343460	345460	新陳代謝率是人體裡面的
345460	348460	一些化學變化所產生出來的熱量
348460	350460	那一般人如果現在
350460	352460	比如說我們現在就坐著不動
352460	354460	就在那邊聽演講的話
354460	356460	一般人的新陳代謝率大概是 100W
356460	359460	就是瓦是一個能量的單位
359460	362460	這個新陳代謝率它可以讓身體增溫
362460	365460	也就是說你這個東西在冬天也非常有用
365460	367460	你在冬天如果覺得很冷的話
367460	369460	新陳代謝率就會變得比較高
369460	372460	那它可以讓我們的核心溫度開始增加
372460	374460	那產生熱之後
374460	378460	我們核心也會希望把這樣子的熱量給散走
378460	380460	那散開的機制就是
380460	382460	藉由傳導 conduction
382460	385460	它核心會把這樣的熱量
385460	387460	從新陳代謝產生的熱量
387460	389460	傳導到我們的皮膚上
389460	391460	那皮膚它也不是省油的
391460	393460	它接受到這樣子的熱量之後
393460	395460	它會再想辦法把同樣的熱量
395460	397460	散發到大氣中
397460	399460	所以同樣的我們可以寫下一個
399460	401460	類似的方程式
401460	403460	可是這個地方因為
403460	405460	這有點數學上的一些detail
405460	407460	就是因為我們人的皮膚表面
407460	409460	因為他的那個體積實在太小了
409460	412460	所以他的熱容量很小
412460	414460	所以基本上我們可以假設
414460	416460	我們的皮膚溫度
416460	418460	基本上它變化是瞬間的
418460	420460	它不會像我們的體溫是慢慢上升或慢慢下降
420460	422460	所以我在這個方程式的左邊
422460	424460	我就故意把它寫成0
424460	426460	這是一個數學上的一個技巧
426460	428460	就是我們不用去考慮
428460	430460	皮膚它怎麼樣隨時會發生變化
430460	432460	我們只要知道說在什麼樣的情況之下
432460	434460	皮膚它的溫度
434460	436460	是怎麼變化就可以了
436460	438460	那皮膚的溫度是怎麼變化呢
438460	440460	第一個它會接受
440460	442460	就是核心丟給它的熱量
442460	444460	就是conduction
444460	446460	這conduction會讓它
446460	448460	讓皮膚溫度開始上升
448460	450460	那同樣的它可以把
450460	452460	這樣子的熱散發給
452460	454460	散發給外界
454460	456460	也就是heat loss to air
456460	458460	就是這項它代表的意思
458460	460460	所以大家可以看一下
460460	462460	不知道大家可不可以看到這個滑鼠
462460	464460	沒關係
464460	466460	大家可以看到那個鼠標嗎
466460	468460	OK好謝謝
468460	470460	所以這一項D到式子
470460	472460	它的意思就是說
472460	474460	如果我的core temperature
474460	476460	如果這一項是比較大的
476460	478460	那這一項它就會讓我的core temperature增加
478460	480460	那如果這一項比較大
480460	482460	因為大家看到前面有一個負號
482460	484460	那這個負號它就會讓我的
484460	486460	我的體溫開始下降
486460	488460	所以基本上我的體溫是決定於
488460	490460	這兩個因素的
490460	492460	新陳代謝和我的傳導
492460	494460	那我的皮膚溫度也是一樣
494460	496460	傳導會讓我的皮膚溫度開始增加
496460	498460	但是因為它同時也會散熱到
498460	500460	散熱到大氣
500460	502460	所以皮膚溫度會開始下降
502460	504460	那我們想要決定的就是
504460	506460	我們想要知道就是說
506460	508460	我們的核心溫度到底在
508460	510460	什麼樣的情況之下會不斷地上升
510460	512460	什麼樣的情況之下會不斷地下降
512460	514460	好
514460	516460	那我們現在如果看一下後面這一項
516460	518460	就是heat loss to air
518460	520460	就是皮膚會用什麼樣子的方式
520460	522460	把熱量送給大氣
522460	524460	它事實上
524460	526460	主要有三種機制
526460	528460	把這個heat loss to air
528460	530460	把它換成三項相加
530460	532460	那第一項叫做long wave
532460	534460	中文就是長波
534460	536460	那什麼是長波呢
536460	538460	長波就是任何有溫度的物體
538460	540460	它都會發出電磁波
540460	542460	那它發出電磁波的
542460	544460	波長的長短是決定於
544460	546460	這個物體的溫度
546460	548460	比如說太陽溫度非常的高
548460	550460	它大概有六千度
550460	552460	所以它發出來的電磁波波長非常非常的短
552460	554460	那人體因為人體的溫度大概只有三十七度C而已
554460	556460	差不多就是這個溫度
556460	558460	所以它發出來的波長非常的長
558460	560460	所以我這邊寫一個long wave
560460	562460	它意思就是因為跟太陽光的電磁波比起來
562460	564460	人體可以發出的
564460	566460	這個電磁波實在長的非常多
566460	568460	所以我把它叫做long wave
568460	570460	人體可以藉由長波長
570460	572460	來為自己散熱
572460	574460	這是第一個機制
574460	576460	那第二個機制是sensible heat
576460	578460	那中文對我這邊查了一下應該叫顯熱
578460	580460	顯是明顯的顯熱量的熱
580460	582460	顯熱
582460	584460	顯熱就是在講皮膚和那個
584460	586460	大氣之間的傳導
586460	588460	也就是說你如果今天遇到一個冷空
588460	590460	碰到一個冷空氣
590460	592460	你的皮膚溫度就會開始下降
592460	594460	那如果那個大氣溫度比較高的話
594460	596460	你皮膚溫度會開始上升
596460	598460	這個就是sensible heat
598460	600460	那最後一項還有一個叫 latent heat
600460	602460	那 latent heat它的中文叫前熱
602460	604460	就是意思是說
604460	606460	如果你現在開始流汗
606460	608460	然後皮膚表面佈滿了汗水
608460	610460	那當這個汗水開始蒸發的時候
610460	612460	它可以把皮膚的
612460	614460	溫度給帶走
614460	616460	這個就是 latent heat
616460	618460	那當然如果你想說這個人如果他沒有流汗的話
618460	620460	那我們就沒有這個第三項
620460	622460	我們只有前面這兩項而已
622460	624460	所以第三項一定要有流汗
624460	626460	他才會在這裡面
626460	628460	那我們現在要開始想像說
628460	630460	OK那我們現在有這個人體模型
630460	632460	那我們想要回答什麼樣子的問題
632460	634460	我們想要問的是說
634460	636460	未來會不會因為有人太熱而死掉
636460	638460	所以我們在想像說
638460	640460	當你如果覺得非常非常熱的時候
640460	642460	你可能快要熱死了
642460	644460	這時候我們會怎麼做
644460	646460	我們可能會脫掉我們所有衣服
646460	648460	可能會覺得說算了不管了
648460	650460	因為我快熱死了我就把所有衣服都脫掉
650460	652460	那當你沒有穿衣服的時候
652460	654460	基本上long wave和sensible heat都可以非常好的運作
654460	656460	因為你沒有衣服來阻隔
656460	658460	你和大氣之間的熱量的傳遞
658460	660460	所以當我們脫掉衣服的時候
660460	662460	事實上是有助於散熱的
662460	664460	那同時呢我們可能會
664460	666460	因為太熱所以全身可能佈滿了汗水
666460	668460	所以
668460	670460	第三項也存在
670460	672460	我們希望我們的人體表面是佈滿了汗水
672460	674460	當然你可能會想說
674460	676460	有一些人比如說老年人
676460	678460	他們可能不太會流汗
678460	680460	那像這種人他們就不太容易散熱
680460	682460	不知道為什麼老年人他們的
682460	684460	不知道什麼關係
684460	686460	就是讓他們的散熱機制比較差
686460	688460	有一個原因就是因為他們不太會流汗
688460	690460	那我們現在想問的是說
690460	692460	健康人
692460	694460	健康人他可以很適當的流汗
694460	696460	但在這種情況之下
696460	698460	在未來會不會還是會死掉
698460	700460	所以我們現在就做一個非常強的假設
700460	702460	我們就假設說
702460	704460	這個人體模型他沒有穿任何的衣服
704460	706460	並且他全身佈滿了汗水
706460	708460	就是assume no clothes
708460	710460	now fully covered by sweat
710460	712460	這是為什麼我們的題目
712460	714460	上面寫一個sweaty human in a GCM
714460	716460	sweaty human意思就是說
716460	718460	他全身佈滿了汗水
718460	720460	所以這是題目的第一部分
720460	722460	請問
722460	724460	就是我對你那個市值的那個sign有點問題
724460	726460	就是我們今天
726460	728460	全部都討論說inhabitable
728460	730460	主要是被熱死不是被冷死
730460	732460	對
732460	734460	然後如果是這樣的話
734460	736460	我直覺會覺得
736460	738460	dt core dt
738460	740460	應該要是正的
740460	742460	可是如果是正的話你的conduction就越大
742460	744460	你
744460	746460	這樣子你的增溫
746460	748460	就變成是
748460	750460	所以你現在是說你的sign是怎麼定的
750460	752460	ok
752460	754460	非常好
754460	756460	conduction如果是正的話就代表說
756460	758460	我的熱量是從core傳到
758460	760460	那個皮膚表面
760460	762460	所以這個箭頭的意思就是conduction的方向
762460	764460	那如果conduction
764460	766460	傳是負的話就代表
766460	768460	熱量從皮膚傳到核心
768460	770460	所以現在
770460	772460	我沒有理解錯的話會死掉的條件
772460	774460	是dt dt
774460	776460	就是底大梯底小梯要是負的
776460	778460	對不對
778460	780460	我希望我們的人體體溫上升
780460	782460	而且要上升到某一定的程度
782460	784460	不是我說
784460	786460	你希望人體溫上升
786460	788460	對我意思是說對人不好是
788460	790460	是負的
790460	792460	ok
792460	794460	其實對這個問題是有兩個層面
794460	796460	就是人的體溫最好是維持
796460	798460	37度C不要變
798460	800460	那但是你如果太冷或太熱
800460	802460	當然對人體都有傷害
802460	804460	那太冷的話怎麼辦
804460	806460	就是這個事當然有可能會預測出說
806460	808460	底梯底梯core底梯小一點的情況
808460	810460	那這種情況下我們當然就會想要穿衣服
810460	812460	如果我們覺得冷的話
812460	814460	我們就會開始加把衣服穿上去
814460	816460	那這個東西這個式子裡面沒有寫
816460	818460	對抱歉這個地方我就是
818460	820460	稍微為了簡化起見
820460	822460	我知道我哪裡沒有搞懂
822460	824460	你那個不是conduction heat loss的power
824460	826460	你那個只是說一個conduction term
826460	828460	但是你還是會把它用成
828460	830460	這個方向然後但是你的
830460	832460	sine會跟著變你只是這樣寫
832460	834460	喔是阿對對
834460	836460	我這邊就是想說用文字來表示
836460	838460	用數學表示你會比較清楚
838460	840460	等一下會把這項寫成數學式子
840460	842460	就會變比較明顯了
842460	844460	ok
844460	846460	好那所以阿
846460	848460	就是我們現在人體就是
848460	850460	我們現在就假設這個人就是全身佈滿了汗水
850460	852460	那ok所以
852460	854460	就是為什麼我們題目就是寫說他是一個sweaty human
854460	856460	那這個模型事實上
856460	858460	他不是只有這樣子而已
858460	860460	我們可以用這個模型來模擬各種不同的情境
860460	862460	就比如說什麼
862460	864460	比如說我現在可以把這樣的人體模型
864460	866460	我可以把它放在艷陽之下
866460	868460	然後看一下當他被太陽照到的時候
868460	870460	那他的體溫會不會上升比較快
870460	872460	答案是一定會嘛
872460	874460	對當我們想知道說上升多快
874460	876460	那如果他這個體溫
876460	878460	這個人體是被太陽照到的話
878460	880460	我們要做的事情就只是把最後一項
880460	882460	就最後這個括號裡面多一個叫
882460	884460	extra radiation
884460	886460	他代表就是太陽光的電磁波
886460	888460	那這個extra radiation
888460	890460	他的來源可以很多阿當然不是只有太陽
890460	892460	如果你今天拿一個暖爐
892460	894460	就放在這個人旁邊那當然這個也會造成
894460	896460	人類體溫的上升
896460	898460	所以意思是說這個模型不是只有
898460	900460	只侷限於在一般的
900460	902460	常播sensible heat和laden heat
902460	904460	這樣子的熱量傳遞我們事實上是可以
904460	906460	增加其他的不同的
906460	908460	熱量傳遞機制在裡面
908460	910460	那另一個問題就是說我們也同時
910460	912460	也會想要知道在未來
912460	914460	某些情況之下因為我們現在知道有些地方
914460	916460	人們比較就是他們必須要
916460	918460	到外面去工作他們可能是外面的勞工
918460	920460	那你在外面的時候
920460	922460	你的新陳開始工作的時候新陳代謝率
922460	924460	一定會開始增加那這個時候
924460	926460	該怎麼辦很簡單我們就把這個
926460	928460	metabolic rate新陳代謝率把它
928460	930460	變成兩倍或甚至三倍都可以
930460	932460	就看這個人他的工作的
932460	934460	工作效率如果你工作非常的勤奮
934460	936460	那你可能就是兩倍或三倍的新陳代謝率
936460	938460	那如果你只是一般的走路的話
938460	940460	可能就是只增加一點點
940460	942460	所以說這樣子的模型事實上是可以
942460	944460	模擬各種
944460	946460	未來的各種情況比如說
946460	948460	在外面工作適不適合工作啊
948460	950460	適不適合運動啊就像之前
950460	952460	加州就是heat wave就是因為有人在
952460	954460	外面hiking然後他就被熱死了
954460	956460	對所以說運動是對
956460	958460	人體的體溫是有影響的
958460	960460	欸我有個問題
960460	962460	你這個metabolic rate就是
962460	964460	因為我本身對就是
964460	966460	fitness有一些設計
966460	968460	那這metabolic rate其實會跟著
968460	970460	隨著年齡的增加而
970460	972460	減少那這個
972460	974460	這個年齡你們怎麼樣把它
974460	976460	incorporate到這樣子的一個
976460	978460	situation裡面就是會
978460	980460	改變啦這個不是一個常數啦
980460	982460	也就是他們有一個inherit
982460	984460	或是每個人他都會隨著他
984460	986460	的肌肉的多寡會影響到
986460	988460	他的基礎代謝率的一些
988460	990460	增加或減少還有年齡
990460	992460	對對是非常好
992460	994460	而且他事實上跟那個跟性別也有
994460	996460	關係不同不同年齡然後不同性別
996460	998460	他們的新陳代謝率都
998460	1000460	不一樣所以說在我們接下來
1000460	1002460	因為等一下會跑一個模擬那這個模擬
1002460	1004460	的話我們當然沒有辦法去做
1004460	1006460	各種年齡層的的的試驗
1006460	1008460	但是理論上是可以做到的
1008460	1010460	但是等一下我們的模擬我們只會取一個
1010460	1012460	世界的平均值那這個大概是
1012460	1014460	大概是我去那時候取
1014460	1016460	數值大概是100瓦就是一個
1016460	1018460	成年人他的新陳代謝率
1018460	1020460	當然你會可能想說那
1020460	1022460	世界上很多人他可能是老年人或是他可能是
1022460	1024460	其他他可能比如說是運動員
1024460	1026460	他新陳代謝率可能比較高那這種
1026460	1028460	怎麼辦那沒關係我們可以再做一次
1028460	1030460	模擬然後把他的新陳
1030460	1032460	代謝率帶到我們這個式子裡面
1032460	1034460	那也是可以用的
1034460	1036460	我們可以對是他是可以就是
1036460	1038460	personalize給不同的人
1038460	1040460	不同的worker那對就是那
1040460	1042460	有些人他的可能conduction可能比較好
1042460	1044460	有些人他的皮膚表面就是面積
1044460	1046460	比較大那那些都會影響到我們
1046460	1048460	這個式子那等一下就我要
1048460	1050460	給大家看的模擬是我是取世界
1050460	1052460	的標準體重標準
1052460	1054460	身高然後標準的新陳代謝率
1054460	1056460	好就是想說在這種情況之下
1056460	1058460	那未來平均上大概會有
1058460	1060460	多少死掉就是
1060460	1062460	等一下我要做的事情不過你說的沒有
1062460	1064460	錯就是不同人會有不同的反應
1064460	1066460	好謝謝
1066460	1068460	好那
1068460	1070460	ok那接下來我想要
1070460	1072460	稍微再花一點點時間再講一下這個
1072460	1074460	conduction term好剛剛因為剛剛有
1074460	1076460	聽眾有問到這個問題就是非常好
1076460	1078460	就是我們現在可以把他式子
1078460	1080460	把他寫下來其實conduction term他大概
1080460	1082460	可以寫成這樣子就是一個
1082460	1084460	熱傳導係數乘上
1084460	1086460	這兩個溫度的差別
1086460	1088460	也就是說如果我的
1088460	1090460	核心溫度比較比
1090460	1092460	我的皮膚溫度還要高一點的話
1092460	1094460	那我這個conduction事實上是會從
1094460	1096460	核心傳導到我的皮膚來
1096460	1098460	那如果是我的skin
1098460	1100460	現在如果特別熱他比core
1100460	1102460	還要高的話我的conduction事實上
1102460	1104460	是會從skin傳到我的核心上
1104460	1106460	ok所以這大概就是我們的
1106460	1108460	conduction term的長相
1108460	1110460	好那現在有個問題就是
1110460	1112460	在這個模型裡面有一個
1112460	1114460	未知的參數也就是這個conduction
1114460	1116460	事實上我這邊寫conduction
1116460	1118460	不是一個太好的詞因為他不是
1118460	1120460	真的只包含conduction而已
1120460	1122460	他事實上是包含兩個效應
1122460	1124460	第一個是肌肉的
1124460	1126460	傳導第二個是
1126460	1128460	血流的這個convection
1128460	1130460	應該是翻譯成對流也就是說我們
1130460	1132460	如果一個人如果死了
1132460	1134460	他的血液不會流動那這個時候
1134460	1136460	k他會等於一個最
1136460	1138460	小的數值大概就是5
1138460	1140460	單位等一下會顯示他那個就是
1140460	1142460	就是5就是k的最小值
1142460	1144460	他代表就是如果純靠
1144460	1146460	肌肉的傳導的話那k
1146460	1148460	大概就只會等於5可是一般
1148460	1150460	如果人是活著那他的
1150460	1152460	血流量事實上是會幫助
1152460	1154460	熱量從核心傳導到
1154460	1156460	我們的皮膚那這個時候k就會
1156460	1158460	開始上升我們如果血流量
1158460	1160460	越大的話k就會越高
1160460	1162460	那在歷史上醫學
1162460	1164460	上觀測到最大的
1164460	1166460	k大概是250
1166460	1168460	左右那後面這個watt
1168460	1170460	per meter square kelvin這個就是他的
1170460	1172460	單位就是這團係數的單位
1172460	1174460	250目前我們人類
1174460	1176460	觀測到最高的k的數值
1176460	1178460	可是你可能會問說那
1178460	1180460	目前人類觀測到250度
1180460	1182460	250那個k是250
1182460	1184460	可是不代表說未來不會有更高的
1184460	1186460	數值出現搞不好未來就人類進化了
1186460	1188460	或者是那個有人經過長期的
1188460	1190460	訓練他可以把自己的k
1190460	1192460	變得非常的大那怎麼辦沒有問題
1192460	1194460	這樣我們就可以做一點數學上的
1194460	1196460	一些數學上的一些近似
1196460	1198460	我們不知道250是不是最大的
1198460	1200460	數值我們就把它換成無限大
1200460	1202460	對不對就無限大的話就沒有
1202460	1204460	話講了5是最小的數字
1204460	1206460	那是肌肉的傳導那
1206460	1208460	上限我們不知道是不是250我們不確定
1208460	1210460	我們就把它換成無限大
1210460	1212460	那事實上這個東西是數學上是有
1212460	1214460	可以justify啦就是數學上
1214460	1216460	就我們在做模擬的時候
1216460	1218460	就數學上我們會發現說比如說
1218460	1220460	剛才原本數值是250我們看一下
1220460	1222460	250和5這兩個數字的差距
1222460	1224460	5和250事實上是差非常
1224460	1226460	多的對不對就是他的數量
1226460	1228460	已經是他的兩個order
1228460	1230460	以上了就打個比方就是
1230460	1232460	比如說有人比如說我現在在
1232460	1234460	加州然後比如說我跟你講說我每天
1234460	1236460	花5塊5塊美金買一杯珍奶
1236460	1238460	對就是台灣聽了可能會覺得
1238460	1240460	很奇怪說為什麼珍奶一般要5塊錢
1240460	1242460	5塊美金對沒有錯這加州就賣這麼貴
1242460	1244460	好那如果我告訴你說我現在每天
1244460	1246460	就是花5塊錢買一杯珍奶喝
1246460	1248460	那如果哪一天我就突然聽到一個
1248460	1250460	另外一個人他說他一天花
1250460	1252460	250塊買50杯珍奶
1252460	1254460	來喝那我可能會想說哇50杯
1254460	1256460	這個對我來講可能是
1256460	1258460	跟無限大沒有什麼兩樣因為其實
1258460	1260460	每天喝一杯珍奶事實上負擔就很大
1260460	1262460	如果你要喝50杯的話那這個跟無限大
1262460	1264460	事實上沒有什麼差別所以這個就是
1264460	1266460	數學上的一個trick就是我們把一個
1266460	1268460	兩個數量級差很大的數字如果一個
1268460	1270460	參數他的範圍是非常的大
1270460	1272460	這兩個範圍數量級差很多的時候
1272460	1274460	我們可以把比較大的那個換成無限大
1274460	1276460	這個對我們的模型本身
1276460	1278460	不會有什麼太大的影響因為基本上
1278460	1280460	他的範圍就是那麼大
1280460	1282460	OK所以
1282460	1284460	那這個就是我們K的範圍
1284460	1286460	那其實做這樣有一個好處
1286460	1288460	就是我們在做模型的時候
1288460	1290460	我們不希望裡面有太多未知的
1290460	1292460	參數就是一個模型他如果
1292460	1294460	未知的參數越多的話那就代表說
1294460	1296460	你這個模型就可能還有些物理
1296460	1298460	沒有弄懂那我們
1298460	1300460	把250這個東西
1300460	1302460	換成無限大我們就是少掉了一個
1302460	1304460	未知的參數那你可能會說
1304460	1306460	那好那這個模型他有
1306460	1308460	幾個未知的參數當然是零
1308460	1310460	就是250這是我們唯一不知道的
1310460	1312460	參數我們不知道人體會取哪一個K
1312460	1314460	那我們現在就把他換成無限大那代表說
1314460	1316460	OK我們現在考慮就是最理想的情況
1316460	1318460	好那但是問題
1318460	1320460	現在還是存在就是那
1320460	1322460	K他到底會等於多少他現在範圍這麼大
1322460	1324460	他從5到無限大他到底會取哪一個
1324460	1326460	K呢那我們現在再做一個更強的
1326460	1328460	假設我們想要做一個比較
1328460	1330460	conservative的預測
1330460	1332460	就是說我們假設
1332460	1334460	未來人未來人他可能
1334460	1336460	演化到
1336460	1338460	某一定的程度他可能有一些
1338460	1340460	一些潛力啊
1340460	1342460	他就是我們人體可以
1342460	1344460	取一個最棒的K
1344460	1346460	使得我們的核心
1346460	1348460	可以傳導最多熱量到我們的皮膚
1348460	1350460	表面也就是說
1350460	1352460	我們的人體會做以下的事情
1352460	1354460	我就從K從5開始選
1354460	1356460	K等於5K等於6
1356460	1358460	K等於7K等於8
1358460	1360460	做一連串的實驗
1360460	1362460	想像中的實驗就人體他就開始會運算
1362460	1364460	然後看說哪一個K
1364460	1366460	可以使得我這個熱傳導最
1366460	1368460	最大因為我希望我的核心溫度
1368460	1370460	降低嘛我不希望人太熱
1370460	1372460	那我就選一個最棒的可以使得
1372460	1374460	這個熱傳導向最大
1374460	1376460	OK那個就是我們就是這個模型
1376460	1378460	會做的事情所以the human model always
1378460	1380460	chooses the optimal K就是我們一定會
1380460	1382460	取一個最佳化的
1382460	1384460	最佳化的解讓我們的人
1384460	1386460	可以最快的降溫這是我們模擬
