start	end	text
3622460	3624460	但如果這些風它遇到了一些
3624460	3626460	比如說草地啊或者是
3626460	3628460	水泥或者是那種
3628460	3630460	就是高樓大廈它風速就會減少
3630460	3632460	那它如何隨高度而減少
3632460	3634460	這個東西是我們可以
3634460	3636460	另外用手放進去的
3636460	3638460	而且事實上我們也有這個資料
3638460	3640460	這是另一個GCN沒有做到的事情
3640460	3642460	就是我們有把每個地方的地形資料
3642460	3644460	全部把它放到這個simulation裡面
3644460	3646460	因為事實上它也沒有真的花很多時間
3646460	3648460	就是多一個東西多一個變量而已
3648460	3650460	所以這個東西是有
3650460	3652460	在我們的結果之內的
3658460	3660460	好那現場的聽眾
3660460	3662460	還有沒有誰有
3662460	3664460	其他問題呢
3668460	3670460	OK如果沒有的話
3670460	3672460	那我們就可以麻煩你們
3672460	3674460	把你們的麥克風打開
3674460	3676460	然後我們鼓掌謝謝
3676460	3678460	那個議員今天為我們帶來精彩的演講
3678460	3680460	謝謝大家
3680460	3682460	好那我們的演講
3682460	3684460	Tara這次的演講就到這邊結束
3684460	3686460	那我現在還是要打一下
3686460	3688460	幫Tara打一下廣告
3688460	3690460	假如說你是第一次參加我們這個線上會議
3690460	3692460	然後知道我們Tara這個組織的話
3692460	3694460	如果你也想要
3694460	3696460	就是分享你的學術專業研究
3696460	3698460	在這個平台上
3698460	3700460	給其他人可以聽的話
3700460	3702460	那就是歡迎你來參加
3702460	3704460	然後並報名成為我們的會員
3704460	3706460	那我們就會幫你們安排
3706460	3708460	就是適當的時間
3708460	3710460	讓你能夠好好的
3710460	3712460	讓你的學術專業能夠在這個平台上
3712460	3714460	好好的發揮
3714460	3716460	然後也希望大家多多支持
3716460	3718460	然後也持續關注我們的
3718460	3720460	部落格或是我們的粉絲專頁
3720460	3722460	然後如果有看到你喜歡的
3722460	3724460	或是有興趣的主題
3724460	3726460	歡迎就是
3726460	3728460	就是準時來參加這個線上會議
3728460	3730460	OK那我們今天就到這邊結束了
3730460	3732460	謝謝您
