start	end	text
0	29900	哈囉,大家晚安,歡迎大家來到今天的Tarot Talk,今天我們很榮幸請到我們的講者,彭路,Lucas 彭,來跟我們講這個關於他的,基本上是他剛畢業,他的博士論文的題目,Clocked Atom Delivery to a Photonic Crystal Wave Guide,然後是有Simulation的部分,然後有實驗結果的部分,然後他本來是在加州理工學院的Kimball Group,
30000	46320	做Quantum Optics,我先介紹一下彭路的背景,等我一下,我把他關掉了,我把我的筆記關掉了,
46320	75220	彭路的博士研究主要是Focus在這個Quantum Simulation Platform by Trapping Atoms Close to the Surface of a Photonic Crystal Wave Guide,然後他在拿到博士學位之後,他到北加一個叫AO Sensing的公司,主要現在是在做Quantum Sensing Technology的開發,
75220	104220	彭路其實是我加州理工學院的學長,他本來是台大電機雙物理,然後在畢業之後就到Caltech拿到博士學位,然後現在在北加,他今天要跟我們講的題目我剛才講了,提醒大家如果要鼓掌的話要把麥克風打開,要不然我們的講者會聽不到,所以那我們就鼓掌,歡迎彭路給我們帶來今天的演講,謝謝,
104220	106220	好,那你開始吧,
106220	116220	謝謝張艾永讓我今天有這個機會可以分享我的研究,那我講的過程中如果大家有任何問題就隨時歡迎打斷我的問題,
116220	138220	好,那我今天要講的題目就是我的PhD的研究,主要是研究如何把色原子放到這個Photonic Crystal Wave Guide的附近,然後主要的用途是這個如果成功的可以把原子捕捉在這個Photonic Crystal Wave Guide的附近的話,就可以拿來做一個Quantum Simulation的平台,
139220	156220	那首先我會講一下我們實驗用的系統,就是這個看到這個透明的Photonic Crystal Wave Guide,那原子主要就是要捕捉在兩支Wave Guide中間這個孔隙的中間,
156220	169220	那所以我先介紹一下為什麼這個系統相比於其他系統,比如說Nano Fiber或是Cavity QED有什麼不一樣的地方,有什麼優勢,那當然也有它會帶來什麼挑戰,
170220	193220	那接著就是會介紹一下我開發的一個模擬的程式,就是可以模擬原子如何在這個Photonic Crystal Wave Guide附近移動,然後並且藉由這些模擬來算出一個2D的Spectrum,那得到這個Spectrum之後就可以了解原子在Wave Guide附近的行為,
194220	203220	那最後會show一些實驗的結果,然後跟模擬的結果來互相比較,然後看到我們可以從中得到什麼結論。
204220	221220	那首先這個研究的目的最終就是要做到一個很強的光跟原子的交互作用,那這個為什麼重要呢,是因為在一些量子科技的研究,比如說量子光學或是一些量子資訊的研究裡面,
221220	239220	就是通常我們會用光來傳遞一些量子資訊,然後這些量子資訊傳到之後可以希望它轉移到另外一個System裡面,因為這些System可能它們的Life Time比較長,可以讓你的量子資訊可以留久一點,以便你做更多的處理。
240220	253220	那有些是在ML領域裡一個研究的方向,就是如何把這個量子資訊從光轉移到原子上面,那要做到這個事情就必須要有很強的光跟原子的交互作用。
253220	266220	那當然最簡單的方式就是你想要把光聚焦到一個很小很小的範圍上,大概是一個波長的範圍,那在這個焦距量放一個原子就可以讓原子跟光產生交互作用。
266220	281220	那這種方式的限制就是,因為你的光的這個範圍最終還是被你的波長限制,所以利用這種方式的話,你光跟原子的交互作用的機率可能就是差的數量值。
281220	296220	那要怎樣讓這個機率可以更高呢?一種方式就是把原子放在一個cavity裡面,那你可以想像說這個就是好像光在這個cavity裡面一直反射,那每次經過這個原子的時候就會多一個機會跟原子交互作用。
296220	311220	所以透過這種方式就可以大幅提高光跟原子交互作用的機率。那除了用一個cavity以外,你也可以使用像這種micro-toray的resonator的結構。
311220	319220	那其實它也是有點像cavity,只是光會在這個圈裡面一直繞繞繞,那每經過一次原子可以有多一個機會跟原子交互作用。
320220	335220	那另外一種方式就是提高原子的數量,比如說regular atom,就是說你只要其中有一個原子跟你的光子產生交互作用,它就會躍遷到一個很高的quantum number的state。
335220	346220	那這樣子它可以阻隔其他原子,繼續跟這個光子產生交互作用。所以好像一坨原子就可以等效成一顆很巨大的原子這種感覺。
347220	361220	那剛剛講的說,在cavity裡面光來回反射產生交互作用是一種看法。那另外一種想法就是,你可以想像說這個cavity改變了光子的density of state,
361220	368220	所以讓你的原子可以有更多的state可以交互作用,這也是另外一種看的角度。
368220	378220	那除了cavity QED以外,還有另外一種就是waveguide QED的system。
378220	389220	那這種waveguide QED簡單來講就是,你可以把模型看成像一個很細的fiber跟一個原子,那光在這個fiber裡面移動的時候,
389220	398220	你可以想像它有一個input的電場,然後有一個transmittance跟一個反射的電場。
398220	408220	那這個system你可以計算出它的反射的公式是長這個樣子。
408220	420220	那裡面最重要的一個數字是γ1d。γ1d你可以想像它是原子放出一個光子之後,它這個光子跑到光線裡面的機率。
420220	426220	因為我們希望很強的光跟原子的交互作用,所以這個機率就是越高越好。
426220	435220	那這個γ1d就是光子decay到空間其他你不要的state的機率。
435220	443220	所以說這個strong addon photon coupling的研究就是你要能夠讓γ1d是越高越好。
443220	448220	那怎樣讓這個變高呢?就是你有幾個方向可以做。
448220	458220	第一個方向就是你可以去減少molar area,就是你把光侷限在越小的範圍裡面,它跟原子的交互作用的機率就越高。
458220	469220	那另外一個方向是你可以減少proof velocity,就是說光在光線裡面走越慢的話,它也有越多的機會跟原子產生交互作用。
469220	478220	所以一個重要的figure of merit就是γ1d就是γ'。
478220	489220	就是光decay到你要的state,就是在光線裡面的state,除以光decay到其他你不要的state的一個ratio。
489220	497220	我們先是以做這個system,就是一個final crystal waveguide。
497220	500220	那final crystal waveguide跟一般的光線有什麼不一樣呢?
500220	509220	有一個重點就是一般的光線離光線的距離有一個波長的限制。
509220	515220	γ1d跟γ'的ratio在現在實驗裡大概是4%左右。
515220	522220	所以這樣子90%的光是沒有跟原子交互作用,只是會透過原子。
522220	532220	那理論上如果再把光能夠抓到很靠近final crystal waveguide的話,γ1d over γ'可以提高到20%左右。
532220	541220	所以這樣子的話只有0.2%的光會透過沒有跟原子交互作用。
541220	547220	為什麼γ1d over γ'可以這麼高呢?
547220	554220	其中一個原因就是final crystal waveguide可以讓你去控制你的groove velocity。
554220	561220	比如說你的光如果很靠近final crystal band edge的話,它的groove velocity就會變得很低。
561220	568220	所以比如說在我們的system裡面,你的groove velocity可能就只有0.1%的光速。
568220	574220	而另外一個原因就是你這個final crystal waveguide你可以把它做成各種形狀,
574220	579220	所以你可以設計這個形狀讓你的光是侷限在一個很小的範圍裡面。
579220	586220	比如說像這個我們用的system是讓光集中在中間這個縫隙裡面,
586220	591220	所以可以讓光是侷限在一個比波長平方更小的面積裡面,
591220	597220	所以這樣可以大幅提高光跟原子的交互作用。
597220	602220	所以在這種系統裡面光是一個原子就可以反射幾乎所有的光,
602220	607220	所以可以把它想像成是一個fountain mirror。
607220	613220	那waveguide QED除了像我們實驗室用的這種我們叫做alligator final crystal waveguide以外,
613220	619220	也有各種各樣,比如說像有一種方式是你可以把光纖加熱然後拉長,
619220	623220	它就變成一個很細很細的光纖,就是nanofiber。
623220	631220	然後你可以在裡面放一些樹脯之類的,它就會把原子在周圍形成一些trap,
631220	637220	所以就可以把原子捕捉在這個光纖的周圍。
637220	644220	另外一種系統在像Huffle的Lukin Group他們有做到這種也是一個final crystal waveguide,
644220	648220	他們用的方式是他們用一個opical tweezer把原子抓住,
648220	652220	然後把它拖到這個final crystal waveguide的附近,
652220	657220	然後再讓它跟final crystal waveguide裡面的guide mode產生交互作用。
657220	663220	那像普魯大學的成龍他們也有做一個系統,
663220	668220	就是在substrate上面做這種resonator,
668220	674220	也是用opical tweezer的方式把原子捕捉在這些結構的附近。
676220	680220	那final crystal waveguide一個特別的地方就是,
680220	684220	final crystal waveguide還有一個general的問題,
684220	688220	就是像這樣子的structure通常都是什麼材料?
688220	695220	應該通常depend on你要在這個waveguide裡面傳的光是什麼波長,
695220	698220	你會希望它是就是越透明越好。
698220	702220	所以比如說像我們用的這個CZM的波長的話,
702220	707220	就是850nm、890nm,我們就是用Zirconitride。
710220	715220	Zirconitride,OK,OK,了解,好,謝謝。
716220	722220	所以你就是可能根據你要的材料,根據你要的波長來選擇你想要的材料。
722220	725220	比如說很常用也有這種telecom waveband,
725220	729220	你就可以弄一些silica之類的材料。
731220	736220	OK,所以waveguide有一個特別的地方是你可以去設計你的waveguide,
736220	742220	讓你的不同的頻率的光在裡面有不同的波長。
742220	748220	所以比如說像這個是bandstructure圖,橫軸就是wavenumber,
748220	751220	然後直軸是頻率。
751220	756220	你看在這個頻率的時候,比如說某個頻率是光就不能在裡面導了,
756220	759220	它就是一個bandgap的一種概念。
759220	763220	那在bandgap的這個邊邊,就是叫bandedge的地方,
763220	768220	你可以看到它的這個dΩdk是趨近於零,
768220	770220	所以就表示它的groove velocity變得很小。
770220	774220	所以在這種情況下,它的density of state就變得很高。
774220	778220	所以如果你原子的月圈的頻率是在這個附近的話,
778220	782220	你就可以想像說它可以跟很多state相交互作用,
782220	786220	就這樣可以大幅增加它dΩdk到這個state裡面的機率。
786220	789220	所以通常我們就會讓這個formula crystal waveguide是設計說,
789220	792220	它的bandedge是很接近原子的月圈頻率。
793220	799220	那所以你可以想像說原子的月圈頻率可以在這個bandgap的外面,
799220	800220	或在bandgap的裡面。
800220	804220	所以先進一種情況就是原子的月圈頻率在bandgap的外面的時候,
804220	808220	你可以看到這個頻率是可以在waveguide裡面傳導的。
808220	812220	所以說,比如說這個原子它從激發態變到ground state的時候,
812220	813220	它會放出一個光子。
813220	817220	那這個光子是在這個可以傳導的頻率,
817220	819220	所以它就會在這個waveguide上面移動。
819220	824220	所以可以想像看整個waveguide上面的原子之間的交互作用都是一樣強。
824220	826220	那這是一種regime。
826220	831220	那另外一個regime就是說,如果你把原子的月圈的頻率放到bandgap裡面,
831220	835220	那因為這個頻率的光就沒有辦法在waveguide裡面傳導了,
835220	841220	它就會形成一個exponential decay的光子的雲在原子的附近。
841220	843220	所以這時候就比較有意思了,
843220	847220	就是你可以控制原子離得越遠,它們的交互作用就越低,
847220	850220	然後原子越近的話,交互作用就越長。
850220	855220	所以可以想像說,這個就可以比較有一些local interaction。
855220	858220	那接下來會解釋說,在這種regime裡面,
858220	862220	你如何去控制兩兩的原子產生韌力的交互作用。
862220	865220	所以理論上,你只要有一維的系統,
865220	870220	你就可以讓原子之間產生可以去engineer韌力的Hamiltonian。
870220	875220	那我們先從一個比較簡單的waveguide外面的例子來講起。
877220	884220	那這是我們實驗室在2015年做的一個實驗。
884220	889220	那這個實驗的方式就是把這個waveguide,
889220	893220	應該說用一個雷射光照在這個waveguide上面,
893220	896220	它就會形成這樣子的干涉條紋。
896220	902220	那你可以看到干涉條紋就是有一些intensity maxima在這裡,還有這裡,
902220	904220	我們把它稱呼為Z1、Z2。
904220	910220	那如果你的這個雷射的頻率是略低於原子的越線頻率的話,
910220	914220	它就會把原子吸引到這個intensity maxima的地方。
914220	921220	所以透過這種方式,我們就會把一些原子抓到這個brown crystal waveguide的附近。
921220	925220	那這個地方它是在waveguide的上面一些,
925220	927220	所以它不是在waveguide的正中間。
927220	930220	所以在這個地方,γ1d over γ'大概是2吧。
930220	933220	所以就表示說它decay的時候,
933220	936220	它的光子decay到這個waveguide裡面的機率,
936220	941220	是比它decay到真空裡面的機率高了兩倍。
941220	945220	那這個有意思的地方就是,
945220	948220	如果你原子是抓在這個periodically,
948220	951220	把它抓在這個brown crystal waveguide上面,
951220	961220	只要它們之間的間距是整數的波長倍的話,
961220	970220	一個光子就可以跟整個原子的collective state產生交互作用。
970220	975220	那它們這樣子的話,交互作用會增強原子的數量。
975220	977220	比如說如果你有NA一個原子的話,
977220	981220	那它們之間的交互作用就會增強NA倍。
981220	985220	但是它們decay到free space還是一樣的數量,
985220	990220	所以你原子越多的話,它就會有更多的機率去decay到這個waveguide裡面。
990220	993220	那這是一個類似像superradiant的現象。
993220	1002220	那這個實驗裡面呢,原子的數量就是利用你抓了多久來控制的。
1002220	1006220	比如說你抓了越久之後,原子就會逃出你的trap外面。
1006220	1010220	所以在這邊你可以看到,當剛抓住原子的時候,
1010220	1012220	這個decay的速度是很快的。
1012220	1015220	那你慢慢放久的時候,這個decay的速度就掉下來了。
1015220	1021220	那我們可以發現說,這的確是原子增加的時候,
1021220	1025220	可以增加它跟waveguide state的交互作用。
1025220	1033220	那也可以用一樣的方式做一樣的實驗,
1033220	1040220	但是這時候我們可以把這個waveguide的bandage調到原子的外面,
1040220	1043220	雖然原子的躍進頻率是在這個bandgap的裡面。
1043220	1048220	那這時候你就可以發現說,像這裡有兩個trace,
1048220	1052220	就是這個綠色的trace,就是描述說你的原子之間的,
1052220	1059220	應該說你描述這個photon decay到waveguide裡面的強度。
1059220	1064220	那這個藍色的trace,就是測量說原子之間的交互作用有多長。
1064220	1068220	那這個交互作用的強度呢,你可以根據你量出來的,
1068220	1071220	就是spectrum的,它是不是對稱來決定。
1071220	1074220	如果交互作用越強,那你的spectrum出來就不會是對稱。
1074220	1078220	所以這樣是可以間接的測量原子之間的交互作用有多強。
1078220	1083220	所以你發現說,如果原子的躍進頻率進入這個bandgap裡面的時候,
1083220	1088220	其實這個光子沒有decay到waveguide裡面,
1088220	1096220	但是原子之間的交互作用還是遠大於光子decay到waveguide裡面的機率。
1096220	1100220	所以這表示說,這個waveguide裡面,
1100220	1106220	在bandgap這個region裡面,原子的確是交互作用就是,
1106220	1112220	應該說光子在原子之外是形成一個spatial decay的cloud。
1117220	1125220	所以接下來,如果你可以把原子抓在waveguide裡面形成一串的話,
1125220	1133220	那你可以外加一個磁場,讓每個原子的zeeman state都在不一樣的門階。
1133220	1140220	那這時候你可以用一個外加的雷射光,然後增加一個sideband,
1140220	1147220	那這個sideband就可以match到原子之間的zeeman state的頻率的差。
1147220	1151220	那你就可以engineer兩兩任意原子之間的交互作用。
1151220	1156220	那比如說在這邊有一個系統,就是它抓了一個一維的原子array,
1156220	1160220	然後之間兩兩都有交互作用,再讓最右邊跟最左邊有交互作用。
1160220	1168220	就可以simulate一個圓圈的spin, which is the many-body fixed system。
1168220	1179220	可以回到上頁嗎?
1179220	1189220	我不是很懂你說兩兩交互作用為什麼會變成一個圈,它沒有頭尾最後那兩個交互作用。
1190220	1195220	應該說,比如說你要讓其中兩個原子產生交互作用的時候,
1195220	1201220	你就必須讓,你先看一下這個state,就是這個原子裡面它會有三個state,
1201220	1205220	它有兩個ground state跟一個excited state。
1205220	1210220	上面我知道,喔沒事我看到了,因為我的想法是說,
1210220	1215220	你不是都跟隔壁的產生交互作用嗎,怎麼會變成像是那種periodic boundary condition,
1215220	1219220	就是這樣變成一個圈圈,你有畫了,就是頭尾是有交互作用。
1219220	1223220	對,但是這個不一定只跟隔壁的發生交互作用,
1223220	1227220	其實它有沒有交互作用depend on你的guiding mode的頻率,
1227220	1233220	是不是跟你的另外一個state的頻率有resonance。
1233220	1239220	你可以想像說你可以加一個磁場,就是一個gradient磁場,
1239220	1245220	讓每一個原子的這個zeeman state都有一點點不一樣的頻率。
1245220	1249220	所以基本上你就是可以挑就對了,你不是一定要跟隔壁的產生交互作用。
1249220	1254220	對,你可以藉由外加的雷射的頻率來挑說你要哪兩個原子產生交互作用。
1254220	1257220	喔,OK,OK,I see。
1257220	1263220	你好,我可以請問一下嗎,這個跟gradient echo memory有沒有很像。
1263220	1266220	有點像spin echo。
1270220	1277220	就GM gradient echo memory它是一個慢慢增加的磁場,
1277220	1283220	然後形成每個位置的連接會有稍微的不一樣的spreading。
1283220	1286220	對,對,有點像這種。
1286220	1291220	那它們兩個的差別有沒有誰比較佔有優勢。
1293220	1299220	應該是說,其實我剛剛講說用一個健強的磁場來增加一個,
1299220	1302220	來產生一個difference,那你也不一定要用一個磁場,
1302220	1309220	你可以用AC source tree的方式來讓它每個state有不一樣的頻率。
1309220	1313220	所以這種情況下你就可以,不一定是要一個gradient,
1313220	1319220	你可以是每一個原子都可以有一個它專屬的一個雷射,
1319220	1325220	讓它產生不同的shift這樣子。
1325220	1327220	好,謝謝。
1332220	1338220	接下來會介紹一下我們實驗所用的alligator functional waveguide。
1340220	1346220	那這裡就是我們整個系統的樣子。
1346220	1353220	那首先這個整個系統是懸掛在這個chip中間的窗戶的上面。
1353220	1358220	那我們跟這個waveguide交互作用的方式主要是透過這個光線。
1358220	1361220	那這個光線是黏在這個chip的上面,
1361220	1365220	然後讓它可以跟這個waveguide couple在一起。
1365220	1369220	那可以看到這個waveguide上很多其他的結構,
1369220	1372220	比如說像這裡有一個coupler,
1372220	1378220	然後這邊有一些mechanical的structure是要拉住這個device,
1378220	1382220	讓中間這兩個並不會貼在一起。
1382220	1388220	所以這個角度是有經過automize,
1388220	1393220	讓你中間的final crystal可以有適當的張力,
1393220	1396220	可以維持中間的gap是一樣寬。
1396220	1403220	那另外這些結構就是負責把雷射經過的時候產生的熱給傳走。
1405220	1410220	你有沒有發現說即使你只輸入幾個microwave雷射的時候,
1410220	1415220	因為這個整個結構是很小的,所以它都會變得非常的熱。
1417220	1422220	那這是一個結構,這是device的SEM。
1423220	1428220	可是你們沒有做active cooling對不對?
1428220	1431220	你們就只是在光學桌上這樣?
1431220	1439220	對,其實我們還要加熱,因為我們沒有辦法冷卻它,
1439220	1443220	所以有時候你調它的頻率的方式是你把它加熱,
1443220	1449220	加熱之後它就可以改變它的bandage的地方。
1450220	1455220	所以你們不只是沒有這樣做,你們其實是不想要active cooling?
1455220	1462220	對,其實你要做也不是不行,只是我們沒有做active cooling。
1463220	1468220	而且其實太冷也有一個壞處,就是你冷的話你的seize也會黏到上面,
1468220	1472220	所以有時候你可能希望它越熱越好。
1473220	1482220	請問一下,你說的結構大概是幾百個nm,
1482220	1487220	然後你說你需要用fiber是不是因為這結構很小,
1487220	1493220	你需要用emanation wave進去跟原子作用?
1494220	1499220	對,因為最終你要把光送到這個way guide裡面,
1499220	1510220	所以說我們用的方式是把光纖黏到chip上面,
1510220	1512220	讓它跟這個way guide對齊。
1512220	1516220	其實一開始我也蠻驚訝的,你以為光纖很大,
1516220	1519220	然後這個way guide可能只有幾百nm那麼大,
1519220	1521220	你會以為它的mode沒有很match,
1521220	1524220	但如果你去算這個way guide的mode的話,
1524220	1527220	你會發現其實它跟光纖的mode有match到90%,
1527220	1536220	所以其實實際上大概有50%的光就可以真的去傳到這個way guide裡面。
1536220	1544220	那這個光從光纖出來是emanation wave嗎?
1544220	1548220	還是一個正常的波傳遞過去?
1549220	1552220	因為是single mode fiber,
1552220	1560220	所以它有點像是一個在光纖裡面蓋的mode,
1560220	1564220	它剛出來是直接對到這個way guide的mode上面,
1564220	1568220	所以只要它的mode是match的話就可以繼續在這個way guide裡面傳。
1569220	1572220	所以它不是emanation wave,
1572220	1574220	但它也不是完全是高纖維,
1574220	1578220	它是一個在way guide裡面傳的single mode的mode的樣子。
1578220	1580220	那個mode長什麼樣子,
1580220	1585220	depends on你的折射率的gradient是長什麼樣子。
1585220	1587220	好,謝謝。
1591220	1593220	那這個就是實驗的照片,
1593220	1596220	就是我們把光纖黏在chip上面,
1596220	1601220	然後把它mount到一個viewport上面,
1601220	1606220	之後再把整個viewport裝到真空的chamber裡面。
1609220	1616220	那我先稍微簡介一下這個CZM的energy level。
1616220	1620220	那這個CZM就是它的fine structure裡面,
1620220	1624220	我們主要就是用它的6s跟6p的state。
1624220	1626220	那6s的state是它的ground state,
1626220	1628220	那6p的state的fine structure,
1628220	1632220	是因為那個spin orbit coupling就會有兩個不同的能階。
1632220	1635220	那如果你在考慮到hyperfine structure的話,
1635220	1640220	那就是因為nuclear spin跟你的電子spin有交互作用,
1640220	1645220	它就會細分成,ground state細分成是fn3跟fn4兩個能階。
1645220	1653220	然後就是這個6p urban z-state也可以分成兩個能階,
1653220	1656220	然後接下來上面這個分成四個能階。
1656220	1663220	那一般而言把這個就是頻率比較高的這個transition,
1663220	1665220	頻率比較低的這個transition叫做D1,
1665220	1668220	然後比較高頻率的叫D2。
1668220	1676220	然後我們這個fine crystal waveguide的設計是讓D1對應到一個band edge,
1676220	1678220	然後D2對應到另外一個band edge。
1678220	1682220	那你可以想像一個比較簡單的想法就是說,
1682220	1685220	我們用一個band edge的頻率,
1685220	1690220	就是用D1來捕捉這個原子,
1690220	1692220	然後用另外一個頻率,
1692220	1694220	比如說用D2來trap這個原子。
1694220	1699220	所以比如說你把D2的雷射放到這個waveguide裡面,
1699220	1701220	然後讓它稍微有點blue detune的話,
1701220	1707220	因為在blue detune的情況下,原子就會被這個推到intensity minima的地方,
1707220	1710220	所以你看這個原子就會被trap到比較粗的地方。
1710220	1712220	那這時候你可以用另外一個edge,
1712220	1715220	只是用D1的頻率來probe它,
1715220	1717220	因為D1的頻率是另外一個band edge,
1717220	1720220	所以它的intensity會在這個粗的地方比較強。
1720220	1724220	那在這個情況下,你就可以用一個頻率來捕捉,
1724220	1726220	另外一個頻率來偵測這個原子。
1726220	1732220	那當然這是一個簡化的模型,
1732220	1736220	之後會稍微介紹下去,會有更多的細節在這裡面。
1742220	1743220	所以我們實驗的主要目的,
1743220	1747220	就是希望原子可以被捕捉在這個fine crystal gap裡面,
1747220	1750220	並且希望每一個size都可以捕捉到一顆原子。
1752220	1753220	那如果可以做到這件事情的話,
1753220	1757220	你可以想像可以把它推廣到一些更複雜的系統裡面,
