start	end	text
1757220	1760220	比如說二維的fine crystal。
1763220	1767220	那這裡我先簡介一些我們實驗上用到的,
1767220	1770220	比較基本的原子的冷卻跟捕捉的技巧。
1771220	1775220	我們先用到的方法主要就是有Moth,
1775220	1780220	還有Dipole Trap,特別是這個Optical Lattice,
1780220	1784220	還有一個冷卻的技巧叫Degenerate Raman Sidon Cooling。
1785220	1788220	那這個Moth呢,這是一個捕捉,
1788220	1790220	這是繞著原子團的一個方法,
1790220	1792220	那它就是你總共有六道雷射,
1792220	1794220	然後你可以把它想像說是在每個方向,
1794220	1797220	它都是有點像Doppler Cooling一樣,
1797220	1801220	只是它原子,就是往下面方向走的原子
1801220	1805220	就會被吸收一個光子,然後再重新放出它,
1805220	1807220	所以它會得到一個動量的kick,
1807220	1810220	所以它就會被冷卻。
1810220	1812220	那加這個磁場的目的呢,
1812220	1816220	就是希望就要引入一個空間dependent的shift,
1816220	1818220	讓你可以產生confinement,
1818220	1821220	所以你同時有了confinement又有了冷卻的話,
1821220	1823220	就可以做出一個Moth。
1827220	1830220	那另外一個方式,應該說另外一個概念,
1830220	1832220	就是這個Optical Dipole Trap,
1832220	1834220	那就是剛剛解釋過的說,
1834220	1836220	如果你的雷射的頻率,
1836220	1839220	就是略低於你的原子的躍進頻率的話,
1839220	1842220	那這時候它就會對你的能階產生一個shift,
1842220	1844220	所以在這種情況下,
1844220	1846220	你的ground state就會往下shift,
1846220	1848220	然後excited state就會往上shift,
1848220	1849220	所以你可以看到,
1849220	1851220	所以在ground state的原子,
1851220	1854220	它就會產生一個空間dependent的potential,
1854220	1857220	那這時候你的原子躍進的頻率也會改變,
1857220	1858220	所以這時候你可以,
1858220	1864220	之後我會講一下這個如何幫助我們去了解原子在空間中的什麼地方。
1865220	1867220	所以比如說,如果你的原子,
1867220	1870220	你的雷射的頻率略低於你的原子的躍進頻率的話,
1870220	1872220	就會產生一個,
1872220	1875220	呃,一個,呃,
1875220	1879220	原子就會被吸到你的intensity maxima的地方,
1879220	1881220	那如果你是Blue Detune的光的話,
1881220	1884220	原子就會被吹開intensity maxima,
1884220	1887220	所以如果你的potential裡面有intensity minima的話,
1887220	1889220	原子會被聚集在那個地方。
1891220	1893220	那這有不同的configuration,
1893220	1895220	最簡單的話就是一個Gaussian beam,
1895220	1897220	它就可以產生一個trap,
1897220	1901220	那我們在實驗室裡是利用兩道雷射形成一個standing wave,
1901220	1905220	那這時候原子就可以被捕捉在這個standing wave裡面,
1905220	1907220	那看起來好像是一個lattice一樣,
1907220	1909220	所以叫optical lattice。
1911220	1913220	那原子被抓到那個optical lattice裡面之後,
1913220	1915220	我們還是需要把它冷卻,
1915220	1919220	那冷卻的方式我們這裡用的是叫degenerate Raman-Seidman cooling,
1919220	1921220	那這是一個蠻巧妙的方式,
1921220	1924220	那它的方式就是你可以外加一個磁場,
1924220	1929220	讓原子不同的這個mf state產生一點,呃,能階的變化,
1929220	1933220	那如果你這個每個mf state之間的能量的差,
1933220	1938220	剛好等於你這個原子在你的optical lattice裡面,
1938220	1942220	震動的那個,呃,h-bar-omega能量的話,
1942220	1944220	那你可以看到就是這個,
1944220	1948220	這個under-1的這個震動的state,
1948220	1952220	跟隔壁這個mf state的under-0的state是在同一個能量的,
1952220	1955220	那這時候你可以利用這個Raman transition的方式,
1955220	1957220	把原子從這個n等於1,
1957220	1960220	然後把它transfer到這個under-0的state,
1960220	1962220	然後再把它pump回去,
1962220	1964220	所以它就是一個,這個經過這個cycle之後,
1964220	1967220	這個原子就會減少一個震動的框框,
1967220	1969220	所以一直重複這個過程,
1969220	1972220	理論上你可以把原子全部冷卻到你的這個,
1972220	1975220	呃,trap裡面震動的機態,
1975220	1977220	所以透過這種方式,
1977220	1981220	我們可以讓原子在這個optical lattice裡面達到一個滿冷的溫度。
1985220	1988220	那一旦你原子被trap到optical lattice裡面之後,
1988220	1992220	我們這裡實驗的方式就是把optical lattice移動,
1992220	1995220	就是你只要改變其中一個雷射的頻率,
1995220	1998220	你的整個interference的pattern就開始移動了。
1998220	2003220	所以我們可以用這種方式讓原子去經過我們的frontal crystal waveguide。
2003220	2005220	那這裡的目的是,
2005220	2010220	可能每一個這個optical lattice的intended minimum,
2010220	2012220	intended maximum的一片,
2012220	2013220	我們把它叫做一個pancake,
2013220	2017220	比如說裡面可能抓了500個原子,
2017220	2022220	那這個500個原子裡面可能只有少部分會跟frontal crystal waveguide產生互動,
2022220	2024220	但是我們一個實驗的cycle裡面,
2024220	2029220	可能就有2000個pancake經過這個frontal crystal waveguide。
2029220	2036220	所以透過這種方式就可以盡量讓更多原子跟frontal crystal waveguide產生互動。
2039220	2046220	那這是我們實驗的一個簡單的圖。
2046220	2052220	那首先我們就是把原子做一個MOD在這個source chamber裡面,
2052220	2057220	然後接下來我們用一個雷射把它踢到我們主要chamber裡面的另外一個MOD。
2057220	2061220	然後我們把原子再從MOD把它冷卻,
2061220	2063220	然後trap在optical lattice裡面。
2063220	2067220	那這個optical lattice是兩道雷射所構成的一個柱波。
2067220	2071220	然後一旦原子被抓到optical lattice裡面之後,
2071220	2073220	我們再改變其中一條雷射的頻率,
2073220	2077220	然後把原子全部送到這個device附近。
2077220	2079220	那這個原子在device附近的時候,
2079220	2082220	我們就可以放入幾道光到這個waveguide裡面。
2082220	2086220	比如說其中一條是一個probe laser,
2086220	2092220	那這個雷射就是調到d1的頻率,
2092220	2098220	那它就可以去,如果原子在frontal crystal waveguide附近的話,
2098220	2100220	它就會吸收這個probe的光。
2100220	2103220	那我們可以從這個probe,
2103220	2112220	透過這個waveguide的量來測量有多少原子跟waveguide的交互作用。
2112220	2119220	另外我們可以放入各種trap的potential在這個waveguide上面。
2119220	2122220	那另外一個很重要的component是說,
2122220	2125220	這個optical lattice在經過waveguide的時候,
2125220	2128220	會有一些光漏到這個waveguide裡面。
2128220	2133220	那我們也可以偵測到這個漏出來的optical lattice的光。
2133220	2138220	然後透過這個光可以知道這個optical lattice哪一部分現在正在經過waveguide,
2138220	2141220	主要可能是在波峰的地方在經過waveguide,
2141220	2144220	還是在波谷的地方正在經過waveguide。
2144220	2151220	所以透過這樣我們可以有更多的資料來了解原子在frontal crystal waveguide附近移動的過程。
2151220	2154220	所以這是一個實驗結果,
2154220	2158220	我們可以看到原子在T20的時候經過frontal crystal waveguide,
2158220	2160220	橫軸是時間,
2160220	2163220	縱軸是這個probe in的頻率。
2163220	2170220	那我們可以把probe in從-50MHz調到-50MHz的de-tuning,
2170220	2174220	然後原子在T20的時候經過waveguide。
2174220	2177220	這是其中一個photodial偵測到的資料。
2177220	2181220	那另外一個photodial是專門偵測漏出來optical lattice的光。
2181220	2183220	我們可以看到原子在經過的時候,
2183220	2187220	它就會產生一個periodic的信號。
2187220	2194220	那這個信號的頻率就取決於這個optical lattice經過frontal crystal waveguide的速度有多快。
2194220	2196220	所以比如說你看我們這裡,
2196220	2203220	那這個信號的頻率就取決於這個optical lattice經過frontal crystal waveguide的速度有多快。
2203220	2211220	所以比如說你看我們這邊是用差不多1.2MHz的頻率在移動這個optical lattice,
2211220	2215220	所以它跑出來的訊號就是1.2MHz。
2216220	2226220	那透過這個訊號我們可以知道什麼時間原子正在經過frontal crystal waveguide。
2226220	2230220	要特別注意一下這邊的時間的timescale是microsecond,
2230220	2234220	然後右邊這個圖的timescale是millisecond。
2234220	2237220	所以說在這個兩格的blob裡面,
2237220	2242220	直接就是有上千個optical lattice的pancake經過frontal crystal waveguide。
2248220	2255220	請問你們實驗上有辦法知道每一個位置都有原子嗎?
2255220	2258220	就是你們實驗上有測量嗎?
2258220	2264220	我們可以知道有多少原子在frontal crystal waveguide的附近。
2264220	2272220	所以現在任何一個時刻可能都會有1到2個原子經過frontal crystal waveguide。
2272220	2282220	然後我們實驗估計說每一個pancake差不多都會有一顆原子去經過frontal crystal waveguide的gap裡面,
2282220	2287220	就是我們真的想要去抓到原子的地方。
2287220	2291220	所以實驗的目的是為什麼要用optical lattice,
2291220	2293220	就是希望可以說得到一個cycle。
2293220	2298220	比如說你可以每一個pancake都抓到一個原子在這個gap裡面的話,
2298220	2302220	那如果100個pancake經過,你可能可以抓到100個原子。
2302220	2307220	所以這個實驗目的是希望可以找出一個trapping cycle,
2307220	2312220	讓你每一個optical lattice cycle都可以抓到一顆原子。
2312220	2314220	好,謝謝。
2314220	2317220	當然這個我們還沒有達到這個目標,
2317220	2322220	就是做了PHD研究就是往這個方向稍微前進了一點點。
2325220	2331220	我們剛剛看到說這個實驗的setup會產生一個這樣的實驗的結果。
2331220	2335220	那到底要怎麼去interpretate這個實驗結果呢?
2335220	2340220	那就是要透過一個模擬的輔助可以幫助我們了解說,
2340220	2345220	這些原子的軌跡如何對應到我們得到的實驗結果。
2346220	2349220	那首先這個模擬的軟體就是說,
2349220	2352220	它就是一個multicolor simulation,
2352220	2356220	就是原子被散佈在這個optical lattice裡面,
2356220	2360220	然後formalize之後再移動到phonic crystal 微蓋的附近。
2360220	2365220	然後根據這些optical dipole potential讓每個原子移動,
2365220	2368220	然後最後收集這些軌跡,
2368220	2371220	然後透過這些軌跡來算出我們應該得到的spectrum。
2372220	2376220	那這個模擬本身其實概念上面很複雜,
2376220	2380220	但是在實作上面就會有一些挑戰。
2380220	2385220	那主要就是因為那是一個periodic potential,
2385220	2389220	而且是你要希望可以量一個很大的範圍,
2389220	2392220	讓你的原子可以在這個potential裡面formalize。
2392220	2398220	所以像我們的simulation domain大概是幾十個micron平方的範圍。
2398220	2401220	那但是這個phonic crystal是一個很小的device,
2401220	2406220	它的大小是幾百個nm到一個micron的範圍的大小,
2406220	2411220	所以整個實驗是非常memory intense,
2411220	2413220	所以很大部分是optimize,
2413220	2415220	它盡量用越少的記憶體越好。
2415220	2420220	那這個模擬的概念是讓原子從很遠的地方,
2420220	2424220	模擬它如何移動到phonic crystal微蓋的附近,
2425220	2433220	然後再模擬各種optical dipole force跟probing的bin profile,
2433220	2437220	然後計算出你會得到的spectrum。
2437220	2441220	然後也可以做3D的模擬。
2441220	2444220	那比如說這是一個模擬的結果,
2444220	2447220	那這裡可以看到這些線是原子的軌跡,
2447220	2454220	那這個原子的軌跡我們可以把它細分成一些不同類別的軌跡,
2454220	2459220	比如說這些綠色的軌跡是它進入了這個模擬crystal微蓋的gap裡面,
2459220	2461220	那這些是我們最有興趣的原子。
2461220	2465220	那另外一些藍色的軌跡是它繞到device的外面,
2465220	2468220	然後紅色是它撞到device的表面。
2469220	2477220	那所以接下來我們就要利用這些軌跡來計算出一個spectrum。
2477220	2480220	那如何計算這個spectrum呢?
2480220	2487220	你可以把原子的軌跡把它distribute到這個一維的微蓋上面,
2487220	2489220	比如說這裡就放了幾個原子,
2489220	2494220	然後每一個微蓋segment你可以把它用一個matrix來表示,
2494220	2497220	那這個matrix就是它的transfer matrix,
2497220	2499220	比如說微蓋有自己的transfer matrix,
2499220	2502220	然後每個原子也有自己的transfer matrix。
2502220	2508220	那這個原子的transfer matrix取決於它所在的位置,
2508220	2511220	那我們可以看到,比如說你可以放一個,
2511220	2518220	就是這個γ1d是被probe的強度,在那個位置的強度來決定,
2518220	2525220	所以原子在微蓋附近的距離就是決定了γ1d的強度,
2525220	2528220	所以每個原子的transfer matrix都是不一樣的。
2528220	2533220	那把這些所有matrix乘起來就可以得到一個total transfer matrix,
2533220	2538220	然後從那邊就可以得出整個系統的transmittance跟reflection。
2542220	2545220	那接下來看模擬會有什麼結果。
2546220	2553220	所以說我剛剛解釋一下如何透過模擬來得出這些原子的軌跡,
2553220	2561220	那接下來要講解說如何透過這個模擬來連結我們實驗的結果。
2565220	2569220	那我們這裡要介紹一個我們使用的工具,
2569220	2571220	我們把它稱之為clock spectrum,
2571220	2572220	那為什麼叫clock呢?
2572220	2575220	是因為我們alpha lattice把原子送到這個device附近,
2575220	2580220	所以這個原子是週期性的被送到這個final crystal的附近。
2580220	2584220	所以比如說你的chirping的頻率如果是1MHz的話,
2584220	2586220	那每一個micron都會有一波原子經過。
2586220	2590220	所以理論上你可以得到一個週期性的信號,
2590220	2596220	那個週期性的信號就是取決於你的原子來到你的device的頻率。
2596220	2602220	所以比如說我們看這個probe出來的光子的話,
2602220	2603220	把它做成histogram,
2603220	2609220	就可以發現說以這個alpha lattice做的頻率而言,
2609220	2611220	它就是一個週期性的信號。
2611220	2613220	而且我剛剛也講過了,
2613220	2616220	我們可以透過另外一個photodial來偵測,
2616220	2618220	露出來的alpha lattice的信號。
2618220	2621220	所以那個就給我們一個鐘,
2621220	2628220	讓我們可以知道現在是alpha lattice哪一個部分正在經過我們的waveguide。
2628220	2640220	所以如果你把整個幾ms的信號全部摺疊到一個alpha lattice period裡面的話,
2640220	2641220	就可以得到一個histogram。
2641220	2644220	那這個histogram就告訴你說,
2644220	2647220	在alpha lattice的頻率裡面的不同的時間,
2647220	2653220	這個整個device的transmittance有多少。
2653220	2659220	那這個就告訴你說有多少原子正在跟這個device產生交互作用。
2659220	2664220	那如果你對每一個detuning都做這個實驗的話,
2664220	2667220	你可以得到一個二維的spectrum。
2667220	2669220	所以看這個二維的圖裡面,
2669220	2671220	橫軸的是時間,
2671220	2674220	那這裡是1.2us,
2674220	2678220	然後縱軸是你的probe的detuning。
2678220	2685220	所以這個二維的spectrum可以蘊含一些原子在photocrystal waveguide附近移動的資訊。
2685220	2692220	所以接下來的工作就是要如何把原子的軌跡對應到這個二維的spectrum上面。
2692220	2700220	那我們這裡實驗的方式就是有一些不同的mode。
2700220	2706220	那像剛剛講過的就是我們讓這個bandage對應到C-D1跟D2的transition。
2706220	2710220	那還有另外一個mode是另外一個polarization。
2710220	2717220	像我剛剛講的bandage是針對於當你的polarization是跟這個waveguide平行的時候,
2717220	2721220	那如果垂直的時候它就會有另外一組bandgap。
2721220	2725220	但是這個bandgap是遠離於C-D1跟D2的頻率的。
2725220	2734220	所以說對於這個偏振而言,這個C-D1跟D2的頻率在上面就好像是一個普通waveguide一樣。
2734220	2741220	所以這裡可以看到這個TE mode,就是D1跟D2是bandage這個mode。
2741220	2747220	在D1跟D2的頻率就是有很明顯的,在X方向有很明顯的結構。
2747220	2755220	比如說D2,intensity就是集中在細的部位,D1的話intensity是集中在粗的部位。
2755220	2762220	我們主要是用這兩個mode來進行probing跟捕捉原子的一個功能。
2762220	2769220	然後TM mode的話,你可以看到在這個沿著waveguide的方向,它幾乎就是均勻的強度。
2769220	2775220	因為在這個頻率的時候,因為C-D1跟D2的頻率是遠離於TM bandgap的。
2775220	2784220	所以說在C-D1跟D2的頻率,在這個mode裡面,fine crystal waveguide就好像是一個正常的waveguide一樣。
2784220	2791220	然後這個mode比較不一樣的地方是,它的強度是在waveguide的上面跟下面是最強的。
2791220	2797220	所以它有一個很有用的特性,你可以幫助我們去保護我們Device的表面。
2797220	2803220	如果你讓它是Bloody chain的話,它就可以把靠近的原子給彈走,讓它不會去黏在Device的表面。
2803220	2814220	同時它還可以在Gap裡面跟Gap外面產生一個很大的Ace structure,讓我們可以偵測多少原子是經過了這個Gap的中間。
2816220	2822220	那這是一個細節,剛剛我們講說用一個mode來做trapping,其實是一個簡化。
2822220	2827220	其實我們需要把兩個mode來結合才能產生一個在三維上都是穩定的trap。
2828220	2843220	那接下來我們有一個有趣的挑戰,我們發現說要產生一個trap,你的兩個mode的能量必須有一個ratio。
2843220	2848220	如果沒有這個ratio外面的話,這個trap就不會是一個穩定的trap了。
2848220	2855220	但是有一個困難就是說,不同的頻率coupled到waveguide裡面的強度是不一樣的。
2855220	2860220	所以我們沒有辦法直接的測量說到底有多少光是在waveguide裡面。
2860220	2865220	所以我們到底要如何去知道兩個mode的強度的ratio有多少呢?
2865220	2874220	那這時候透過連接你的實驗結果跟模擬的結果,就可以去知道說在waveguide裡面的光到底有多強。
2876220	2879220	那另外一個實驗的目的就是告訴我們timing。
2879220	2888220	就是這裡有一個原子,這是一個trapping的方式,原子進來waveguide中間的時候,它是在譬如說在efference4的state。
2888220	2894220	那在原子中間的時候,我們在正確的時間把它pump到excited state,然後讓它decay到ground state的話,
2894220	2903220	可以看到它從一個比較淺的potential,然後被pump到一個比較深的potential裡面,這時候原子就可以被抓住了。
2903220	2910220	不然的話它就會進來然後又出去,因為這是一個有點類似於一個conservative potential。
2910220	2918220	那要得到這種結果,就是我們必須要知道原子經過這個gap的時間。
2918220	2926220	所以同樣的模擬可以告訴我們說,它到底應該在什麼時間會經過fine crystal waveguide的gap裡面。
2926220	2941220	那問一個問題,就是你的模擬有包含干擾嗎?
2941220	2952220	比如說environmental thermal radiation這些東西,或是各種你,因為我不知道你dominant的背景干擾是什麼,是什麼然後有嗎?有包含嗎?
2952220	2967220	因為這個thermal radiation相比於我們其他的mode,比如說我們這個alpha lattice的強度就是幾百個mW,
2967220	2977220	然後裡面guided mode停留的是幾個μW,所以他們的intensity遠大於這個thermal radiation,所以我們是不用考慮thermal radiation。
2977220	2981220	那有其他的干擾是已知的然後需要考慮的嗎?
2982220	2994220	有一個應該不能把它歸類為干擾吧,這是一個很大的因素,就是Casper-Poller force,原子在很接近這個,會有一個吸引力。
2994220	2998220	那個吸引力就是如果你不考慮的話,結果就會差蠻多的。
2998220	3007220	所以這是一個一開始沒有想到,但是事後發現會有很重要影響的一個因素。
3008220	3011220	了解,謝謝。
3011220	3022220	那有一些干擾因素,比如說device的震動,我們會想說它是懸掛的一個有點像一個線,所以它如果熱起來可能會震動。
3022220	3035220	那我們有測量它的震動頻率,然後發現是遠大於原子在trap裡面震動的頻率,所以那可以暫時不用考慮。
3037220	3047220	OK,那我們這裡可以解釋一下如何去calibrate這三個不同的mode。
3047220	3055220	那我想先介紹比較簡單的問題是如何去calibrate opical lattice beam。
3055220	3061220	那這其實也不是calibrate,因為我們已經知道了opical lattice beam有多強,所以只是驗證一下這是一個可行的方式。
3061220	3071220	那這是一個模擬的結果,那這裡的原子的density是遠大於真實的density,只是真實的density大概只有這個十分之一。
3071220	3078220	那這個模擬的結果可以讓我們了解一下原子在device附近是怎麼移動的。
3078220	3086220	那在這個模擬裡面呢,有用到的ponential是兩個opical lattice,跟我剛剛提到的cathodic polar force。
3086220	3094220	原子在很接近divergence的時候會受到一個吸引力,那這個吸引力就是周圍這一圈藍色的ponential。
3094220	3099220	所以其實它是一個非常強的ponential。
3099220	3107220	那像右邊我們就可以看到模擬出來的cathodic spectrum。
3108220	3115220	那我們可以像原子在,因為原子是在opical lattice帶來的,所以它們是一條一條來的。
3115220	3122220	可以想像像那一條經過final crystal way guide的時候就會造成最大的吸收。
3122220	3130220	然後它並不是在zero detuning,因為opical lattice是red detuning,所以它會帶來一個blue detuning。
3131220	3141220	像前面也講到opical double trap的時候,會提到說red detuning的ponential會讓你的ground state降低,但是你的excited state變高。
3141220	3149220	所以說整體的躍進頻率也會變大,所以可以看到這些原子的transition的頻率變成是一個正的detuning。
3149220	3158220	那這裡可以看到一坨是往下的,這一坨是因為cathodic polar ponential帶來的一個現象。
3158220	3173220	那你會想說剛剛cathodic polar告訴你的也是一個吸引力的ponential,如果excited state不變的話,它應該會讓你的躍進頻率也變大,那這裡怎麼會是red detuning呢?
3173220	3178220	原因是因為cathodic polar ponential影響到你excited state。
3178220	3187220	那對於CZM我們用的這個D1 transition而言,它造成的excited state的變化其實是ground state的兩倍。
3187220	3196220	所以它excited state其實是降低的程度是比ground state降低的程度還要多兩倍,所以實際上躍進頻率是變小的。
3196220	3202220	所以在受到cathodic polar的影響下,它反而會變成是反而detuning是負的。
3202220	3214220	那我們可以看到左邊的是實驗的結果,所以發現兩者其實還蠻match的,而且在detuning的大小是一樣的,所以這表示說我們模擬的parameter跟實驗是一致的。
3217220	3224220	那這時候可以來量一些我們不知道的東西,比如說我們可以來量一個TM的guided mode的強度。
3225220	3229220	那這裡是加了這個TM guided mode的一個模擬。
3229220	3236220	那這個TM guided mode是blue retuning,所以它在waveguide的上面跟下面會產生一個排斥的ponential。
3236220	3246220	所以可以看到原子是被這個排斥的ponential給彈走,同時還改變了進入這些gap的原子軌跡。
3246220	3259220	所以右邊這個圖就是模擬跟實驗的比較。
3259220	3266220	那我們可以看到二維三維的模擬其實非常類似,所以它們的差別就不細講了。
3266220	3269220	不過可以看到模擬跟實驗也是非常的接近。
3269220	3276220	那我們可以看到增加這個ponential之後,它就造成了一些對於這個二維的crossband產生的一些影響。
3276220	3282220	那最大的影響就是你可以看到它產生了一個往下降的feature。
3282220	3293220	那這個feature就是原子在爬這個ponential被彈走的時候,隨時間不同會看到不同的ponential造成的。
3294220	3307220	那這時候我們就可以match我們實驗放進來的光的能量跟模擬的來做個對比。
3307220	3314220	那我們可以發現說模擬的光的強度是比實際上少的。
3314220	3321220	那這是因為這裡實驗測量到的光的強度是在我們放電fiber裡面的光的強度。
3321220	3325220	那真的couple到這個waveguide裡面的強度其實是比這還要小不少的。
3325220	3333220	所以經過這樣的方式我們可以估計出來差不多fiber coupling的efficiency是30%左右。
3333220	3340220	那這個efficiency跟用別的方式測量出來的結果是一致的。
3340220	3348220	所以用這種方式我們就可以直接在device裡面測量出我們放進該類模擬的強度。
3352220	3357220	那這些feature它都各別對應到什麼樣的軌跡呢?
3357220	3364220	我們可以看到這裡藍色的feature對應到右邊藍色的軌跡。
