start	end	text
3364220	3371220	所以它們是繞過device外面的,所以它們看到比較少的該類模擬,所以它們沒有受到太大的acceleration。
3371220	3384220	然後這些往上爬的軌跡也是看到這個藍色的該類模擬,所以它看到一個越來越強的radiation值,所以它的月圈頻率就會越來越低。
3384220	3394220	那最後這些穿過中間的會看到在中間這個gap裡面的acceleration,所以它們對應到這些綠色的結果。
3395220	3404220	我們可以看到我們可以用這種方式來知道這些原子團經過device附近的時間還有它們的位置。
3404220	3411220	我們大概有100ns的time resolution跟50ns的空間resolution。
3414220	3422220	那我們可以用同樣的方式來做TMO,我們可以看到也是match的相當的不錯。
3422220	3430220	但是比較意思的時候,就是我們發現說在device裡面的能量的強度是比我們放進實驗裡的還要多的。
3430220	3439220	但是這其實並不意外,就是因為我們用的是TMO,那TMO是在這個D1、D2是在band edge上面。
3439220	3450220	所以在band edge的時候,因為它的groove velocity變得很小,所以它其實這個光輝在裡面的強度是會被hence的。
3450220	3456220	所以其實在ray guide裡面的光的強度是大於在放進去的。
3456220	3460220	這是告訴我們的確是有這個slow light effect。
3464220	3472220	那像剛剛講的就是這個不同類別的trajectory,我們可以在模擬裡面把它分離出來,
3472220	3477220	就是看它們個別對於這個box vector有什麼貢獻。
3477220	3485220	比如說這個是在中間的原子造成的貢獻,跟在外圍原子的貢獻,跟這些藍色其他原子的貢獻。
3485220	3492220	所以這個很重要的功能就是告訴我們說真的有沒有原子去經過這個gap裡面。
3492220	3497220	因為這是我們希望去捕捉的原子,所以我們希望了解說是不是真的有原子會經過這個gap。
3497220	3505220	那我們可以發現說,像如果我們在這個時間取一個cut的話,你會發現說它有兩個dip。
3505220	3513220	那在這個模擬裡面就告訴我們說,其中一個dip主要是來自於中間原子的貢獻,然後另外一個dip是其他原子的貢獻。
3513220	3518220	所以說像我們剛剛在實驗裡面也可以觀察說,在這個時間出現這兩個dip,
3518220	3524220	所以可以告訴我們說的確是有原子去經過中間這個final crystal的gap。
3524220	3533220	然後藉由比較它跟模擬的結果,我們可以差不多估計說每一個pancake就會有1到2個原子經過這個gap。
3533220	3542220	同時這個模擬也告訴我們說,應該在什麼時間去把這個原子pump到比較深的trap裡面。
3542220	3547220	然後它這個dip的位置呢,告訴我們那邊的AC structure,
3547220	3554220	所以告訴我們說應該要什麼樣頻率的雷射去把這個原子pump到比較深的trap。
3554220	3562220	所以透過比較這個模擬的實驗,第一點我們可以去calibrate我們的guided mode的強度,
3562220	3564220	讓我們造出我們想要的trap。
3564220	3567220	然後第二點是它告訴我們什麼時機去pump原子。
3567220	3573220	然後它還告訴我們是怎樣的detuning,用什麼detuning去把原子pump到trap裡面。
3573220	3584220	那最後就是講一下這個比較意外的結果,就是我們可以去probe說這個Casper polar force有多強。
3584220	3590220	所以比如說這裡有兩個模擬,右邊就是沒有Casper polar force,左邊是有Casper polar force。
3590220	3596220	我們發現說它們差別在於說這邊有沒有一個往下墜的一個feature。
3597220	3606220	那我發現說在實驗室確實有出現這個feature,那透過比較這兩個feature,就是fit這兩個feature,
3606220	3616220	我們也可以去得出這個Casper polar potential,然後得到這個potential的coefficient跟文獻提到的是一致的。
3616220	3630220	好,那我們最後講一下這個離開之後,應該說離開的時候實驗室進行的一些新的研究。
3630220	3638220	那這個一個新的方式,我們剛剛看到說要把這個chip放到真空腔裡面其實是非常麻煩的。
3638220	3648220	因為你要黏16個fiber,然後把它再mount到這個viewport,再把它放到chamber裡面,那通常都會花掉我們兩整天的時間。
3648220	3659220	那現在新一代的實驗室不需要光纖,你可以直接用眼尾鏡的objective把雷射focus到這個coupler上面,
3659220	3670220	就可以直接從真空腔外面couple到這個waveguide裡面,就可以大大減低更換chip所需要的時間,
3670220	3678220	也提供我們更多的optical access,讓我們可以放更多的beam,有更近距離的觀察。
3679220	3686220	另外一個方式是,我們可以不用optical lattice改用optical tweezer。
3686220	3696220	optical lattice的好處是,它短時間內給我們很多的原子,就是它短時間內讓很多原子經過這個device附近,
3696220	3702220	可以提供我們很多的sample size,可以去extract剛剛我提到的那些資訊。
3702220	3707220	但是如果你想要更fine-tune你的原子的位置的話,其實你可以用optical tweezer,
3707220	3715220	那你可以把原子在一維的waveguide上面做一些比較細微的控制,
3715220	3721220	這樣可以更直接去probe兩個原子之間交互動的強度。
3723220	3729220	這是在二維market crystal上的一些應用的構想。
3730220	3739220	這是今天演講的一個總結,首先我講了為什麼我們要做strong atom-photon interaction,
3739220	3745220	然後我解釋一下我們是如何把原子傳送到fine-tune waveguide附近。
3745220	3752220	接下來我介紹一個numerical simulation,模擬這些原子的trajectory,
3752220	3757220	然後從這些trajectory算出一個二維的spectrum。
3757220	3762220	最後我比較了實驗的spectrum跟模擬的spectrum,看到說它提供了一些用途,
3762220	3766220	它可以幫助我們去調整guided mode的強度,
3766220	3770220	然後去了解原子在waveguide附近的行為,
3770220	3776220	然後幫助我們了解要用什麼時間跟怎樣的tuning去把原子pump到trap裡面去。
3776220	3782220	最後它也可以幫助我們去了解back and forth,
3782220	3787220	以及原子在fine-tune waveguide附近所受到的吸引力的強度。
3787220	3789220	謝謝大家。
3793220	3799220	我們先要鼓掌感謝我們今天的講者,但是還是一樣,提醒大家把麥克風打開,我們這樣子才聽得到大家的掌聲。
3799220	3804220	謝謝大家,不是,抱歉,謝謝彭路給我們帶來精彩的演講。
3804220	3817220	好,我們接下來要進行發問了,但是在大家發問之前,我們先來廣告一下好了。
3817220	3825220	就是如果大家支持project TARA在做的事情,支持我們的理念,支持我們推廣台灣在海外的學者,
3825220	3830220	大家彼此分享彼此研究的成果,我們也歡迎大家加入project TARA當會員,
3830220	3835220	而不是只是follow我們的facebook,然後看我們的每個禮拜的po文這樣子。
3835220	3842220	加入的方法大家可以在facebook的po文上找到,我們其實也很歡迎,
3842220	3848220	而且我們其實也需要大家來主動的分享,如果大家有有趣的研究的發展和結果,
3848220	3855220	報名來給演講的方式也可以在我們facebook上,還有我們網頁上的資訊找到。
3856220	3860220	好,那我們現在開始進行那個Q&A,大家有問題嗎?
3860220	3877220	我有問題,請問你上面說的就是用optical lattice去deliver你的原子,是deliver到photonic crystal上面去嗎?
3878220	3889220	最終的目的是希望可以把它deliver到兩個photonic crystal的gap裡面,並且讓原子留在這個gap裡面。
3889220	3892220	那目前的方式是?
3892220	3902220	你的lattice的間隔有辦法那麼容易的控制到跟你的crystal的間隔是嗎?
3903220	3910220	就是其實這個optical lattice的,它是兩個Gaussian beam,應該說是兩道Gaussian beam構成的,
3910220	3916220	那我們把這個photonic crystal waveguide放在這個Gaussian beam的位置上面,
3916220	3924220	那我們用的optical lattice的這個beam的位置大概就是60micron,
3924220	3936220	那你看這個device的大小大概是一點多micron,所以其實大部分的原子並沒有經過這個photonic crystal waveguide的附近,
3936220	3943220	但是在每一個pan可以經過的時候總會有幾十個會出現在這個waveguide的附近,
3943220	3948220	然後在那幾十個中間可能又有一兩顆會跑到這個gap裡面去。
3948220	3952220	我以為它是可以一對一的送上去。
3952220	3961220	這很難,因為你看這個gap的大小是200nm,所以首先你的波長都沒那麼小,
3961220	3968220	第二點就算你可以focus到一個波長的大小,你的right light lamp就會變很小,
3968220	3976220	所以就沒辦法像我們剛剛從那麼大的一個mod load到這個operator裡面,
3976220	3983220	像我們load完之後我們整個原子雲大概有2mm那麼大,所以我們一次送過去才可以有幾千個pan可以,
3983220	3991220	那如果你把光focus到這麼小的話,其實有點像剛剛提到這個optical tracer的方式,
3991220	3997220	這個optical tracer就是focus到波長的大小,但是相對的原因就只能trap一顆原子,
3997220	4000220	然後把這個原子放到附近去。
4000220	4005220	它有它的好處,但它的難度是在於說你要真的抓到一顆原子,
4005220	4010220	並且再把原子移到fine crystal wave蓋上的時候,那個原子都不能夠丟掉。
4010220	4013220	所以也是有它的難度在。
4016220	4018220	好的,謝謝。
4020220	4023220	我有個問題,我想要請問說,
4023220	4029220	你說你們實驗目的就是你們希望最後可以實現strong metal light interaction嗎?
4029220	4033220	我想說,你們比較長遠的目標是,
4033220	4038220	當你們實現strong interaction的時候,你們想要用它來做什麼?
4038220	4040220	對,就是,
4060220	4068220	其實最主要的目的是希望這個可以成為一個模擬many-body physics的一個系統。
4068220	4076220	那除了這裡貼的這張就是可以做一個這種quantum magnetism simulation以外,
4076220	4080220	還有一個蠻有意思的實驗就是說你可以,
4080220	4085220	比如說你現在一般的cavity QED就是你的鏡子,這是一個很大的classical object。
4085220	4087220	那你可以想像說,
4087220	4091220	比如說你抓了五顆原子,然後中間隔幾個side,
4091220	4095220	然後中間又抓一個原子,然後空幾個side,又抓了五顆原子。
4095220	4099220	那你左右那五顆原子就好像是一個black mirror一樣。
4099220	4106220	所以就表示你的原子跟你的鏡子本身都是一個quantum object,
4106220	4108220	這就是一個很有意思的。
4109220	4111220	所以你可以,
4111220	4116220	就是,然後透過剛剛講的這種你可以兩兩產生這個,
4116220	4122220	兩兩產生這個,兩兩產生pairwise Hamiltonian的方式,
4122220	4126220	你就可以做出各種各樣的quantum simulation。
4127220	4131220	然後還有一個有意思,剛剛沒有提到的一個應用就是說,
4131220	4135220	這個有一個跟一般的way guide QED不同的地方在於說,
4135220	4138220	因為它是有一個dielectric structure,
4138220	4140220	然後這個dielectric structure是讓你的,
4140220	4145220	就是強迫你的這個光的intensity是黏在這個structure上面。
4145220	4152220	所以你可以讓你的原子之間的距離是比free space的波長還要小。
4152220	4154220	那這時候就有一個有意思的現象就是說,
4154220	4160220	你這些原子radiate到free space裡面的光其實是彼此干涉掉了。
4160220	4164220	所以這時候你可以大幅降低他們spontaneous emission的強度。
4164220	4171220	所以這是一個一般的way guide QED沒有辦法做到的一個事情。
4177220	4183220	所以像剛剛,如果你能夠大幅suppress你decay到free space的頻率的話,
4183220	4187220	你可以想像說這可以做成一個quantum memory的system。
4187220	4193220	還有問題嗎,大家?如果沒有問題的話,我問一個問題。
4193220	4197220	那個你可以跳到那個Casimir force那一頁嗎?
4207220	4210220	你可以再解釋一下這一頁你想要表達,
4210220	4212220	就是你想要傳達的那個point是什麼?
4212220	4217220	對,就是一開始模擬的時候沒有加這個Casimir force這一項。
4217220	4220220	所以你可以看到說,我們就想說,
4220220	4226220	我們這個模擬是最簡單的一個情況,
4226220	4228220	就是我們什麼guidemode都沒有加,
4228220	4230220	就是只有probe跟alpha lattice。
4230220	4232220	然後這個alpha lattice是ready tuned嘛,
4232220	4235220	所以想說整個系統裡面的光都是ready tuned,
4235220	4239220	所以我們看到的原子應該全部的月星頻率都會,
4239220	4244220	應該說我們的probe的月星頻率都要是正的才能看到這個原子。
4244220	4249220	但實際上我們發現說,都會出現這個往下掉的這個feature。
4249220	4252220	那之後發現說,其實這個就是Casimir polar force。
4252220	4255220	那Casimir polar force它算是一個吸引力,
4255220	4258220	那它造成了excited state的這個quantum memory,
4258220	4261220	那這個quantum memory它算是一個吸引力,
4261220	4264220	那Casimir polar force它算是一個吸引力,
4264220	4268220	那它造成了excited state的往下shift的量是比ground state要多的,
4268220	4271220	所以其實它造成的是一個,
4271220	4273220	它會讓你月星頻率是降低的,
4273220	4277220	所以你看到的是一個redshift的一個頻率。
4277220	4282220	然後同時它CNN也看到一樣的現象。
4282220	4285220	那如果我這樣問呢,就是說,
4285220	4288220	如果你就是說,你不加Casimir force,
4288220	4291220	然後你simulation的resolution當然很高嘛,
4291220	4294220	然後你比較你這個experimental data,
4294220	4298220	它有多大的inconsistence。
4298220	4302220	你就是說,比如說我們不知道Casimir polar coefficient有多強,
4302220	4305220	可以透過這種方式來把它extract出來。
4305220	4309220	對,我對這個很有興趣。
4309220	4312220	對,這是,我們可以得到一個數量級,
4312220	4314220	但它很難量到很接近。
4314220	4316220	有一個原因是因為,
4316220	4318220	excited polar其實是,
4318220	4320220	它對於,
4320220	4322220	就是它的potential,
4322220	4325220	就是跟這個原子跟dialytic的距離是
4325220	4327220	z3的,
4327220	4332220	1 over z3這樣子的一個dependent。
4332220	4334220	所以它是一個,
4334220	4337220	應該說一個降得很快的potential。
4337220	4339220	所以原子越接近的時候,
4339220	4341220	它就跑得越快。
4341220	4344220	它真的跟很深的地方交互作用的時間是很短的。
4344220	4347220	所以你看到我們量到這裡的shift差不多是
4347220	4352220	-20MHz,
4352220	4354220	對應到差不多是1mK.
4354220	4356220	所以你看到它其實在,
4356220	4360220	有點忘了這距離多少,可能是幾十,
4360220	4365220	幾十nm外面的時候其實已經幾乎都被吸掉了。
4365220	4367220	所以我們可以match,
4367220	4369220	match個大概,但是
4369220	4371220	如果你要match到很準確的話,
4371220	4373220	其實就是很難用這種方式來量。
4375220	4377220	-你這個東西有publish嗎?
4377220	4379220	我可以拿你找到的detail嗎?
4379220	4383220	有,我們有PNAS的一篇paper,
4383220	4385220	裡面有提到這個事情。
4385220	4387220	-那你之後可以傳給我一個連結或什麼。
4387220	4391220	OK啊,不過我們並不是真的,
4391220	4393220	應該說pair目的不是在量這個,所以。
4393220	4396220	-我知道,我的想法是這樣,
4396220	4399220	就是我認為這個東西你可以有,
4399220	4402220	有一個potential可以optimize to,
4402220	4404220	you know, Casimir force detector,
4404220	4406220	但是顯然這個東西它的目的不是這樣,
4406220	4408220	所以看起來似乎有機會,
4408220	4410220	但是因為我對量Casimir force,
4410220	4412220	couple to new physics蠻有興趣的。
4412220	4414220	我記得好像有篇paper它是,
4414220	4416220	用那個Evanescent field,
4416220	4418220	它用藍色Evanescent field,
4418220	4420220	讓原子去跟這個平衡,
4420220	4422220	然後就可以透過這種方式來量,
4422220	4424220	量那個Casimir force。
4424220	4426220	其實有點累,
4426220	4428220	因為我們這個device沒辦法設計,
4428220	4430220	讓它跟它平衡到一個穩定的trap,
4430220	4432220	所以我們沒有辦法停住,
4432220	4434220	它是經過的時候,
4434220	4436220	順便有這個potential,
4436220	4438220	我們可以看到它對它的影響。
4438220	4440220	-OK,我覺得這很酷,我們之後再討論。
4440220	4444220	好,那大家還有問題嗎?
4446220	4448220	如果沒有問題的話,
4448220	4450220	大家把麥克風打開吧,
4450220	4452220	我們再次鼓掌,
4452220	4454220	謝謝彭路為我們帶來今天的演講。
