start	end	text
1873000	1890000	那這個其實,那我還要強調一點就是,不能搞混所謂的convergence rate,就是所謂的order,然後不能把它跟accuracy搞混,因為order這個東西只是定義你誤差變小的速度多快而已,但不代表說它給你的誤差非常小。
1891000	1908000	那accuracy則是說,我今天給你的誤差非常非常小,但不代表說我element數量加倍之後,它誤差真的會變得更小,甚至有可能你10個element給你這樣的誤差,你double成20個element之後,你的誤差反而變大了。
1908000	1912000	所以accuracy跟order是不能搞混。
1939000	1951000	那事實上,你用到3、4、5、6、7、8、9,都不會再有更多的improvement,因為它的critical,就它已經完美描述了這個問題了嘛。
1953000	1959000	因為你之後所有的coefficient都會是0,可是那這樣子的情況,不就是case by case嗎?
1959000	1988000	對,所以你這樣講沒有錯,但是我們沒有辦法知道真實界到底是什麼,因為今天我這個是一個例子,所以我用一個三次方程式去畫它,但是真實世界你不知道它是三次方程式,所以你當然只能用越來越多的order去看它到底長什麼樣。
1990000	2012000	你意思是說,自然界真正的signal可能你弄到五次方可以描述某一些性質,然後可能你弄到十次方之後,它開始可以描述某另外一種的perturbation,然後十五次方可以描述某一種noise,它會不斷地描述更小的signal這樣嗎?
2013000	2032000	不是我在講的是,我想講的就是,我今天在建立這個UJ,它到底該用幾項的時候,它的確是case by case,因為我不知道真實的界到底長什麼樣子,所以我也沒辦法知道說我到底該用幾項,UJ裡面該用幾項。
2033000	2056000	我能做的就是,譬如說我剛剛做的同樣六個element,我先假設它是C0加C1x,就只是這樣,然後看它誤差是多少,然後我今天做第二次計算的時候,我再加上一項加上C2x平方,然後看它誤差是多少,然後看它收斂會不會差異越來越小。
2056000	2083000	譬如說如果我今天用三項,像現在我投影片上三項的話,如果誤差是十的負十次方,一乘以十的負十,然後今天如果我再加上一個C3x三次方再去算一次,結果四項的那個假設跟三項的假設誤差只有譬如說只有一的負十二次方的話,那等於說你今天再增加一個C3這一項的時候,它並沒有幫助。
2086000	2099000	所以就是說等於說其實我們不知道到底該用幾項,我們只能用這種手段去猜,有點難形容。
2099000	2118000	我大概可以理解你要講什麼,但是你現在在講的基本上是假設在一個完美的數學的討論上,可是事實上你在寫 code 的時候,我猜你一直增加你的 degree 的話,你可能會一直減少你的 uncertainty 或是 inaccuracy,
2118000	2130000	可是到某一個程度,你不再有那麼多的優勢去減少 model 和實際的差異,但是你開始會放大你自己 computation 的 error 嗎?會嗎?
2130000	2144000	會的,所以那邊大概就是你不會再想要再弄更多了。對,那個時候到那個點,你就知道你可能就不需要再放更多的那個項進去你的 UJ 裡面。
2145000	2147000	Oh, I see. OK 好,謝謝。
2147000	2170000	然後下一頁,所以像剛剛講的就是,前面投影片除了說用更多項在你的假設的函數裡面,它除了給你更精準的答案之外,同時它的 convergence rate 也非常高。
2171000	2181000	所以它等於是它收斂速度,它誤差減小的速度也快,然後同時它給你的誤差也非常小,那它是一個非常聽起來非常吸引人的方法。
2182000	2190000	那事實上從有電腦開始,從有數值方法開始,高所謂的 high degree 這種 approximation,大家就都一直想用。
2190000	2199000	那可是為什麼到現在大家都還是用非常簡陋的有限差分、有限元素跟有限體積,那追根究底就是它有很多缺陷。
2199000	2212000	那缺陷就是如果我今天的物理場是一個 time dependent,就是它是一個 unsteady problem,它的統一方程式裡面有對時間的導數,那通常 high degree 這種東西它是非常不穩定。
2212000	2224000	因為電腦會有誤差嘛,電腦它是用 0101 來表示所有數字,所以它有些數字沒辦法表達出來,所以它就會在計算過程中產生誤差。
2224000	2250000	那今天如果我在 t 等於 0.1 秒這個時間點,有一個電腦產生一個非常小的誤差,那所謂 unstable 就是說它很可能在 t 等於 0.2 秒的時候,前一秒產生的誤差在這一秒就讓你的計算整個爆炸,譬如說變成無限大,甚至什麼 divide by zero 或者是無限小,就會出現這種情況,這種情況就叫做 unstable。
2251000	2270000	那高階函數它特別容易 unstable,那原因很明顯嘛,像你剛剛看到如果我們今天用到了十項,有一個 c 十,x 十次方,等於說我今天如果有一個微小的誤差,在這一步有一個微小的誤差是 1 的兩次方好了。
2271000	2285000	1 的兩次方,那你把 1 的誤差帶到 x 十次方,它整個誤差就變成 1 的二十次方,整個就會變成讓你的計算爆炸,所以這種東西它就會變成所謂的非常 unstable。
2286000	2305000	那第二個就是它比較牽扯到線性代數的概念,它是 ill-conditioned,我們剛剛不是說必須要有連立方程式去解那些 c 那些函數,譬如說四個連立方程式去解,那所謂 condition number 有一種東西叫 condition number,就是說這個連立方程式有多難解。
2305000	2334000	那 condition number 越高就表示說這個連立方程式越難解,condition number 越低就表示說這個連立方程式越好解,那通常你用越高項的假設函數,譬如說用到 x 四次方、x 五次方、x 六次方的時候,它就會變成所謂的 ill-conditioned,就是病態,它的連立方程式會非常難解,你可能需要非常非常久的時間才終於解得出那些 c0、c1、c2、c3。
2335000	2354000	那這是所謂 high degree 跟 high order method 的第二個缺點,然後第三個就是你用的越多項當然越複雜,那你在寫電腦程式的時候就會越難寫,那你越難寫的程式就算好不容易寫出來了,它裡面的 bug 可能也會越多,你就會更難去 debug。
2354000	2375000	然後第四個就是像現在大家的程式都是平行化,要在多核上面跑,連我們的電腦都是至少有四個核心、八個核心,那當這種高階的方法你要把它設計成可以同時在八個核心上面一起去求解的時候,它也會變得非常困難,所以這是高階方法最明顯的四個缺點,
2375000	2385000	那這也是為什麼到目前為止大家熟悉的數值方法都還是那種 first order 或 second order 的那種有限差分或有限元素。
2386000	2413000	那可是大家還是很努力的一直研究所謂的高階方法,因為它很 appealing,它就是給你非常小誤差,然後它誤差收斂的又非常慢,所以大家還是一直研究,然後所以大家就想辦法說從我們剛剛說的那三個問題,數值方法圍繞的那三個問題裡面,如果我們能不能找出一種組合,三個答案的組合,能夠給我們比較好的高階方法。
2413000	2437000	那大家都一直在這方面嘗試,那的確這是有可能的,那最近也許大家都有聽過所謂的 discontinuous gallerking,就是不連續的 gallerking method,它就是大概這兩千年之後的一個重大突破,那它就是可以非常高階,然後它的那個也比較 stable,然後它的條件數也比較低,
2437000	2445000	所以兩千年之後你就會非常常聽到所謂的 discontinuous gallerking,因為它就變得非常 popular。
2445000	2474000	那我這裡有一個例子,就是我剛剛講的說,不同的答案能夠給你同樣高階,但是比較穩定或條件數比較低的數值方法。像我這裡上面三個線代表的是三種不同的 Phi i 的假設,那最陡的這個直線就是所謂的,這裡有個打錯字,它應該是 moment expansion,就是我剛剛前面例子一直用的。
2475000	2503000	C0 加上 C1x 加 C2x 平方加 C3x 三次方,也就是說 Phi i 等於 x 的 i 次方,這個就很明顯你看得出 x 軸是幾項,就是我用了幾項的 Phi i,然後 y 軸是條件數,你可以看到它用越多項,它的條件數上升得越來越快,所以等於說你今天用太多項的話,你的那個連立方程式會非常非常難解。
2504000	2530000	然後第二個就是兩個 x 的這種連線,它是用所謂的內差函數,Lagrange polynomial,應該中文叫做拉格朗日內差,然後譬如說 Phi i, Phi 2, Phi 3 就是所謂的 Lagrange polynomial,用這種 polynomial 去定義的假設函數。
2530000	2549000	它的條件數變化就沒有用 moment expansion 變化這麼快,然後甚至第三個三角形這條線就是這幾年比較流行的一種 expansion,就是 Phi 0, Phi 1, Phi 2 就是所謂的 Lagrange polynomial。
2550000	2566000	Phi 0 就是一階的 Lagrange polynomial, Phi 1 就是一階的 Lagrange polynomial,那用這種方式去假設的一個假設的函數,你會發現它隨著你用的 Phi 越多,它的條件數其實變化不大。
2566000	2578000	那等於說你今天用的 Phi 越多的話,你所謂的 EO condition 這個 drawback 就基本上可以算是被 eliminate,就是已經不存在了。
2578000	2590000	那這張圖只是就是 show 給大家看說,就是為什麼不同的答案,那三個問題不同的答案,可以去有可能會解決掉高階方法的那些 drawbacks。
2591000	2602000	我有一個小問題,所以實際上來說,通常 condition number 是不是大約會正比於計算時間?
2603000	2607000	因為你就算一個 condition number,就是一個 linear equation 嘛。
2607000	2621000	對,但是這個我不太曉得,我沒有想過這個問題,其實很難講,因為你要看你用求解的,用來解那個連立方程式的方法是什麼。
2621000	2635000	比如說,你可以用解一個連立方程式,你可以用最基本的高斯消去法,那你也可以用一些比較快的方法,就是像共二梯度法。
2635000	2648000	或者像你可以用一些比較 fancy 的方法,就是先解出它的 eigenvalue,然後用 eigenvalue 再去找出它的特徵向量,然後再用特徵向量組合出它的連立方程式的解。
2648000	2660000	所以我不覺得說不同的方法去解同一個連立方程式,條件數都是正比於求解的時間。
2660000	2667000	而且不一定會正比,因為你基本上要把所有 condition 全部連立起來解。
2667000	2670000	就像你說的,要解 eigenvalue,要 all IC。
2670000	2677000	對,但是我確定的就是說,如果條件數越多它解得越慢。
2677000	2683000	那至於這個慢的比例到底是線性還是怎麼樣,這個我沒有研究過,所以我不太曉得。
2683000	2685000	好,謝謝。
2689000	2700000	好,那所以現在就是進入到正題,就是前面講了 weighted residual method,那個全重殘值法,是用來等一下推導那個 flux reconstruction method。
2700000	2712000	然後剛剛解釋的那個 order 只是就是給大家一個概念說什麼是 low order,什麼是 high order,那為什麼我們要用 high order 的方法,那 high order 有什麼好研究?
2713000	2724000	那這裡就是給大家提示,先給大家一個概念,我們剛剛提到說有三個方法,三個問題的答案可以決定定義出一種新的數值方法。
2724000	2732000	那所以我現在就講,先給大家提示說這個 flux reconstruction,它在這三個問題裡面它的答案是什麼。
2732000	2749000	那對 FR 方法來說,它的假設的函數這個 Phi I,它用的就是,你可以說它是 Lagrangian function,但你也可以說它是 Lagrangian polynomial,就是拉格朗日內差函數。
2749000	2757000	那只是這個內差函數它是定義在,內差函數需要,如果大家有印象的話,應該內差函數就知道你需要一些點去定義內差函數。
2757000	2772000	那今天這個在 FR 裡面,它用的 Phi 的內差函數就是定義在所謂的 Lagender 的 quadrature point,就是大家就先知道它就是某種特別的點,它不是隨機分佈,它也不是均勻分佈。
2772000	2780000	它的點的分佈必須要符合某種規則,這種規則就是 Lagender polynomial,它必須要符合 Lagender 這個規則。
2780000	2794000	那這是它的 expansion,它的 expansion 就是 Phi I 是什麼,那至於它用的權重是什麼,它的權重用的是 Galerkin method,所以它的權重用的就會跟 Phi I 是一樣。
2794000	2805000	Wj 會等於 Phi j,那跟 Galerkin method 一樣,但是等一下我們會 show 給大家看說它跟 Galerkin method 哪裡不一樣,它還是有些不一樣的地方。
2806000	2829000	然後第三個問題就是不同的 element 之間到底是什麼關係,那我今天這裡寫的是 orthogonal polynomial based flux reconstruction,其實說穿了它就是跟有限元素一樣,用的有限體積用的一樣,就是我前面提到的所謂 Riemann jump flux。
2830000	2848000	那如果大家有學過有限體積的話,就大概會有印象,那也沒關係,因為等一下還是會講一下這個 flux 到底是什麼,這個 neighboring 之間到底是怎麼 coupling,那這只是一個 heads up 而已。
2848000	2872000	那現在來開始正式推導,EFA 這個方法2007年提出的時候,它主要是在求解所謂的 hyperbolic conservation law,這種 PDE 長的會是這種形式,那當然你在二維或三維的時候,後面還會有對 y 的維分、對 z 的維分,但在一維的話大概就是長這樣。
2872000	2898000	然後今天我們假如它的有效的 range 是從 xa 到 xb,那這個 range 如果我們把它又切成 n1 個元素的話,然後我們用大 E 來表示每個元素,然後每個元素裡面自己的有效範圍我們把它寫成 xk 到 xk 加 1,然後我們今天建立了兩個猜測函數,第一個是對 u 的猜測函數,
2898000	2921000	那 dk 個 element 裡面的猜測函數就是會長,我們就寫成這個樣子,sigma 然後 uki、phi i, uki 就是指 dk 個元素裡面的第 i 個點,第 i 個位置的值,然後 phi i 是內差函數,然後 f 我們同樣也這樣定義。
2922000	2945000	那可是在這兩個近似函數裡面其實只有 uki 是未知數,是我們需要求解的,因為 fki 是從 uki 定義來的,fki 就是你把 uki 代到你原本 pd 裡面這個 f 函數,你就可以得到 uki,所以雖然我們有兩個近似函數,但是只有 uki 是未知的需要求解的。
2945000	2971000	那我們回到前面講的權重殘值法,那我們把權重殘值法那個積分套用在 dk 個 element,只在 dk 個 element,我們不管其他 element,所以它的積分範圍就是 xk 到 xk 加 1,然後權重 wj,然後右邊是我們原本的 pd 的殘值,就是 r,然後下面第二行我只是把它拆成兩項而已。
2976000	3000000	那我們現在針對第二項,第二項就是權重乘以 f 這函數對 x 的導數,那我們今天用分佈積分,就微積分裡面的分佈積分,我們可以得到等號右邊這個樣子,這個式子,就會變成是 xk 加 1 的值減掉 xk 這個地方的值,然後再減掉另外一個積分函數。
3000000	3027000	那這個函數就是所謂的 weak form,discontinuous gallerking 的 weak form,那我這邊只提一下,因為我們並沒有要做 discontinuous gallerking,然後如果你今天要做 discontinuous gallerking 的話,你導出這個式子之後,你的下一步就會直接跳到說到底我這個 f 在 xk 加 1 這個點該怎麼定義,或者 f 在 xk 這個點該怎麼定義。
3028000	3051000	那我們今天不是要做這個,所以先跳過這一步,我們先進到下一步,下一步就是我剛剛那個等號右手邊那個積分,我再進一步,再做一次分佈積分,那我再做一次分佈積分之後,我又會得到原本的積分函數,就是權重乘以 f 對 x 的導數。
3051000	3080000	可是我左邊我會多了兩項,就是我會多了一個 fk 在 xk 加 1 的值,這就是說我剛剛對 f 的假設的那個函數,內差函數在 xk 加 1 的值,然後這個 fk,然後 xk 就是指 f 這個假設函數在 xk 這個地方的內差出來的值,所以第三行就是只是一個重新整理。
3081000	3110000	你會得到一個原始的積分函數,然後再減掉後面這兩項,權重乘以這個中括弧裡面的東西,那中括弧裡面的東西代表的是什麼?代表就是說一個 jump,就是我希望 xk 這個地方,第一個 f,如果大家能看到我的滑鼠的話,第一個 f 值的是我希望 xk 這個地方該是它的值該是多少,然後第二個這個 f。
3111000	3128000	就是用內差函數去求出來的 f,就是指我今天內差函數實際上算出來在這個點,在這個 xk 這個點是多少,所以它叫 jump,就是我希望的值跟實際上內差出來的值之間的差距,這叫 jump。
3128000	3150000	那這種東西在那個文獻裡面他們會叫做 strong form of discontinuous skeleton,那只是沒有人在求解這個方程式,然後最後一點就是提醒大家注意到兩種不同 f 的定義方式,一個是我希望它是多少,然後一個是內差函數實際上內差出來的值。
3150000	3173000	然後下一頁,有點慢,然後我今天就是在這一頁講的就是只是把剛剛導出來的所謂 strong form of discontinuous skeleton,帶回原本的那個權重殘值法的積分裡面,然後就會長成這樣。
3173000	3181000	你就會發現第一項還是原本的那個權重殘值的積分,然後可是多了兩項跟 jump 有關的東西。
3181000	3210000	然後今天在 flux reconstruction 跟所謂的 strong form of discontinuous skeleton 不一樣的地方就是,它在這個時候用了一個 trick,就是它假設說我前面有一個地方是有 xwjxk 這一項,如果我同樣能把它寫成一個積分的形式,然後找到一個所謂 gl 函數的話,那它就會長成這樣。
3211000	3239000	xwjxk 函數,讓它說 wj 這個權重函數在 xk 這個點的值會等於這個積分,然後 wj 在 xk 加 1 這個點的值會等於用 gr 來定義的這個積分,那我把這兩個定義帶回去原本上一頁的那個權重殘值的那個積分的時候,我就可以把它整個寫成一個所有東西全部都塞到我的積分範圍裡面,就會像這樣。
3239000	3253000	所有東西都會變成積分,然後權重乘以其他所有東西。那為什麼要這樣做呢?因為這樣做的話,我就可以把權重刪掉,我就可以把積分刪掉,變成純粹的一個微分方程式。
3253000	3276000	所以這就是 Flux Reconstruction,我假設 wj 能夠變成一個積分,然後帶回去之後,我就可以把積分跟權重刪掉,變回還原出一個原始的微分方程式,那這一頁就是只是把它重新寫而已。
3277000	3289000	主持人問一個小問題,所以你這個方法基本上 rely on gr 跟 gl 存在嗎?
3289000	3293000	主持人問一個小問題,所以你這個方法基本上 rely on gr 跟 gl 存在嗎?
3319000	3320000	主持人問一個小問題,所以你這個方法基本上 rely on gr 跟 gl 存在嗎?
3320000	3321000	主持人問一個小問題,所以你這個方法基本上 rely on gr 跟 gl 存在嗎?
3321000	3336000	主持人問一個小問題,所以你這個方法基本上 rely on gr 跟 gl 存在嗎?
3336000	3364000	主持人問一個小問題,所以你這個方法基本上 rely on gr 跟 gl 存在嗎?
3366000	3369000	主持人問一個小問題,所以你這個方法基本上 rely on gr 跟 gl 存在嗎?
3369000	3398000	主持人問一個小問題,所以你這個方法基本上 rely on gr 跟 gl 存在嗎?
3399000	3409000	主持人問一個小問題,所以你這個方法基本上 rely on gr 跟 gl 存在嗎?
3409000	3438000	主持人問一個小問題,所以你這個方法基本上 rely on gr 跟 gl 存在嗎?
3439000	3454000	主持人問一個小問題,所以你這個方法基本上 rely on gr 跟 gl 存在嗎?
3454000	3477000	主持人問一個小問題,所以你這個方法基本上 rely on gr 跟 gl 存在嗎?
3477000	3493000	主持人問一個小問題,所以你這個方法基本上 rely on gr 跟 gl 存在嗎?
3493000	3522000	主持人問一個小問題,所以你這個方法基本上 rely on gr 跟 gl 存在嗎?
3523000	3537000	主持人問一個小問題,所以你這個方法基本上 rely on gr 跟 gl 存在嗎?
3537000	3566000	主持人問一個小問題,所以你這個方法基本上 rely on gr 跟 gl 存在嗎?
3567000	3596000	主持人問一個小問題,所以你這個方法基本上 rely on gr 跟 gl 存在嗎?
3597000	3622000	主持人問一個小問題,所以你這個方法基本上 rely on gr 跟 gl 存在嗎?
3622000	3642000	主持人問一個小問題,所以你這個方法基本上 rely on gr 跟 gl 存在嗎?
3642000	3669000	主持人問一個小問題,所以你這個方法基本上 rely on gr 跟 gl 存在嗎?
3672000	3692000	主持人問一個小問題,所以你這個方法基本上 rely on gr 跟 gl 存在嗎?
3692000	3721000	主持人問一個小問題,所以你這個方法基本上 rely on gr 跟 gl 存在嗎?
3722000	3747000	主持人問一個小問題,所以你這個方法基本上 rely on gr 跟 gl 存在嗎?
3747000	3772000	主持人問一個小問題,所以你這個方法基本上 rely on gr 跟 gl 存在嗎?
3772000	3797000	主持人問一個小問題,所以你這個方法基本上 rely on gr 跟 gl 存在嗎?
3797000	3819000	主持人問一個小問題,所以你這個方法基本上 rely on gr 跟 gl 存在嗎?
3819000	3848000	主持人問一個小問題,所以你這個方法基本上 rely on gr 跟 gl 存在嗎?
3849000	3878000	主持人問一個小問題,所以你這個方法基本上 rely on gr 跟 gl 存在嗎?
3879000	3899000	主持人問一個小問題,所以你這個方法基本上 rely on gr 跟 gl 存在嗎?
3899000	3919000	主持人問一個小問題,所以你這個方法基本上 rely on gr 跟 gl 存在嗎?
3919000	3947000	主持人問一個小問題,所以你這個方法基本上 rely on gr 跟 gl 存在嗎?
3949000	3978000	主持人問一個小問題,所以你這個方法基本上 rely on gr 跟 gl 存在嗎?
3979000	4004000	主持人問一個小問題,所以你這個方法基本上 rely on gr 跟 gl 存在嗎?
4004000	4029000	主持人問一個小問題,所以你這個方法基本上 rely on gr 跟 gl 存在嗎?
4030000	4057000	主持人問一個小問題,所以你這個方法基本上 rely on gr 跟 gl 存在嗎?
4057000	4085000	主持人問一個小問題,所以你這個方法基本上 rely on gr 跟 gl 存在嗎?
4087000	4115000	主持人問一個小問題,所以你這個方法基本上 rely on gr 跟 gl 存在嗎?
4117000	4145000	主持人問一個小問題,所以你這個方法基本上 rely on gr 跟 gl 存在嗎?
4147000	4153000	主持人問一個小問題,所以你這個方法基本上 rely on gr 跟 gl 存在嗎?
