start	end	text
0	8000	Welcome to this week's Tera Talk. I'm your host, Yu-Wei Lin.
8000	11000	I'm pleased to welcome our speaker today, Louis.
11000	15000	He is currently a Ph.D. student at St. Louis University of Washington.
15000	21000	His main research projects include intellectual property rights, law, anti-Thorax law, and economic analysis.
21000	27000	Before he was a Ph.D. student, he was an intern at Winston & Stone, a law firm in Taiwan and abroad.
27000	34000	He also analyzed the legal process of Taiwan clients and non-authorized individuals in the U.S. and East Texas courts.
34000	37000	Louis is also passionate about entrepreneurship.
37000	42000	He is a member of the China Entrepreneurship and International Exchange Association.
42000	48000	He regularly holds conferences and talks in Taiwan to promote entrepreneurship.
48000	51000	Today's topic is based on his background in law and entrepreneurship.
51000	61000	Louis, please turn on your microphone.
61000	80000	Thank you, Yu-Wei, and thank you, Tera, for inviting me.
80000	104000	Last year, I also talked about copyright issues in my talk.
104000	107000	Today's topic is completely different.
108000	122000	This topic has a little to do with my graduate thesis, but it is not all of my graduate thesis.
122000	128000	Instead, I use different angles to analyze the case study of my graduate thesis.
128000	144000	As you can see on the screen, my graduate thesis is co-authored by a friend from Shanghai Fudan University's School of Management.
145000	167000	My thesis focuses on the use of bundling in the market.
167000	175000	The main details of my thesis will take about 30-40 minutes.
175000	184000	This topic has a background, so I will talk about it in detail.
184000	191000	I'm just curious about what kind of people are listening to my talk today.
215000	217000	I will talk about it in detail.
217000	223000	In fact, it is not so difficult to compare things in the Department of Sociology and Law.
223000	232000	Today, I will use some mathematical things, but I will not show you the whole process.
232000	234000	I don't think I need to show off.
234000	238000	I just want to show you what our results are.
238000	240000	I don't have much to say.
240000	245000	Some of the things I study need to be understood by everyone.
245000	255000	If some of you are interested in this industry or already know it very well, please add it if I am wrong.
255000	260000	What I want to talk about today is actually related to modern chip.
260000	264000	Modern chip is the so-called communication chip industry.
264000	269000	In fact, I found this Samsung Galaxy S4 on the Internet.
269000	274000	The structure of the picture is like this.
274000	277000	One of them is modern chip.
277000	279000	What are the benefits of modern chip?
279000	284000	The advantage is that after I installed this modern chip in my mobile phone today,
284000	295000	For example, as we all know, the communication standards of 2G, 3G, and 4G will not have the so-called problems that cannot be used in different countries.
295000	301000	Just imagine that if you buy an iPhone today, whether it is iPhone 4, iPhone 5, or iPhone 6,
301000	308000	The result may be that your communication standards are different today, or your communication bandwidth is different.
309000	314000	In fact, this is very blind.
314000	320000	How to solve this difference in bandwidth or communication standards?
320000	323000	Modern chip plays a very important role.
323000	326000	Another example is that everyone is in the United States.
326000	331000	I assume that everyone is in the United States.
331000	341000	For example, if you run to some remote places with your mobile phone, it is not 4G that covers the range, but 3G or even 2G.
341000	347000	But you can still make calls and you can still go online.
347000	349000	It's just that it's very slow.
349000	351000	How is this function done?
351000	353000	In fact, this is the function of modern chip.
353000	359000	It can still operate under different standards and under different levels.
359000	361000	However, its operating function is limited.
361000	363000	This is the function of modern chip.
363000	372000	It can be seen that a mobile phone has a lot of functionality.
372000	378000	But the value of a smart phone is to be online.
378000	382000	Modern chip plays a very important role.
383000	389000	What I want to discuss today is a small communication chip problem.
389000	394000	Let's take a look at the situation of this industry.
394000	399000	This is a total of 1.2 years.
399000	405000	From 2007 to 2012, there were several leading companies in the modern chip industry.
405000	415000	We can probably see that Qualcomm has been playing a leading role in this field.
415000	423000	Qualcomm has been playing a leading role since the 3G in 2007 to the 4G in 2012.
423000	427000	Later, I will show the state of the 5G patent layout.
427000	431000	Qualcomm has been playing a leading role.
431000	445000	Qualcomm has been playing a leading role since the 3G in 2012 to the 5G in 2012.
445000	448000	This is the current state of the industry.
448000	463000	From 2012 to now, we can see that the green part of the patent is high-speed communication.
463000	476000	In fact, it occupies a very high position in the patent layout of modern chip, including radio front, modulation, and core networking.
476000	482000	From these pictures, we can see the current state of the industry.
482000	490000	For example, InterDigital and BlackBerry have all disappeared.
490000	493000	These are all in the past.
493000	496000	The former dragon head is no longer in use.
496000	500000	You can see that there is a lot of communication in the green part.
500000	506000	The gray part is Intel, which we will discuss today.
506000	515000	In fact, it is not as good as Qualcomm in terms of patent layout, especially 5G.
515000	526000	So we can simply summarize that Qualcomm is almost in monopoly in the modern chip industry.
526000	536000	Because most of the chips are in the patent layout of most of the modern chip sales, and the quality of its products is maintained.
536000	539000	So the state of its maintenance is very good.
539000	560000	Most of the big manufacturers, including Apple users, mostly use Qualcomm's modern chip for their important suppliers from iPhone 4, iPhone 5, iPhone 6, and iPhone 7.
561000	574000	But the problem is that these so-called communication standards, which I just mentioned, such as 2G, 3G, and 4G standards.
574000	584000	In fact, these standards have a lot of patent layout behind them, and the negotiation process of each party.
584000	591000	You always have to decide which standard to use. It must be of good quality and easy to promote. I think everyone can understand this.
591000	598000	In fact, there are these international standard organizations behind the standard promotion.
598000	604000	So back to the picture just now, let's come here first.
604000	611000	I think this picture is very important in the background of my law school.
611000	618000	Why is it important? Because it explains the relationship between people of different levels.
618000	629000	Because on my left is IEEE, ITU, and ETSI. These three are very important technical standards organizations that designate 4G and even 5G.
629000	637000	These technical standards organizations play a role in promoting technical standards.
638000	651000	The core concept is that I want my 4G standard or 5G standard in the future to be able to be used by many people.
651000	657000	It's not that I only let a group of people use it. A small group of people using it is not a standard.
657000	665000	So it must be that everyone can recognize this thing. Yes, it's good, it's easy to use, and it's efficient.
665000	670000	The standard of 5G and 4G can be slowly promoted because the industry recognizes it.
670000	677000	But behind it, as I said before, it involves a lot of different patent layouts.
677000	682000	Because it is impossible for a company to have all the patents of technical standards.
682000	692000	It must be segmented. It must be cut into many segments. Some companies specialize in that.
692000	703000	For example, now everyone sees Radio Front End. Although the patents of Ericsson and Qualcomm are similar, it also means that there are many things that Qualcomm can't do.
704000	711000	So today I want to talk to you about this kind of industry.
711000	718000	Such patents are called SEP.
718000	727000	SEP stands for Standard Essential Patents.
727000	742000	Those who have SEPs, such as the manufacturers I mentioned earlier, including Ericsson, Qualcomm, and Intel, are considered SEPs.
742000	753000	Everyone will think that if everyone in the world uses this standard, then he can raise the price.
753000	757000	Because people all over the world use it, then I'm not turning over.
757000	763000	In order to prevent this from happening, it should be said that preventing it from turning over is one point.
764000	768000	Another point is that it can take advantage of the position of patents in the market.
768000	774000	Because patents are a kind of legal monopoly, everyone can understand it this way.
774000	777000	Most people may not study law.
777000	783000	If you ask me how to understand patents, the way to understand it is very simple.
783000	792000	A patent is a legal right for you to have this kind of monopoly.
792000	799000	It allows you to have the right to monopolize within a period of time for your technology and patent.
799000	802000	So it is a limited monopoly.
802000	814000	After these people have patents, if these patents or technologies are used as standards, then they can raise their prices indefinitely.
814000	822000	Isn't that against the purpose of these technical standards organizations that I just mentioned?
822000	825000	Because the price is too high, no one can use it.
825000	828000	If I want to pay so much, who will think about my rights?
828000	841000	So, in this atmosphere, in this concept, all technical standards organizations in the process of setting standards,
841000	854000	remember that this structural organization requires all SEPs to provide an LOA.
854000	860000	LOA is the condition that you have to accept the conditions provided by the technical standards organization.
860000	867000	For example, you want to become a 3G standard, or a 4G standard, or a 5G standard in the future.
867000	871000	But your patent price must be within a certain range.
871000	874000	But we call this range of conditions FRIEND.
874000	878000	Let me stop for a moment.
878000	881000	Because I really can't see everyone's conversation.
881000	884000	Does anyone have any questions now?
884000	887000	Let's take a look.
887000	890000	It seems that no one has asked me a question.
890000	893000	If you have any questions, you can ask me at any time, it doesn't matter.
893000	896000	If there are no questions, I will continue to talk.
896000	902000	Because I found that there is no social science background, I have to speak particularly slowly.
903000	913000	The full name of FRIEND is Fair, Reasonable and Non-Discriminatory Licensing.
913000	921000	FRAND is included in the conditions provided by all technical standards organizations.
921000	924000	This condition actually includes a lot.
924000	926000	If you are interested, you can check it.
926000	933000	One of the most important conditions is that your patent must be used as a standard.
933000	937000	Your technology must become my 5G standard.
937000	943000	You submit your patent application.
943000	947000	But you must accept the restrictions of FRAND.
947000	952000	Because, as I said, you can't raise the price too high.
952000	955000	If the price is too high, no one will use it.
955000	958000	Another point is the following box.
958000	960000	The following box is the implementer.
960000	966000	What I mean by implementer is, for example, our great HTC.
966000	970000	HTC may have some patents, but it is not a player.
970000	976000	HTC is not the patent holders we saw in the picture just now.
977000	985000	It's just that I'm an authorized person, and I use the technical standards they have, and I use the technology.
985000	987000	We call it implementer.
987000	990000	It is not a person who develops modern chips.
990000	992000	Simply put, HTC is also.
992000	993000	Apple is also.
993000	1000000	Of course, if you are concerned about this industry, Apple has already released a message that it wants to step in.
1000000	1002000	It also wants to make its own chips.
1002000	1004000	If you are interested in this in the future, you can talk to me.
1004000	1006000	It's a matter of whether you can do it or not.
1006000	1009000	There are still some entry barriers.
1009000	1018000	Back here, you have to accept that you have to become a technical standard.
1018000	1019000	You have to accept FRAND.
1019000	1027000	Second, the condition of FRAND will not be limited to the relationship between you and the technical standard organization.
1028000	1031000	It will have a third-party interest.
1031000	1034000	We call it a third-party interest contract.
1034000	1046000	This third-party interest contract means that after I make these terms with the technical standard organization today, the efficiency of these terms will affect the third person.
1046000	1053000	The meaning of the third person is that it includes HTC, because it is not an owner of SEP.
1054000	1058000	It is not an owner of SEP, but its efficiency will affect the third person.
1058000	1063000	So everyone can enjoy the benefits of FRAND.
1063000	1068000	In other words, the third party, for example, HTC, I also have to use these technical standard organizations.
1068000	1071000	These 3G, 4G, or 5G patents.
1071000	1078000	You can't because I'm not in this technical standard organization, or I'm not part of this technical standard organization.
1079000	1084000	So these SEP owners raise my price very high.
1084000	1103000	Basically, these SEP owners join the technical standard organization and submit their patents to the technical standard organization as a prerequisite for 5G standards.
1103000	1105000	The problem is that you have to accept these two conditions.
1105000	1111000	The first is that the price of your patent must be within a reasonable range.
1111000	1115000	The second is that it will affect the third party.
1115000	1123000	As long as everyone wants to use this technical standard, everyone can enjoy the benefits of FRAND.
1123000	1130000	Instead of saying that because you are in a technical standard organization, I will give you a discount, and no one else will.
1130000	1132000	But here I make a signal.
1132000	1137000	That is, my research is in this area.
1137000	1141000	The source of all the problems is here.
1141000	1146000	Because there will be so-called market monopoly problems.
1146000	1147000	Why?
1147000	1153000	Think about it, who are the members of all the technical standard organizations?
1153000	1156000	Isn't it the so-called industry leaders?
1156000	1158000	Because who sets the technical standards?
1158000	1160000	It must be the industry leaders, right?
1160000	1164000	Among these industry leaders, if everyone gathers together to have a meeting.
1164000	1167000	But Taiwanese people may not know much about this law.
1167000	1172000	It seems that many manufacturers sit in line together to eat and discuss things.
1172000	1174000	It seems very simple, there is no legal problem.
1174000	1177000	I tell you, the problem is here.
1177000	1187000	The problem is that the U.S. Anti-Trust Law and the so-called EU Competition Law strictly prohibit this matter.
1187000	1192000	Because this prohibition is actually the so-called joint pricing behavior.
1192000	1200000	Because the U.S. has a lot of different review standards in the so-called Anti-Trust Law.
1200000	1205000	In fact, the most taboo thing is like the joint pricing I just said.
1205000	1210000	A bunch of competitors in the same industry.
1210000	1213000	For example, we just said that Ericsson also has a patent.
1213000	1217000	It is also in the ETSI, ITU, and IEE.
1217000	1219000	Qualcomm is also a member.
1219000	1223000	Because everyone submits their patents and then joins their members.
1223000	1228000	So this group of people are all competitors in the same industry.
1228000	1230000	All set standards here.
1230000	1236000	Of course, as a government role, the government will be very worried about this matter.
1236000	1238000	Are you guys doing it?
1238000	1240000	Why? Think from another perspective.
1240000	1243000	Friend is what we just talked about.
1243000	1246000	The problem with Friend is that I promised you today.
1246000	1250000	I promised you to set the price of Friend.
1250000	1256000	But this is a requirement for all SEP holders.
1256000	1260000	And this technical standard organization is afraid.
1260000	1268000	For example, if I ask for 5%, I ask for the price of Friend.
1268000	1272000	It is called 5% of each product sale.
1272000	1273000	5% may be too high.
1273000	1275000	1% is called Friend.
1276000	1277000	Think about it.
1277000	1280000	If this is the case.
1280000	1283000	What is the price of Friend?
1283000	1286000	What is the price of reasonable and non-discriminatory?
1286000	1289000	All people can only charge 1%.
1289000	1293000	In fact, from the perspective of the government, you will find it strange.
1293000	1297000	Why did you all create this RATE together?
1297000	1299000	Is there a joint pricing behavior?
1300000	1304000	This problem is stuck in the technical standard organization.
1304000	1307000	I abbreviate SSO to make it easier for me to say.
1307000	1310000	SSO will be worried.
1310000	1312000	If everyone is investigating me.
1312000	1313000	Everyone is doubting me.
1313000	1315000	Am I doing joint pricing?
1315000	1317000	Because I said a sentence.
1317000	1319000	The price of Friend is called 1%.
1319000	1323000	Am I being investigated all day?
1323000	1325000	So the problem is here.
1326000	1329000	Although it is a very important organization.
1329000	1330000	It created Friend.
1330000	1333000	It requires everyone to accept Friend.
1333000	1337000	But it is not responsible for the so-called pricing behavior.
1337000	1340000	Because of this, what is Friend?
1340000	1343000	I can report to you.
1343000	1345000	What is Friend?
1345000	1347000	In the legal circle.
1347000	1351000	There are many discussions in the paper of the Chamber of Commerce.
1351000	1355000	Because no one dares to go to court.
1355000	1359000	The court itself or the government unit.
1359000	1363000	It has never dared to respond positively to this matter.
1363000	1365000	Includes its definition.
1365000	1367000	It has its own method of calculation.
1367000	1369000	But every court in the United States.
1369000	1372000	Are using different methods of calculation.
1372000	1377000	So this thing is actually complicated.
1378000	1382000	In fact, today I will introduce this kind of background to you first.
1382000	1386000	Because I think this thing needs to be explained to you first.
1386000	1388000	Then his background state.
1388000	1391000	Then I can get into what we are studying.
1391000	1395000	Because of this, everyone will have the so-called level playing field.
1395000	1397000	Everyone has a rough idea of ​​this matter.
1397000	1400000	I know what I am studying.
1400000	1402000	I'm getting into my stuff.
1402000	1404000	This is easier for everyone to understand.
1405000	1407000	Before we officially start talking.
1409000	1411000	Before this very interesting case.
1411000	1412000	Let me ask you first.
1412000	1414000	The simple industry I just introduced.
1414000	1417000	Or some knowledge background.
1417000	1419000	Is there any problem with the introduction?
1429000	1431000	5 seconds.
1431000	1433000	No problem so far.
1434000	1436000	No problem, very good.
1436000	1438000	But if you have any questions, you are welcome.
1438000	1440000	I also want to train.
1440000	1443000	Talk to people in the legal field.
1443000	1445000	See what you think.
1445000	1447000	After having such background knowledge.
1447000	1450000	We know that the technical standards have many patents.
1450000	1453000	It is authorized to be restricted by the FRIEND regulation.
1453000	1455000	Then it has a third-party regulation.
1455000	1457000	So everyone can enjoy FRIEND.
1459000	1460000	Then there is that we all know.
1461000	1463000	When selling, there are usually a lot of patents behind.
1467000	1469000	The problem has appeared.
1469000	1471000	We all know that I just mentioned.
1471000	1474000	Qualcomm is an industrial leader.
1474000	1477000	Its modern chip quality is very good.
1477000	1481000	It is also an Apple long-term supplier.
1481000	1488000	But at the beginning of 2017.
1488000	1492000	FTC, the Federal Trade Commission of the United States.
1492000	1494000	And Apple itself.
1494000	1497000	Apple is its downstream manufacturer.
1497000	1504000	It has sued Qualcomm for violating the Antitrust Law.
1506000	1509000	Specifically, it has many claims.
1509000	1511000	It has advocated many things.
1511000	1513000	What I want to focus on today is.
1513000	1516000	Qualcomm is on the so-called contract.
1517000	1519000	With everyone playing a so-called.
1519000	1521000	It uses its market position.
1521000	1524000	To achieve its goal of making profits.
1524000	1526000	How does it do this?
1526000	1528000	First of all, everyone sees this picture.
1528000	1532000	This picture is actually public.
1532000	1534000	I didn't do it, it's not so beautiful.
1534000	1538000	This picture is when Apple is suing Qualcomm.
1538000	1542000	It added its content of this lawsuit.
1542000	1544000	And its analysis chart.
1544000	1547000	How does Qualcomm violate the law?
1547000	1549000	Basically, Qualcomm.
1549000	1554000	Its practice is actually divided into two stages.
1554000	1556000	Today, because of a little more time.
1556000	1558000	I don't know how much time I have.
1558000	1560000	But I'll talk slowly.
1560000	1562000	It is actually divided into two stages.
1562000	1565000	Qualcomm's two-stage behavior is the first.
1565000	1567000	Qualcomm in 2007.
1567000	1570000	Before officially becoming an Apple supplier.
1570000	1572000	In fact, it is with Apple.
1572000	1574000	Uh, other assembly lines.
1574000	1576000	Uh, including the so-called.
1576000	1578000	We refer to this Fuskang.
1578000	1580000	I take Fuskang as an example.
1580000	1582000	Fuskang is Apple's.
1582000	1584000	This assembly line.
1584000	1586000	It is actually Qualcomm itself.
1586000	1588000	Uh, the assembly line of Apple.
1588000	1590000	There is already a contract.
1590000	1592000	Why? Because you want to assemble.
1592000	1594000	You will also use Qualcomm's patent.
1594000	1596000	Because Qualcomm's patent layout is very wide.
1596000	1597000	We just.
1597000	1598000	In fact, I just gave a simple example.
1598000	1600000	In fact, if you look at it.
1600000	1602000	Qualcomm's patent layout.
1602000	1604000	It has exceeded the scope of the modern chip itself.
1604000	1606000	It contains the entire technical standard.
1606000	1608000	OK, this is what he said.
1608000	1610000	Uh, I also believe that.
1610000	1612000	Because if you go to check Qualcomm.
1612000	1614000	This company was established in 1985.
1614000	1616000	Then continue to be in.
1616000	1618000	Uh, the communication chip industry continues.
1618000	1620000	To do research and development.
1620000	1622000	Then continue to.
1622000	1624000	Uh, expand his career.
1624000	1626000	So he actually.
1626000	1628000	The impact is not just in the modern chip itself.
1628000	1630000	It also includes the whole.
1630000	1632000	It also includes itself.
1632000	1634000	Uh, it also includes technical standards.
1634000	1636000	OK.
1636000	1638000	So he was originally Qualcomm.
1638000	1640000	He is cooperating with Apple suppliers.
1640000	1642000	Ah, because Apple suppliers.
1642000	1644000	For example, I just said Fuskang.
1644000	1646000	Fuskang, he actually does more than Apple products.
1646000	1648000	He also does other.
1648000	1650000	Do HP, right?
1650000	1652000	You do other products.
1652000	1654000	HP's, for example.
1654000	1656000	Will also use Qualcomm's chip.
1656000	1658000	Uh, it will also use Qualcomm's patent.
1658000	1660000	Or technology also needs to be done.
1660000	1662000	Uh, patent authorization.
1662000	1664000	So it becomes.
1664000	1666000	In fact, Qualcomm already has.
1666000	1668000	With other Apple suppliers.
1668000	1670000	To do cooperation.
1670000	1672000	So why did I mention Apple suppliers?
1672000	1674000	His complexity is here.
1674000	1676000	Because Qualcomm, he did one.
1676000	1678000	The fun thing is that he is.
1678000	1680000	Before becoming an Apple supplier.
1680000	1682000	He told this Apple supplier.
1682000	1684000	I just said.
1684000	1686000	I signed a contract with you.
1686000	1688000	I put this.
1688000	1690000	You want to assemble this Apple product.
1690000	1692000	Okay, I'll take this patent with you.
1692000	1694000	But what about the content of this patent?
1694000	1696000	The scope is not the content.
1696000	1698000	Specific details.
1698000	1700000	How is it?
1700000	1702000	Uh, it's NDA.
1702000	1704000	Non-disclosure agreement is not open.
1704000	1706000	OK, what about other things?
1706000	1708000	If I think I'm because of this.
1708000	1710000	The relationship is actually a bit complicated.
1710000	1712000	To put it simply.
1712000	1714000	Qualcomm, I'm with Apple today.
1714000	1716000	Uh, the assembly plant of Apple.
1716000	1718000	Ah, and then the patent authorization.
1718000	1720000	Ah, these assemblies.
1720000	1722000	He can actually come back and ask Apple for this.
1722000	1724000	Want this reimbursement.
1724000	1726000	That is to say, because the assembly plant.
1726000	1728000	He doesn't think he has to.
