start	end	text
1728000	1730000	Take more of this responsibility.
1730000	1732000	Because this contract is actually negotiable.
1732000	1734000	But in the real world.
1734000	1736000	I can tell you.
1736000	1738000	Report to everyone.
1738000	1740000	In fact, most of the money.
1740000	1742000	Uh, there are a lot of parts.
1742000	1744000	A lot of money has become.
1744000	1746000	Apple to squeeze.
1746000	1748000	But of course Apple will say.
1748000	1750000	I didn't squeeze them.
1750000	1752000	Of course, in this case.
1752000	1754000	Qualcomm is Qualcomm.
1754000	1756000	Uh, Qualcomm claims.
1756000	1758000	Oh, I have been with these assemblies today.
1758000	1760000	Cooperation.
1760000	1762000	I asked them to pay these.
1762000	1764000	Give me the rights to patent authorization.
1764000	1766000	If you don't want to.
1766000	1768000	You can go back to Apple.
1768000	1770000	You don't have to pay for this.
1770000	1772000	Does Apple pay for you?
1772000	1774000	But the fun thing is here.
1774000	1776000	Qualcomm, I just said that Qualcomm.
1776000	1778000	He is SEP.
1778000	1780000	In fact, his SEP is a.
1780000	1782000	There must be a range.
1782000	1784000	His range is the so-called.
1784000	1786000	This friend.
1786000	1788000	He is more than that.
1788000	1790000	Fair and reasonable.
1790000	1792000	He must be reasonable.
1792000	1794000	And not discrimination.
1794000	1796000	I went to these assemblies.
1796000	1798000	Signed the NDA.
1798000	1800000	If you are Apple.
1800000	1802000	Then there is a result.
1802000	1804000	I want to use.
1804000	1806000	For example, I want to use Qualcomm chips.
1806000	1808000	Then the result.
1808000	1810000	I use Qualcomm chips.
1810000	1812000	All those assemblies below me.
1812000	1814000	Have been asking me for money.
1814000	1816000	Qualcomm has already collected more money from me.
1816000	1818000	Then you have to compensate me.
1818000	1820000	Then how much compensation.
1820000	1822000	Then how much according to the contract.
1822000	1824000	Why is this price?
1824000	1826000	Those assemblies.
1826000	1828000	Apple asked those assemblies.
1828000	1830000	Why is this price?
1830000	1832000	I can't tell you.
1832000	1834000	Because Qualcomm said this is NDA.
1834000	1836000	I can't tell you.
1836000	1838000	So this is wonderful.
1838000	1840000	The first stage is to say.
1840000	1842000	Qualcomm went to Apple's assembly plant.
1842000	1844000	Wanted a sum of money.
1844000	1846000	Then the source of this money is.
1846000	1848000	NDA is not public.
1848000	1850000	That becomes.
1850000	1852000	Because the account is there.
1852000	1854000	Qualcomm asked me for so much money.
1854000	1856000	Then Apple.
1856000	1858000	Transferred to Apple.
1858000	1860000	Then Apple.
1860000	1862000	I can only admit it.
1862000	1864000	Apple thinks it's strange.
1864000	1866000	Is this price reasonable?
1866000	1868000	Ask my assembly plant.
1868000	1870000	He can't say.
1870000	1872000	That's weird.
1872000	1874000	Apple actually wants to get rid of this.
1874000	1876000	How much did I pay Qualcomm?
1876000	1878000	I don't know.
1878000	1880000	I don't know my source.
1880000	1882000	I don't know my calculation method.
1882000	1884000	I just kept paying for it.
1884000	1886000	He thinks it's unreasonable.
1886000	1888000	Feel the price.
1888000	1890000	His internal manager.
1890000	1892000	Or lawyers or lawyers.
1892000	1894000	Think this price may be unreasonable.
1894000	1896000	Qualcomm wants too much money.
1896000	1898000	He decided to talk to Qualcomm directly.
1898000	1900000	So this picture is later.
1900000	1902000	Apple talked to Qualcomm.
1902000	1904000	After he talked.
1904000	1906000	Apple said I can sign a contract with you.
1906000	1908000	The gray part below.
1908000	1910000	BCPA, TA, FTA, SDA, ASDA.
1910000	1912000	These are all abbreviations of this contract.
1912000	1914000	BCPA, for example.
1914000	1916000	His full name is.
1916000	1918000	Business Cooperation and Patent Agreement.
1918000	1920000	TA is Transition Agreement.
1920000	1922000	Anyway, he is an abbreviation.
1922000	1924000	Anyway, he is an abbreviation.
1924000	1926000	In these contracts.
1926000	1928000	Qualcomm and Apple.
1928000	1930000	They went to talk.
1930000	1932000	Apple feels bad.
1932000	1934000	You go through the middle.
1934000	1936000	I want to talk to you directly.
1936000	1938000	I want to talk to you directly.
1938000	1940000	Qualcomm agreed.
1940000	1942000	After he agreed, he signed these contracts.
1942000	1944000	But he added some conditions in these contracts.
1944000	1946000	But he added some conditions in these contracts.
1946000	1948000	These conditions are fun.
1948000	1950000	What you see now.
1950000	1952000	Rebate Agreement and Chipset Supply Agreement.
1952000	1954000	These two.
1954000	1956000	It sounds very simple.
1956000	1958000	In fact, the specific content looks like this.
1958000	1960000	This is the lawsuit.
1960000	1962000	This is mentioned in Apple's lawsuit.
1962000	1964000	Of course, it contains a lot of confidential documents.
1964000	1966000	I don't know what confidentiality is.
1966000	1968000	I don't know what confidentiality is.
1968000	1970000	Mainly these two.
1970000	1972000	One is that you have to promise me.
1972000	1974000	You want me to provide.
1974000	1976000	You want me to provide you with chips.
1976000	1978000	You want me to provide you with chips.
1978000	1980000	He is the US Federal Trade Commission.
1980000	1982000	He is the US Federal Trade Commission.
1982000	1984000	No license.
1984000	1986000	No chip.
1986000	1988000	No license.
1988000	1990000	No license.
1990000	1992000	He said.
1992000	1994000	You want me to supply my high-quality modern chip.
1994000	1996000	But you have to accept the price.
1996000	1998000	But you have to accept the price.
1998000	2000000	But you have to accept the price.
2000000	2002000	You have to accept the price of my SEP.
2002000	2004000	You have to accept the price of my SEP.
2004000	2006000	Then he found out inside Apple.
2006000	2008000	It seems to be a bit higher than the market.
2008000	2010000	But Qualcomm said.
2010000	2012000	But Qualcomm said.
2012000	2014000	What can you do?
2014000	2016000	If you don't accept this price.
2016000	2018000	Then I can't provide you with this modern chip.
2018000	2020000	These two are bundled together.
2020000	2022000	The so-called bundled together.
2022000	2024000	I'm going to sell you a modern chip today.
2024000	2026000	But you have to accept.
2026000	2028000	Apple's own claim.
2028000	2030000	In fact, this case is still running.
2030000	2032000	In fact, this case is still running.
2032000	2034000	The so-called price is not FRIEND.
2034000	2036000	The so-called price is not FRIEND.
2036000	2038000	The so-called price is not FRIEND.
2038000	2040000	But sorry, I want 5% of the sales price.
2040000	2042000	But sorry, I want 5% of the sales price.
2042000	2044000	But sorry, I want 5% of the sales price.
2044000	2046000	But because Qualcomm has good quality.
2046000	2048000	And then he is a market leader.
2048000	2050000	And then there's a lot of patent planning.
2050000	2052000	So Apple has to accept this.
2052000	2054000	So Apple has to accept this.
2054000	2056000	This is the first point.
2056000	2058000	The so-called no license, no chip policy.
2058000	2060000	The so-called no license, no chip policy.
2060000	2062000	Apple must accept his contract terms.
2062000	2064000	Apple must accept his contract terms.
2064000	2066000	In exchange, you say, okay, you want me to use his.
2066000	2068000	I use Qualcomm's modern chip.
2068000	2070000	I use Qualcomm's modern chip.
2070000	2072000	But I have to accept a higher FRIEND price.
2072000	2074000	But I have to accept a higher FRIEND price.
2074000	2076000	You want me to supply this, right?
2076000	2078000	But Qualcomm, in order to make Apple feel.
2078000	2080000	But Qualcomm, in order to make Apple feel.
2080000	2082000	I didn't treat you badly.
2082000	2084000	He provides a rebate.
2084000	2086000	He provides a rebate.
2086000	2088000	This rebate is a fixed amount of price.
2088000	2090000	This rebate is a fixed amount of price.
2090000	2092000	Because you've been my client for a long time.
2092000	2094000	Because you've been my client for a long time.
2094000	2096000	Use my communication chip.
2096000	2098000	Then I'll give you a discount.
2098000	2100000	Then I'll give you a discount.
2100000	2102000	Then I'll give you a discount.
2102000	2104000	Because everyone is not learning law or business.
2104000	2106000	Because everyone is not learning law or business.
2106000	2108000	All the discounts in the mall.
2108000	2110000	All the discounts in the mall.
2110000	2112000	I'll give you a sum of money.
2112000	2114000	In fact, there are conditions.
2114000	2116000	Qualcomm said yes.
2116000	2118000	Apple said yes.
2118000	2120000	You give me a discount.
2120000	2122000	But Qualcomm said yes.
2122000	2124000	I'll give you a discount.
2124000	2126000	But you have to accept the following conditions.
2126000	2128000	The following conditions are two.
2128000	2130000	The following conditions are two.
2130000	2132000	The following conditions are two.
2132000	2134000	What are the conditions?
2134000	2136000	You have to use my communication chip.
2136000	2138000	You have to use my communication chip.
2138000	2140000	You can't jump the grass.
2140000	2142000	You can't use Intel.
2142000	2144000	You can't use Samsung.
2144000	2146000	You can't use Samsung.
2146000	2148000	You can't use my competitor's chip.
2148000	2150000	You can't use my competitor's chip.
2150000	2152000	It sounds reasonable.
2152000	2154000	It sounds reasonable.
2154000	2156000	The second point is that it's fun.
2156000	2158000	You can't go to any government unit.
2158000	2160000	You can't go to any government unit for investigation.
2162000	2164000	You can't make a lawsuit.
2172000	2174000	Let's start the debate.
2174000	2176000	First, I provide a discount
2176000	2178000	First, I provide a discount
2178000	2180000	But you have to use my chip.
2180000	2182000	But you have to use my chip.
2184000	2186000	Second, he says,
2186000	2188000	Second, I provide a discount
2188000	2190000	Second, I provide a discount
2190000	2192000	But you can't sue me.
2192000	2194000	But you can't sue me.
2194000	2196000	These are two points.
2196000	2198000	One is that you can't investigate me.
2198000	2200000	Completely lock you up.
2200000	2202000	The other point is that
2202000	2204000	You can't jump to another place.
2204000	2206000	You can't jump to another place.
2208000	2210000	You can't make a patent lawsuit.
2210000	2212000	You can't make a patent lawsuit.
2212000	2214000	This makes Apple very upset.
2214000	2216000	I can't use other people's chip.
2216000	2218000	I can't use other people's chip.
2218000	2220000	I can't use other people's chip.
2220000	2222000	Qualcomm uses the so-called
2222000	2224000	Qualcomm uses the so-called
2224000	2226000	No license, no chip.
2226000	2228000	The price is so high.
2228000	2230000	I don't know what you're doing.
2230000	2232000	I don't know what you're doing.
2232000	2234000	You are a market monopoly.
2234000	2236000	You are a market monopoly.
2236000	2238000	The whole thing is mixed up.
2238000	2240000	The whole case is mixed up.
2240000	2242000	Let Apple jump.
2242000	2243500	And caused a lot of
2243500	2245500	And caused a lot of
2245500	2247500	European Union.
2247500	2249500	And China-Taiwan.
2249500	2251500	Taiwan, you probably heard of it.
2251500	2253500	He was also investigating this case.
2253500	2255500	US and the U.S.
2255500	2257500	The United States Trade Commission is investigating the whole thing.
2257500	2259500	What is his legitimacy?
2259500	2261500	What is his legitimacy?
2267500	2269500	We want to investigate.
2269500	2271500	Qualcomm is doing this.
2271500	2273500	What is the reason behind this?
2273500	2275500	Why does Qualcomm
2275500	2277500	Why does Qualcomm
2277500	2279500	Bundle Rebate?
2279500	2281500	Bundle Rebate?
2281500	2283500	You can think about it.
2283500	2285500	If Qualcomm's quality is so good.
2285500	2287500	If Qualcomm's quality is so good.
2287500	2289500	Good quality, good market monopoly status.
2289500	2291500	Why does he provide a return to Apple?
2291500	2293500	Why does he provide a return to Apple?
2293500	2295500	Because I'm lying down.
2295500	2297500	Apple is coming.
2297500	2299500	You can think about it.
2299500	2301500	If you are a market monopoly status.
2301500	2303500	If you are a market monopoly status.
2303500	2305500	Basically, everyone's products
2305500	2307500	Almost use my modern chip.
2307500	2309500	Almost use my modern chip.
2309500	2311500	People can't catch up with me.
2311500	2313500	People can't catch up with me.
2313500	2315500	For example, he mentioned Intel.
2315500	2317500	For him, Intel is nothing.
2317500	2319500	He can't catch up with me at all.
2319500	2321500	He can't catch up with me at all.
2321500	2323500	I don't know if you have learned this.
2323500	2325500	I don't know if you have learned this.
2325500	2327500	The cost of investment is very high.
2328500	2329500	So this question has always been a question of ours.
2329500	2331500	So this question has always been a question of ours.
2331500	2333500	So this question has always been a question of ours.
2333500	2335500	The core question is if Qualcomm
2335500	2337500	If Qualcomm is in a market monopoly status.
2337500	2339500	If Qualcomm is in a market monopoly status.
2339500	2341500	In market leadership.
2341500	2343500	He is so wide in his specialist.
2343500	2345500	OK, and the quality of products is also very good.
2345500	2347500	Why does he provide this return to Apple?
2347500	2349500	What's going on in society?
2349500	2351500	What's going on in society?
2351500	2353500	And provided with this return.
2353500	2355500	And provided with this return.
2355500	2357500	This period is not just a year or two,
2357500	2359500	Perhaps a period of 3 to 5 years.
2359500	2361500	Perhaps a period of 3 to 5 years.
2361500	2363500	So he's actually still providing this rebate.
2363500	2365500	So he's actually still providing this rebate.
2365500	2367500	Then provide such a return to Apple.
2367500	2369500	Then the two requirements are that
2369500	2371500	Then the two requirements are that
2371500	2373500	And then you can't investigate me.
2373500	2375500	And then you have to accept mine.
2379500	2381500	Then issue
2381500	2383500	Is the value of Friends justified?
2383500	2385500	I'm not in today's report.
2385500	2387500	I'm not in today's report.
2387500	2389500	Because you say everything.
2389500	2391500	Apple says you are not a friend.
2391500	2393500	Qualcomm says I am a friend.
2393500	2395500	Because I have the whole patent I authorize to you.
2395500	2397500	Because I have the whole patent I authorize to you.
2397500	2399500	This know-how
2399500	2401500	And this so-called technical standard.
2401500	2403500	Of course, the price is so high.
2403500	2405500	Of course, the price is so high.
2405500	2407500	This is the problem of the industry.
2407500	2409500	This is the problem of the industry.
2409500	2411500	Today's problem is on this rebate.
2411500	2413500	So today I will tell you briefly.
2413500	2415500	That is to say, today I focus on the point.
2415500	2417500	Also this paper.
2417500	2419500	The point I studied with that classmate is.
2419500	2421500	Why Qualcomm
2421500	2423500	He will be so persistent.
2423500	2425500	To provide rebate this matter.
2425500	2427500	OK
2427500	2429500	I'm pausing again.
2429500	2431500	I'm pausing again.
2431500	2433500	See if you have any understanding of this case.
2433500	2435500	See if you have any understanding of this case.
2435500	2437500	Do you understand this story I just said?
2437500	2439500	Do you understand this story I just said?
2439500	2441500	Do you understand this story I just said?
2461500	2463500	Does anyone not understand?
2463500	2465500	What is the link that you don't understand?
2465500	2467500	If you don't understand.
2467500	2469500	Can you tell me which link you don't understand?
2497500	2503500	OK, no one responded.
2503500	2505500	Just pretend to understand.
2505500	2507500	On the basis of this knowledge,
2507500	2511500	we know that the hatred between Apple and Qualcomm has spread like this.
2511500	2513500	I was sued like this last year.
2513500	2523500	For me, this paper is a cross-sectional, cross-field cooperation paper.
2523500	2525500	I am responsible for the part of legal analysis.
2525500	2530500	My partner is responsible for the study of the Gantt theory model,
2530500	2536500	and the analysis of this whole thing from a commercial and economic perspective.
2536500	2539500	First of all, everyone is very curious.
2539500	2541500	From my point of view,
2541500	2543500	is there a similar case in the past?
2543500	2548500	Or how did they judge this rebate case?
2548500	2551500	Or what is the result of their judgment?
2551500	2553500	Let me report to you.
2554500	2557500	Simply put, this thing, this problem,
2557500	2561500	even the court itself is difficult to handle.
2565500	2568500	The red part you see on the screen
2568500	2571500	represents that the court is the red part.
2571500	2575500	The red case is the court's judgment.
2575500	2582500	The defendant, a company like Qualcomm, is illegal.
2582500	2584500	The black part is that I didn't mark it.
2584500	2587500	The black part of these cases
2587500	2590500	is considered legal by the court.
2590500	2592500	It's like a bond rebate.
2592500	2594500	You have to accept this.
2594500	2596500	If you want to use it,
2596500	2598500	just like the state of communication I just talked about.
2598500	2601500	If you want to use my stuff,
2601500	2604500	you want to become my supplier,
2604500	2606500	or I want to supply you with good stuff,
2606500	2608500	but you have to accept my conditions.
2609500	2611500	You can buy it,
2611500	2613500	but you have to buy a certain amount.
2613500	2614500	After you buy a certain amount,
2614500	2616500	I'll give you a rebate.
2616500	2617500	It's a similar concept.
2617500	2620500	It's a similar trading model.
2620500	2622500	I've sorted out these six cases.
2622500	2625500	Since none of them are legal,
2625500	2627500	I won't go over them one by one.
2627500	2629500	In fact, based on the results,
2629500	2631500	the results are divided.
2631500	2633500	The reasons are also divided.
2633500	2634500	The three red dots
2634500	2637500	are the different courts
2637500	2641500	for these cases.
2641500	2642500	So you can see
2642500	2644500	a very special phenomenon.
2644500	2647500	On the issue of rebate,
2647500	2649500	or bond rebate,
2649500	2651500	different courts have different reasons
2651500	2653500	and different results.
2655500	2656500	I'll talk about it later.
2656500	2658500	Qualcomm actually used this point.
2658500	2660500	It's not a use.
2660500	2662500	It should have seen this point.
2662500	2664500	We infer that he saw this point
2664500	2667500	and it may have become his reason
2667500	2672500	to continue to use his bond rebate to Apple.
2672500	2674500	This is our inference.
2674500	2676500	I'll talk about it later.
2676500	2677500	This is my preliminary investigation.
2677500	2679500	I found that
2681500	2682500	if the defendant
2682500	2685500	is illegal in the red case,
2685500	2687500	and legal in the black case,
2687500	2688500	I'll see
2688500	2689500	what common features
2689500	2691500	the red case has.
2691500	2693500	First, those illegal cases
2694500	2695500	in the red part.
2695500	2697500	I just showed you the red part.
2697500	2698500	These defendants
2698500	2703500	actually have some market monopoly.
2703500	2709500	So if you are a market monopolist,
2709500	2712500	it is likely to violate the antitrust law.
2712500	2715500	This is in our legal school.
2715500	2718500	If you learn this antitrust law,
2718500	2721500	basically this probability is very high.
2721500	2723500	If you have this market monopoly,
2723500	2727500	it is basically easy to violate the antitrust law.
2727500	2730500	This is very normal.
2730500	2731500	OK.
2731500	2733500	In the context of this bond rebate,
2733500	2735500	it is not an exception.
2735500	2737500	But we have seen
2737500	2739500	the second point is very interesting.
2739500	2740500	We see legal.
2740500	2742500	We compare these legal cases.
2742500	2745500	In the black cases,
2745500	2746500	we found that
2746500	2749500	the defendant may still be legal.
2749500	2750500	Why?
2750500	2752500	Just imagine.
2752500	2757500	In the black cases,
2757500	2760500	why do some judges
2760500	2762500	think they are legal
2762500	2764500	in the same situation?
2764500	2766500	Because they do not have
2766500	2768500	the effect of exclusion.
2768500	2769500	OK.
2769500	2770500	In general,
2770500	2771500	let's put it simply.
2771500	2773500	Antitrust law is actually
2773500	2777500	a law of corporate behavior.
2777500	2778500	OK.
2778500	2779500	It is the law of market economy
2779500	2780500	and corporate behavior.
2780500	2782500	So the market economy
2782500	2784500	should maintain a competitive attitude
2784500	2786500	instead of letting a person monopolize
2786500	2788500	or show a state of monopoly.
2788500	2789500	But imagine
2789500	2791500	if he was originally today.
2791500	2792500	Although he is a
2792500	2795500	through his sales behavior
2795500	2797500	and then his innovative business model
2797500	2799500	to achieve his market leadership position
2799500	2801500	but not monopoly leadership position
2801500	2803500	and then he wants to continue
2803500	2805500	to increase his market share
2805500	2808500	he may let other competitors
2808500	2811500	have some problems
2811500	2812500	or what is the situation.
2812500	2814500	The effect of his exclusion
2814500	2815500	may make some
2815500	2816500	for example,
2816500	2817500	competition or something
2817500	2820500	he may let other competitors
2820500	2821500	he can not come in
2821500	2823500	or potential competitors
2823500	2824500	for example,
2824500	2825500	as I just mentioned
2825500	2826500	Intel
2826500	2828500	Intel in the so-called
2828500	2830500	this computer CPU
2830500	2831500	everyone should know
2831500	2832500	are doing very well
2832500	2833500	this Pentium
2833500	2834500	Pentium series are doing very well
2834500	2835500	and then with this
2835500	2836500	Microsoft
2836500	2838500	in the late 90s
2838500	2839500	is almost
2839500	2840500	this is almost
2840500	2842500	very few computers
2842500	2843500	but he is in
2843500	2844500	the communication chip inside
2844500	2846500	he just can not stand
2846500	2847500	he is not
2847500	2849500	the so-called position
2849500	2852500	that he is coming in today
2852500	2854500	but in fact
2854500	2855500	he wants to come in
2855500	2857500	as long as he invests enough money
2857500	2858500	in fact, Intel
2858500	2859500	if you go to check
2859500	2860500	in fact, he is also doing
2860500	2861500	just keep doing bad
2861500	2862500	OK
2862500	2863500	but not to say
2863500	2864500	he can not do
2864500	2865500	this is the difference
2865500	2866500	that is
2866500	2867500	I'll talk about
2867500	2868500	this is the difference
2868500	2869500	that is the so-called can not do
2869500	2870500	that is to say
2870500	2871500	I used some business behavior
2871500	2872500	for example, I
2872500	2873500	I join all the people
2873500	2874500	I do not provide you material
2874500	2875500	you can not do
2875500	2876500	this is not
2876500	2877500	this must be against
2877500	2878500	this anti-trust law
2878500	2879500	because this is against
2879500	2880500	this
2880500	2881500	this market competition
2881500	2882500	that is
2882500	2883500	the current situation
2883500	2884500	is to say
2884500	2885500	we observed
2885500	2886500	the first few
2886500	2887500	black cases
2887500	2888500	we found that
2888500	2889500	those cases
2889500	2890500	Why is it legal
2890500	2892500	because those potential competitors
2892500	2893500	he was not excluded
2893500	2894500	into this market
2894500	2895500	he can still
2895500	2896500	enter this market
2896500	2897500	competition
2897500	2898500	means that
2898500	2899500	his entry barrier
2899500	2900500	is low
2900500	2901500	that entry barrier
2901500	2902500	low, then
2902500	2903500	the court saw
2903500	2904500	low entry barrier
2904500	2905500	that is to say
2905500	2906500	that you
2906500	2907500	may come in today
2907500	2908500	but you choose not to come in
2908500	2909500	or you
2909500	2910500	may have other
2910500	2911500	commercial considerations
2911500	2912500	but not come in
2912500	2913500	so
2913500	2914500	before
2914500	2915500	I go back
2915500	2916500	before
2916500	2917500	these black cases
2917500	2918500	Why would be
2918500	2919500	legal
2919500	2920500	these Bundle
2920500	2921500	Rebate
2921500	2922500	because
2922500	2923500	other competitors
2923500	2924500	he
2924500	2925500	was not excluded
2925500	2926500	he still came in
2926500	2927500	he still joined
2927500	2928500	this industry
2928500	2929500	continue to compete
2929500	2930500	with these defendants
2930500	2931500	for example,
2931500	2932500	if the defendant
2932500	2933500	is Gaotong
2933500	2934500	he still
2934500	2935500	come in
2935500	2936500	this industry
2936500	2937500	to compete
2937500	2938500	that is
2938500	2939500	like we
2939500	2940500	discussed today
2940500	2941500	Gaotong
2941500	2942500	is not the only
2942500	2943500	one
2943500	2944500	to provide
2944500	2945500	Samsung
2945500	2946500	also has
2946500	2947500	Huawei
2947500	2948500	also has
2948500	2949500	OK
2949500	2950500	so
2950500	2951500	you
2951500	2952500	know
2952500	2953500	that
2953500	2954500	although Gaotong
2954500	2955500	in this market
2955500	2956500	is based on
2956500	2957500	monopoly status
2957500	2958500	based on this
