start	end	text
1293000	1295000	can be seen as
1295000	1297000	the first one is
1297000	1299000	my average error is about 6%.
1299000	1301000	That is to say, my average price
1301000	1303000	is about 6% higher than the theory.
1303000	1305000	The next one is
1305000	1307000	my Smith Alpha.
1307000	1309000	The fluctuation rate
1309000	1311000	is about 30%.
1311000	1313000	The efficiency
1313000	1315000	is about 84%.
1315000	1317000	In fact,
1317000	1319000	these numbers are
1319000	1321000	significantly different from the theory.
1321000	1323000	However,
1323000	1325000	this is related to another problem.
1325000	1327000	In our lab,
1327000	1329000	we often let our customers
1329000	1331000	play the same game for 10 or 20 rounds.
1331000	1333000	At this time,
1333000	1335000	after more than 10 rounds,
1335000	1337000	the price will become very stable.
1337000	1339000	But here,
1339000	1341000	if we play for 10 rounds,
1341000	1343000	the customer may have gone up to level 3.
1343000	1345000	This is why the price
1345000	1347000	here is unstable.
1347000	1349000	However,
1349000	1351000	I will try to show
1351000	1353000	if our students
1353000	1355000	can play enough rounds,
1355000	1357000	where will they end up?
1357000	1359000	This is the result
1359000	1361000	of the double option.
1361000	1363000	Let's continue to see
1363000	1365000	the whole distribution.
1373000	1375000	I don't know
1375000	1377000	which computer
1377000	1379000	I used to jump out.
1379000	1381000	I don't know
1381000	1383000	what to do now.
1383000	1385000	Thank you for reminding me.
1385000	1387000	I hope you don't
1387000	1389000	knock on my door anymore.
1389000	1391000	I don't want to leave the group.
1391000	1393000	Thank you.
1393000	1395000	Let's continue.
1395000	1397000	First, let's see
1397000	1399000	the whole distribution of Proposal Offer.
1399000	1401000	Because
1401000	1403000	in our game design,
1403000	1405000	the teacher can decide
1405000	1407000	whether to play one round, two rounds,
1407000	1409000	or several rounds.
1409000	1411000	If you play more than two rounds,
1411000	1413000	it will become a repeat game.
1413000	1415000	If we divide the data
1415000	1417000	into a repeat game and a single game,
1417000	1419000	we can see
1419000	1421000	that
1421000	1423000	the first point
1423000	1425000	is
1425000	1427000	theoretical prediction.
1427000	1429000	This is theoretical prediction.
1429000	1431000	This is theoretical prediction.
1431000	1433000	So here,
1433000	1435000	whether it is a one-shot game or a repeat game,
1435000	1437000	only about 10% of the audience
1437000	1439000	played on the theoretical prediction.
1439000	1441000	Next, we have seen
1441000	1443000	50% of the audience
1443000	1445000	played on the theoretical prediction.
1445000	1447000	Next, we have seen
1447000	1449000	50% of the audience
1449000	1451000	played on the theoretical prediction.
1451000	1453000	The first observation
1453000	1455000	is that we have a lot of Proposal Offer
1455000	1457000	on the natural focal point.
1457000	1459000	So I played 0,
1459000	1461000	10, 20, 30.
1461000	1463000	This is the first observation.
1463000	1465000	The second observation is that
1465000	1467000	only 6% of the audience
1467000	1469000	gave themselves
1469000	1471000	less than the Proposal Offer.
1471000	1473000	I gave myself more.
1473000	1475000	In this game,
1475000	1477000	there should be a first mover advantage.
1477000	1479000	I should give you 50% if I'm great.
1479000	1481000	According to the theory, I should not give you 10%.
1481000	1483000	But only 6% of the audience
1483000	1485000	gave more than the Proposal Offer.
1485000	1487000	This is the first observation.
1487000	1489000	Next, let's compare
1489000	1491000	the distribution with ROF.
1491000	1493000	This is ROF's distribution
1493000	1495000	in 1991.
1495000	1497000	As Mr. Zhang said,
1497000	1499000	we did not do a statistical analysis.
1499000	1501000	So we can only see
1501000	1503000	the distribution characteristics.
1503000	1505000	The first observation is that
1505000	1507000	the density is
1507000	1509000	about 50% to 40%.
1509000	1511000	The density is about 50% to 40%.
1511000	1513000	But this is
1513000	1515000	ROF's distribution.
1515000	1517000	So we can
1517000	1519000	give them the result.
1519000	1521000	In addition,
1521000	1523000	the biggest difference
1523000	1525000	between ROF and ROF
1525000	1527000	is that almost no one
1527000	1529000	played in the theoretical prediction.
1529000	1531000	But about 10% of the audience
1531000	1533000	played in the theoretical prediction.
1533000	1535000	In fact,
1535000	1537000	at least I and Colin
1537000	1539000	are not sure.
1539000	1541000	This may be the reason for the prediction option.
1541000	1543000	In the beginning of a game,
1543000	1545000	the prediction ball
1545000	1547000	is placed on the theoretical prediction.
1547000	1549000	So if the students
1549000	1551000	press the button
1551000	1553000	without thinking,
1553000	1555000	it means that
1555000	1557000	there is no strategy at all.
1557000	1559000	So 10% of the audience
1559000	1561000	may play in the theoretical prediction.
1561000	1563000	Of course, it may also be affected by the prediction option.
1563000	1565000	But this is...
1565000	1567000	Do you have the response time here?
1567000	1569000	I will fix it later.
1569000	1571000	According to your hypothesis,
1571000	1573000	the response time should be the lowest.
1573000	1575000	But the response time is actually very high.
1575000	1577000	But I will show the result later.
1577000	1579000	So it may not be the result of the prediction option.
1579000	1581000	Yes.
1581000	1583000	But...
1583000	1585000	Sorry, Bo-Xuan.
1585000	1587000	Can you show the previous video?
1587000	1589000	OK.
1589000	1591000	Because I just thought
1591000	1593000	if you said it was because of the default option,
1593000	1595000	then you should see...
1595000	1597000	Because the information of ROF
1597000	1599000	is very rare.
1599000	1601000	Almost none.
1601000	1603000	Yes.
1603000	1605000	But the people who chose 1
1605000	1607000	seem to be more likely than 0.
1607000	1609000	Yes.
1609000	1611000	So...
1611000	1613000	Although 0 is so high,
1613000	1615000	it may be the effect of the default option.
1615000	1617000	But it seems that there are more people
1617000	1619000	who are more likely.
1619000	1621000	If you look at the balance
1621000	1623000	as 0 or 1,
1623000	1625000	there are more people who chose 1.
1625000	1627000	Yes.
1627000	1629000	That's what I think.
1629000	1631000	Thank you for this comment.
1631000	1633000	But it is indeed...
1633000	1635000	It should be...
1635000	1637000	In this...
1637000	1639000	There should be a lot of people who play with the theory.
1639000	1641000	But it is indeed the default option.
1641000	1643000	This effect is indeed a confirmation.
1643000	1645000	But I will continue to talk about it.
1645000	1647000	Then here is
1647000	1649000	our acceptance rate.
1649000	1651000	Because I think this result is very cool.
1651000	1653000	So it doesn't matter if I talk about it later.
1653000	1655000	I will talk about it later.
1655000	1657000	First of all, because what we talked about earlier
1657000	1659000	is the unconditional acceptance rate.
1659000	1661000	What is more interesting now
1661000	1663000	is to measure the conditional acceptance rate.
1663000	1665000	Unconditional...
1665000	1667000	What is the number of offers I see?
1667000	1669000	That is to say, because we measure
1669000	1671000	the expected value of the conditions.
1671000	1673000	Then this is actually
1673000	1675000	a function of an offer.
1675000	1677000	So on this graph,
1677000	1679000	my X-axis shows
1679000	1681000	how many proposal offers I see.
1681000	1683000	What is the acceptance rate?
1683000	1685000	OK.
1685000	1687000	In this graph, the black dot represents the information of one-shot game.
1687000	1689000	The orange dot represents the information of repeat game.
1689000	1691000	Next,
1691000	1693000	the size of each point
1693000	1695000	represents
1695000	1697000	the density of the histogram
1697000	1699000	we saw earlier.
1699000	1701000	So if you put the size of this ball
1701000	1703000	projected to the X-axis,
1703000	1705000	it becomes the entire histogram.
1705000	1707000	OK.
1707000	1709000	Next, because when I was checking the data,
1709000	1711000	between 49 and 50,
1711000	1713000	there is actually a jump of about 20%.
1713000	1715000	So I thought it was strange.
1715000	1717000	So I used a specification
1717000	1719000	to measure
1719000	1721000	the P-splice linear
1721000	1723000	specification.
1723000	1725000	So what you can see
1725000	1727000	is that I think it is quite special.
1727000	1729000	If you are less than 50,
1729000	1731000	you see
1731000	1733000	that your acceptance rate is this curve.
1733000	1735000	When it is greater than 50,
1735000	1737000	there will be a big break here.
1737000	1739000	This is completely obvious.
1739000	1741000	It is very obvious.
1741000	1743000	When we measure the standard error,
1743000	1745000	we also use
1745000	1747000	a cluster.
1747000	1749000	We have a cluster at the session level.
1749000	1751000	So we use the most conservative estimation
1751000	1753000	to estimate our variability.
1753000	1755000	So in this case,
1755000	1757000	it is also very obvious.
1757000	1759000	If we put all the data together,
1759000	1761000	there is a jump of about 20% to 21%.
1761000	1763000	If we divide it into one-shot game
1763000	1765000	and repeat game,
1765000	1767000	the jump is about 16%.
1767000	1769000	If we divide it into one-shot game
1769000	1771000	and repeat game, the jump is about 26%.
1771000	1773000	First of all,
1773000	1775000	this phenomenon has not been seen
1775000	1777000	in the first 50 years.
1777000	1779000	So I think it is a very cool discovery.
1779000	1781000	Next, let's talk about 1.
1781000	1783000	First of all,
1783000	1785000	this interpretation is actually very complicated.
1785000	1787000	Because we have a lot of confounds here
1787000	1789000	that our database cannot detect.
1789000	1791000	But what we can be sure is that
1791000	1793000	at least the source of this break
1793000	1795000	is the difference in payoffs.
1795000	1797000	Because you can see that
1797000	1799000	when we come in from the left B,
1799000	1801000	you can come in from 49.99999.
1801000	1803000	Then the next is coming in from the right B,
1803000	1805000	it is about 50.0000001.
1805000	1807000	In fact, this gap is less than
1807000	1809000	how small your Epsilon is.
1809000	1811000	So this effect is definitely not
1811000	1813000	from monetary payoffs.
1813000	1815000	Or even if you are in a hypothetical state,
1815000	1817000	it is basically not from
1817000	1819000	how much your payoff is.
1819000	1821000	So it is very possible that
1821000	1823000	you have to consider
1823000	1825000	how other people
1825000	1827000	distribute the whole proposal.
1829000	1831000	Next, there are many interpretations here.
1831000	1833000	We can't uniquely pin down.
1833000	1835000	It may be like
1835000	1837000	because you are from 49.999 to 50.
1837000	1839000	There is a big gap here,
1839000	1841000	which is equality.
1841000	1843000	Because this paragraph can also mean
1843000	1845000	that I may be very, very care.
1845000	1847000	Am I equal to you?
1847000	1849000	Or this is the first one.
1849000	1851000	Or another one is that
1851000	1853000	if you don't give me 50,
1853000	1855000	I may punish you.
1855000	1857000	So this is why this paragraph
1857000	1859000	may be 10% more in the repeated game.
1859000	1861000	It may be that this 10% is more
1861000	1863000	that I want to punish you.
1863000	1865000	Or I may care about my fairness.
1865000	1867000	Or I simply
1867000	1869000	since we are not playing real money,
1869000	1871000	I just don't want to lose you.
1871000	1873000	So it means that
1873000	1875000	my acceptance rate is relatively low.
1875000	1877000	But when I can at least not lose you,
1877000	1879000	my acceptance rate is about the same.
1879000	1881000	This is what we see
1881000	1883000	in the data.
1883000	1885000	I want to ask
1885000	1887000	what is your idea?
1891000	1893000	I don't know.
1895000	1897000	Before you do this,
1897000	1899000	there is a problem.
1903000	1905000	Although you know a lot,
1905000	1907000	you just showed us
1907000	1909000	that there are very few offers above 50.
1909000	1911000	There are about 600.
1913000	1915000	So
1915000	1917000	your estimate of acceptance rate
1917000	1919000	is because
1919000	1921000	you are not using strategy method.
1921000	1923000	You are showing an offer.
1923000	1925000	So it means that
1925000	1927000	the point of return you are running now
1927000	1929000	when it is below 50
1931000	1933000	the variation
1933000	1935000	is relatively good.
1935000	1937000	But when it is above 50,
1939000	1941000	your estimate may not be stable.
1943000	1945000	But this point
1945000	1947000	is really interesting.
1947000	1949000	Because
1949000	1951000	let me think about it.
1955000	1957000	Have you ever tried
1957000	1959000	not to use
1959000	1961000	a linear return when it is below 50?
1961000	1963000	I haven't tried it yet.
1963000	1965000	But I want to try quadratic.
1967000	1969000	There is another possibility.
1969000	1971000	It is not like a breakpoint.
1971000	1973000	It is a
1973000	1975000	more complicated non-linear.
1977000	1979000	Because you fit linear,
1979000	1981000	it looks like a breakpoint.
1981000	1983000	If you look at the data directly,
1983000	1985000	it looks at least
1985000	1987000	I think it is quite linear.
1987000	1989000	If you look at the
1989000	1991000	orange repeating game,
1991000	1993000	it looks like
1993000	1995000	it is a
1995000	1997000	falling down.
1997000	1999000	But it is stable
1999000	2001000	when it is above 40.
2001000	2003000	It is like quadratic.
2003000	2005000	If you only look at
2005000	2007000	black,
2007000	2009000	it looks like
2009000	2011000	it is
2011000	2013000	between 20 and 50.
2013000	2015000	It is a steep drop.
2015000	2017000	But
2017000	2019000	it is stable
2019000	2021000	when it is below 20.
2021000	2023000	So
2023000	2025000	there is a possibility here.
2025000	2027000	It's just because
2027000	2029000	you fit a
2029000	2031000	straight line relationship.
2031000	2033000	Anyway, I will try quadratic.
2033000	2035000	But this is
2035000	2037000	what I estimated.
2037000	2039000	I think it is quite interesting.
2039000	2041000	If this is true,
2041000	2043000	how do we
2043000	2045000	reproduce this
2045000	2047000	breakpoint in the lab?
2047000	2049000	Let's look at
2049000	2051000	the result of ROS.
2051000	2053000	If we look at the data of ROS,
2053000	2055000	this breakpoint is completely invisible.
2057000	2059000	I think this result
2059000	2061000	is quite special.
2061000	2063000	We have a lot of work hypothesis
2063000	2065000	running at the same time.
2065000	2067000	But we have tried
2067000	2069000	a power test.
2069000	2071000	If we only draw the data,
2071000	2073000	the sample number is about 0.
2073000	2075000	So if we only draw 10% of the data,
2075000	2077000	can we estimate this breakpoint?
2077000	2079000	In our data, we can still estimate this breakpoint.
2079000	2081000	So it may not be because
2081000	2083000	of the problem of power in statistics.
2083000	2085000	Then another
2085000	2087000	work hypothesis is
2087000	2089000	hypothetical stake.
2089000	2091000	Is it because it's all
2091000	2093000	not about making money?
2093000	2095000	So I care more about the ranking between you and me.
2095000	2097000	At least I don't want to lose you.
2097000	2099000	So
2099000	2101000	this is my current work hypothesis.
2101000	2103000	This may be
2103000	2105000	the next article to do
2105000	2107000	is how to reproduce this breakpoint in the lab.
2107000	2109000	I think it's quite interesting.
2109000	2111000	Can you remind us
2111000	2113000	again
2113000	2115000	the population composition of your data?
2115000	2117000	For example,
2117000	2119000	the proportion of each state.
2119000	2121000	We have
2121000	2123000	seen that
2123000	2125000	the United States has the West,
2125000	2127000	the Middle West,
2127000	2129000	the Northeast,
2129000	2131000	the South America,
2131000	2133000	Canada,
2133000	2135000	the United Kingdom,
2135000	2137000	Spain,
2137000	2139000	China, Japan,
2139000	2141000	and Singapore.
2141000	2143000	What about the proportion?
2143000	2145000	About 80% of the data is in the North,
2145000	2147000	about 10% in Europe,
2147000	2149000	and 10% in Asia.
2149000	2151000	OK.
2151000	2153000	So overall,
2153000	2155000	this result
2155000	2157000	is more conservative.
2157000	2159000	It's based on the North America,
2159000	2161000	right?
2161000	2163000	Yes.
2163000	2165000	OK, I just want to ask.
2165000	2167000	But I want to add
2167000	2169000	that the problem is
2169000	2171000	all the results in the lab
2171000	2173000	are not in the North America.
2173000	2175000	Yes.
2175000	2177000	That's true.
2177000	2179000	OK.
2179000	2181000	Then I'll...
2181000	2183000	Bo-Xuan,
2183000	2185000	if you want to compare
2185000	2187000	with Ross's article,
2187000	2189000	Ross's article is mainly not in the North America,
2189000	2191000	but the data of
2191000	2193000	other works
2193000	2195000	such as Automaton Game
2195000	2197000	can be observed.
2197000	2199000	I have almost never seen any shortcomings.
2199000	2201000	Yes.
2201000	2203000	OK.
2203000	2205000	Because of the time...
2205000	2207000	You can go first.
2207000	2209000	I'll go first.
2209000	2211000	I have a question.
2211000	2213000	Because the article was written
2213000	2215000	about 20 years ago,
2215000	2217000	right?
2217000	2219000	Yes.
2219000	2221000	Do you think the change of time
2221000	2223000	has a big impact on the data?
2223000	2225000	Of course it's possible.
2225000	2227000	Because a lot of social preferences
2227000	2229000	may change with time.
2229000	2231000	For example, the value of Taiwanese
2231000	2233000	may change every few years.
2233000	2235000	So it's true that
2235000	2237000	there may be a difference.
2237000	2239000	But we can see that
2239000	2241000	there is a difference.
2241000	2243000	If we look at it simply,
2243000	2245000	if it has any impact on the shortcomings,
2245000	2247000	maybe it's okay.
2247000	2249000	Because the shortcomings may be a mirror effect.
2249000	2251000	But this is a big problem.
2251000	2253000	We can talk about it later.
2253000	2255000	Then I'll go on.
2255000	2257000	Finally, the teacher just said
2257000	2259000	to show the reaction time.
2259000	2261000	Because our server does record
2261000	2263000	the reaction time.
2263000	2265000	Then I look here.
2265000	2267000	Because in one-shot game and repeated game,
2267000	2269000	the reaction time is very similar.
2269000	2271000	So I only use one-shot game
2271000	2273000	to demonstrate the result.
2273000	2275000	First of all, the black line,
2275000	2277000	the y-axis is the reaction time.
2277000	2279000	The black line represents the reaction time.
2279000	2281000	Then the black line is
2281000	2283000	our lowest estimation.
2283000	2285000	Then the orange line,
2285000	2287000	the y-axis is my acceptance rate.
2287000	2289000	Then this is
2289000	2291000	also my lowest estimation.
2291000	2293000	Then below me,
2293000	2295000	the x-axis is
2295000	2297000	my offer.
2297000	2299000	If you don't have any concept,
2299000	2301000	you can think of it as
2301000	2303000	doing a return in each section
2303000	2305000	to measure it.
2305000	2307000	This means that
2307000	2309000	I'm fitting the data
2309000	2311000	when it's close to infinity.
2311000	2313000	It's very close.
2313000	2315000	So what the teacher saw at the beginning
2315000	2317000	was at zero.
2317000	2319000	It actually took a lot of time.
2319000	2321000	It actually took almost 20 seconds
2321000	2323000	to make a decision.
2323000	2325000	However,
2325000	2327000	at 50,
2327000	2329000	there was a very sharp drop.
2329000	2331000	It only took about 8 seconds
2331000	2333000	to make a decision.
2333000	2335000	This means that
2335000	2337000	50-50 may be
2337000	2339000	a very special allocation.
2339000	2341000	At least for them,
2341000	2343000	if I see 50-50,
2343000	2345000	I don't have to think too much
2345000	2347000	and I can decide to accept it.
2347000	2349000	Another thing is
2349000	2351000	we see a very sharp kink
2351000	2353000	at 50-50.
2353000	2355000	It's true that
2355000	2357000	no matter how
2357000	2359000	qualitative you are,
2359000	2361000	at least we can still see something.
2361000	2363000	This is the data
2363000	2365000	on the reaction time.
2365000	2367000	However,
2367000	2369000	the interpretation is quite special.
2369000	2371000	At least for Show,
2371000	2373000	at 50-50,
2373000	2375000	we can spend very little time
2375000	2377000	to make a decision.
2377000	2379000	You can't record
2379000	2381000	the proposal time
2381000	2383000	to enter the game.
2383000	2385000	Because if you want to see
2385000	2387000	if it's default...
2387000	2389000	We can see
2389000	2391000	the time it takes
2391000	2393000	to enter the game.
2393000	2395000	If you want to see
2395000	2397000	if it's the default option
2397000	2399000	that causes a lot of people to raise their hands,
2399000	2401000	you should look at the proposal time.
2401000	2403000	Yes, you're right.
2405000	2407000	We did look at the proposal time.
2407000	2409000	But I remember
2409000	2411000	it took a lot of time here.
2415000	2417000	Hello?
2417000	2419000	Let me respond.
2419000	2421000	At the close to 0,
2421000	2423000	you said
2423000	2425000	it took a lot of time.
2425000	2427000	You mentioned
2427000	2429000	that
2429000	2431000	you were thinking
2431000	2433000	that
2433000	2435000	at 0,
2435000	2437000	there would be a lot of people raising their hands.
2437000	2439000	At that time,
2439000	2441000	I was wondering
2441000	2443000	if it was because the starting point
2443000	2445000	of the slider bar was 0.
2445000	2447000	However,
2447000	2449000	if they spent a lot of time
2449000	2451000	to think about it,
2451000	2453000	I don't think
2453000	2455000	it's because...
2455000	2457000	I think it's a bit like
2457000	2459000	negating
2459000	2461000	the explanation you mentioned
2461000	2463000	at the beginning.
2463000	2465000	I just accepted it casually.
2465000	2467000	That's right.
2467000	2469000	But it took a lot of time here.
2469000	2471000	It took a lot of time
2471000	2473000	to respond.
2473000	2475000	But I should show you
2475000	2477000	the proposal time.
2477000	2479000	But it's true.
2479000	2481000	It's funny to explain the coding.
2481000	2483000	It took a lot of time
2483000	2485000	to look at this.
2485000	2487000	A lot of people didn't want to accept it.
2487000	2489000	It took me a long time
2489000	2491000	to accept it.
2491000	2493000	That's right.
2493000	2495000	Bo-xuan, you can
2495000	2497000	split the responder into
2497000	2499000	accepting and not accepting.
2499000	2501000	Okay.
2501000	2503000	This point is quite special.
2503000	2505000	I'll split it.
2505000	2507000	I'll write it down.
2509000	2511000	Next,
2511000	2513000	I still have some time.
2513000	2515000	I'm going to talk about the result of double option.
2515000	2517000	Double option, first of all...
2517000	2519000	Bo-xuan, before you enter the double option,
2519000	2521000	let's talk about the
2521000	2523000	Automatic Game breakpoint.
2523000	2525000	I was just thinking,
2525000	2527000	you just said that one possibility of the breakpoint
2527000	2529000	is that everyone cares about fairness.
2529000	2531000	The other possibility is that
2531000	2533000	everyone cares about
2533000	2535000	not counting you.
2535000	2537000	Is there a way to look at
2537000	2539000	the 50 proposed
2539000	2541000	in your data?
2541000	2543000	Is the acceptance rate
2543000	2545000	particularly high?
2545000	2547000	Or is it the whole breakpoint
2547000	2549000	after the breakpoint is raised
2549000	2551000	to form a frequency curve?
2551000	2553000	Because if you care about fairness,
2553000	2555000	maybe after 50 is particularly high,
2555000	2557000	there will be another breakpoint
2557000	2559000	after 51 and 52.
2559000	2561000	One-shot game is like this.
2561000	2563000	There is no repeated game.
2563000	2565000	Okay.
2565000	2567000	I'll keep talking.
2567000	2569000	I'm afraid I don't have enough time.
2569000	2571000	The next double option is...
2571000	2573000	The first thing I want to show here
2573000	2575000	is what the data looks like.
2575000	2577000	This is our predicted market.
2577000	2579000	The next one is
2579000	2581000	the price fluctuation.
2581000	2583000	This is just an example.
2583000	2585000	I have 10 regions here.
2585000	2587000	I choose a market for each region.
2587000	2589000	I draw it out to show you
2589000	2591000	what it looks like.
2591000	2593000	You can see that I only draw four periods.
2593000	2595000	Because the length is about four periods.
2595000	2597000	If you look at the first period,
2597000	2599000	everyone may be very noisy.
2599000	2601000	Then look at the second and third periods.
2601000	2603000	In fact, the price fluctuation
2603000	2605000	becomes less.
2605000	2607000	Then look at the fourth period.
2607000	2609000	The more they play, the more stable they become.
2609000	2611000	So what we want to see here is
2611000	2613000	that under the double option market mechanism,
2613000	2615000	as long as they play about three or four times,
2615000	2617000	consumers can find
2617000	2619000	a balanced price, even if I don't tell them anything.
2619000	2621000	The next thing is
2621000	2623000	what I said earlier.
2623000	2625000	Because our bidders play very short,
2625000	2627000	we want to estimate
