start	end	text
0	10000	I'm very happy to have you all here today for Lin Bo-xuan's talk.
10000	14000	Let me first introduce our speaker, Lin Bo-xuan.
14000	20000	She studied economics at NTU, and is now a sophomore at NTU Economics.
20000	29000	Currently, she is an intern at a startup company called ModLab in Pasadena, California.
29000	35000	Her main topic is game-related data analysis.
35000	39000	Today, we are very happy to invite Lin Bo-xuan to give a talk
39000	43000	about how to use class experiment data to test the stability of the final window match
43000	46000	and the results of the double-sided auction experiment.
46000	50000	Let's welcome Lin Bo-xuan to start her talk.
50000	52000	Thank you, Director Lin.
52000	55000	Without further ado, I'll get started.
55000	57000	Today's topic is very simple.
57000	59000	I'll just ask one question.
59000	65000	Are the results of the economic experiment we see on paper stable?
65000	68000	To be honest, in the field of economic experiments,
68000	70000	people are the ones doing the research.
70000	73000	So, if you want to say that a result is stable,
73000	75000	you can't just say,
75000	78000	if I were in Taiwan, I'd do this result.
78000	80000	Or, if I were in a victim group, I'd do that.
80000	84000	Often, we need to do a lot of different victim groups.
84000	87000	If we were to say that this result is right for all humans,
87000	90000	then it should be right to take the same result
90000	93000	and do the same experiment in every place.
93000	96000	But in fact, we often know that
96000	98000	this situation is often not necessarily right.
98000	102000	For example, let's say we measure the risk.
102000	104000	In Taiwan alone,
104000	106000	if you only measure the risk for men or women,
106000	108000	the set of risks may be different.
108000	111000	So, in fact, if we want to measure stability,
111000	113000	that is, if we want to do the same experiment
113000	116000	in many places, the result is wrong.
116000	118000	But often,
118000	120000	what we want to do
120000	123000	is actually very difficult in the experiment.
123000	125000	First, because economists know
125000	127000	that our research funds are limited.
127000	129000	Second, our time is limited.
129000	131000	So, often, it's hard for us to think about
131000	133000	whether we can do the same experiment
133000	134000	in every corner of the world.
134000	136000	So, this is a very difficult thing.
136000	138000	Because, mainly, there is a big limitation in economic experiments.
138000	141000	In fact, we hope to provide real benefits to consumers.
141000	143000	Because of this,
143000	146000	we need a lot of money and a lot of time.
146000	148000	We need to have a good enough time design.
148000	151000	Basically, it will be impossible to measure in every place in the world.
151000	153000	So, because of this,
153000	155000	we did not give up
155000	157000	to test whether our experiment results are stable or not.
157000	159000	So, there are two main ways
159000	161000	to do this on our website.
161000	163000	First,
163000	165000	for example,
165000	167000	in the case of Ultraman Game,
167000	169000	in fact, in the past 50 years,
169000	171000	there have been a lot of studies on the series of Ultraman Game.
171000	173000	So, basically,
173000	175000	there is a method
175000	177000	that we take the previous experimental data
177000	179000	and break it into a very large database
179000	181000	to do some meta-analysis here.
181000	183000	Just like what Usterbeck did in 2004.
183000	185000	But, like this,
185000	187000	there is a problem.
187000	189000	In fact, many times,
189000	191000	all the previous studies of Ultraman Game
191000	193000	are the same game,
193000	195000	but their context is a bit different.
195000	197000	So, in practice,
197000	199000	many times, your usage is different,
199000	201000	or your context is different,
201000	203000	which may affect the result of the experiment.
203000	205000	So, when we use this method,
205000	207000	we have already lost the control
207000	209000	of our experimental design.
209000	211000	Although this method
211000	213000	can make our database very rich.
213000	215000	The other way is that
215000	217000	we control the same experimental design,
217000	219000	but go to other places
219000	221000	to do the same experiment.
221000	223000	Just like Roth,
223000	225000	he has been to four countries in the world.
225000	227000	One is the United States,
227000	229000	one is Slovenia,
229000	231000	one is Israel,
231000	233000	and the other is Japan.
233000	235000	He went to these four countries
235000	237000	to do the same final analysis
237000	239000	and market game
239000	241000	to see if the results of these four countries
241000	243000	were stable or not.
243000	245000	This is the largest experiment
245000	247000	so far.
247000	249000	But, from this point of view,
249000	251000	even so,
251000	253000	we can only do it in a small number of places.
253000	255000	So, in this way,
255000	257000	although you can
257000	259000	control your experimental design,
259000	261000	but you can't make
261000	263000	your database very large.
263000	265000	So, today,
265000	267000	what we are doing is
267000	269000	using the third method.
269000	271000	It's like
271000	273000	you want to test the stability
273000	275000	of a result of an experiment.
275000	277000	There are three things to do.
277000	279000	One is the real sound,
279000	281000	and the third is to have a large enough sample.
281000	283000	The first two methods
283000	285000	are to give up
285000	287000	and control the experimental design.
287000	289000	The other is to give up a large enough database.
289000	291000	But what we are going to do today
291000	293000	is to have a large enough database,
293000	295000	and the design
295000	297000	is exactly the same.
297000	299000	But what we give up today is to give up
299000	301000	and control the sound.
301000	303000	In this case,
303000	305000	I can only say that we are the first article
305000	307000	to do this.
307000	309000	We have a lot of data.
309000	311000	But when we give up
311000	313000	and control the sound,
313000	315000	our experiment
315000	317000	will be done in a very
317000	319000	no-easy situation.
319000	321000	So, if we can
321000	323000	reproduce
323000	325000	all the experimental results
325000	327000	in the lab,
327000	329000	it means that the experimental results
329000	331000	are very stable.
331000	333000	As I said,
333000	335000	what we are going to use today
335000	337000	is MobLab.
337000	339000	MobLab is an experimental platform
339000	341000	for all class economics experiments.
341000	343000	If we take all the data from the class,
343000	345000	it is actually good and bad.
345000	347000	Of course, the two biggest concerns are
347000	349000	that all the students in the class
349000	351000	do not use money
351000	353000	to provide their sound.
353000	355000	Most of the time, they just use
355000	357000	the grade of the course
357000	359000	or other random numbers
359000	361000	to provide their sound.
361000	363000	This is what we have lost control of.
363000	365000	The two biggest concerns are
365000	367000	that many students in class
367000	369000	may not necessarily be
369000	371000	the representative sample
371000	373000	of the culture.
373000	375000	However, there are still
375000	377000	a lot of benefits
377000	379000	for us to try this method.
379000	381000	First of all,
381000	383000	there is no publication bias
383000	385000	in our database.
385000	387000	For example,
387000	389000	if you take the results
389000	391000	of the previous article
391000	393000	as a meta-analysis,
393000	395000	you may get too good results.
395000	397000	This is called publication bias.
397000	399000	However,
399000	401000	all the results, good or bad,
401000	403000	are recorded in our database.
403000	405000	Another thing is that
405000	407000	our company is
407000	409000	at least in the class of
409000	411000	experimental economics.
411000	413000	If you want to do a class experiment
413000	415000	in the world,
415000	417000	you basically use our company.
417000	419000	In fact, our sample is very diverse.
419000	421000	There are many different areas.
421000	423000	This gives us a lot of
423000	425000	variation to test.
425000	427000	Thirdly,
427000	429000	the environment in which our data is generated
429000	431000	is exactly the same.
431000	433000	The interface, language,
433000	435000	and the entire experiment process
435000	437000	are exactly the same.
437000	439000	This means that we have
439000	441000	completely controlled
441000	443000	the process of their game.
443000	445000	These are the three advantages
445000	447000	that we think
447000	449000	are very important.
449000	451000	Before talking about these two areas,
451000	453000	I would like to talk about
453000	455000	how big our dataset is.
455000	457000	First of all,
457000	459000	we can see that
459000	461000	this table is a total of
461000	463000	10 areas in our dataset.
463000	465000	You can see that
465000	467000	this data is across North America,
467000	469000	Europe, and Asia.
469000	471000	In Ultraman Game,
471000	473000	we have more than
473000	475000	15,000 sample points.
475000	477000	For those of you who do not know
477000	479000	the economics of time,
479000	481000	the data in Ultraman Game
481000	483000	is about 10 times more than
483000	485000	a normal article,
485000	487000	or 0 to 2.0.
487000	489000	In DoubleAction,
489000	491000	there are basically 2.0 more.
491000	493000	This is a very large sample
493000	495000	that we can test.
495000	497000	Next,
497000	499000	I will talk about these two areas.
499000	501000	These two areas are actually very simple.
501000	503000	The first is Ultraman Game.
503000	505000	In addition,
505000	507000	why do we choose these two areas?
507000	509000	The first is because these two areas
509000	511000	are the most abundant in our database.
511000	513000	The second is that these two areas
513000	515000	are basically the origin of
515000	517000	the economics of time.
517000	519000	In Ultraman Game,
519000	521000	there are two people in this game.
521000	523000	One is Proposer,
523000	525000	the other is Responder.
525000	527000	Proposer can decide
527000	529000	how much to give to the other party.
529000	531000	This game is very simple.
531000	533000	There is a ball in the middle.
533000	535000	You can decide how much to give to the other party.
535000	537000	You can pull the ball
537000	539000	and decide how much to give to the other party.
539000	541000	If you decide,
541000	543000	you can press Submit.
543000	545000	In this way, the other party can see
545000	547000	how much you gave to the other party.
547000	549000	Next,
549000	551000	suppose I decide to give the other party $45.
551000	553000	In this way,
553000	555000	the other party can see
555000	557000	that this is
557000	559000	a Proposer you have provided.
559000	561000	Proposer is
561000	563000	I take $55, you take $45.
563000	565000	Do you want to accept it?
565000	567000	If you are Responder,
567000	569000	if you decide to accept it,
569000	571000	you take $45, he takes $55.
571000	573000	If you refuse,
573000	575000	you both take $0.
575000	577000	This is a very simple environment.
577000	579000	It's like the simplest negotiation
579000	581000	in simulation life.
581000	583000	For example, when you go to the night market to buy vegetables,
583000	585000	you often say
585000	587000	that you might say in the last round
587000	589000	don't pull the ball.
589000	591000	It's like simulating such a concept.
593000	595000	This is the game interface
595000	597000	of our Ultraman Game.
597000	599000	Next, I want to talk about
599000	601000	double-sided auction.
601000	603000	The most classic example
603000	605000	of double-sided auction is
605000	607000	like Wall Street.
607000	609000	They are selling stocks.
609000	611000	You often see some pictures and news photos
611000	613000	that there may be a lot of machines
613000	615000	with a lot of stations.
615000	617000	Many traders are raising their hands
617000	619000	and shouting loudly.
619000	621000	It's like everyone is shouting at the same time.
621000	623000	How much do I want this? How much do I want this?
623000	625000	It's like buyers and sellers are arguing there at the same time.
625000	627000	So double-sided auction is
627000	629000	compared to Ultraman Game.
629000	631000	Ultraman Game has only one side.
631000	633000	I propose a proposal to you.
633000	635000	In double-sided auction,
635000	637000	no matter which side, buyer or seller,
637000	639000	they can call at the same time.
639000	641000	So in double-sided auction,
641000	643000	I will introduce what this game is playing now.
643000	645000	One is a buyer and the other is a seller.
645000	647000	So if you are a buyer today,
647000	649000	you want to buy something.
649000	651000	We are buying oranges here.
651000	653000	In this game interface,
653000	655000	the first thing you can see is
655000	657000	how much satisfaction you will get when you buy an orange.
657000	659000	This is called value.
659000	661000	Next, you have to raise a price.
661000	663000	You can pull a slider bar here.
663000	665000	You can move left and right
665000	667000	to decide how much you want to bid
667000	669000	to bid for this orange.
669000	671000	If you buy an orange,
671000	673000	your advantage is
673000	675000	your value today is
675000	677000	how much you spent to buy it.
677000	679000	OK.
679000	681000	If you are buying,
681000	683000	you have two ways to buy.
683000	685000	One is to bid here.
685000	687000	The other one is
687000	689000	if there are a lot of buyers in front,
689000	691000	they have already asked for a price.
691000	693000	So you can also buy directly at the lowest price.
693000	695000	OK.
695000	697000	The next one is
697000	699000	seller.
699000	701000	We have the same interface.
701000	703000	If you sell an orange today,
703000	705000	you have a cost.
705000	707000	So you will see your cost here.
707000	709000	OK.
709000	711000	Next,
711000	713000	you can pull a slider bar here
713000	715000	to decide how much you want to bid.
715000	717000	You can ask for a price here.
717000	719000	Or you can decide
719000	721000	to sell the highest price here.
721000	723000	So I can sell it here.
723000	725000	Then pay attention here.
725000	727000	There is a special design in our game interface.
727000	729000	When you decide to
729000	731000	ask for a price here,
731000	733000	if you ask for a price,
733000	735000	if the transaction
735000	737000	makes you pay a negative price,
737000	739000	I will make it red
739000	741000	to warn you
741000	743000	that
743000	745000	this transaction may bring you
745000	747000	a negative price.
747000	749000	So this is a double option
749000	751000	game interface.
751000	753000	Let me introduce
753000	755000	our game settings here.
755000	757000	This is because
757000	759000	in such a simple game interface,
759000	761000	many teachers
761000	763000	can adjust the game parameters
763000	765000	themselves.
765000	767000	But in most cases,
767000	769000	many teachers use our preset options.
769000	771000	In Ultimatum Game,
771000	773000	you can divide the money
773000	775000	into 100 yuan.
775000	777000	In the case of double option,
777000	779000	there are five buyers in total.
779000	781000	Then each person
781000	783000	can have three products to buy.
783000	785000	That is to say, there are a total of
785000	787000	15 things in the market to buy and sell.
787000	789000	If we draw this value,
789000	791000	this is our black line.
791000	793000	This is our demand curve.
793000	795000	Then the gray line
795000	797000	is our supply curve.
797000	799000	Before I start,
799000	801000	I want to talk a little bit
801000	803000	about the theoretical prediction
803000	805000	of these two games.
805000	807000	In Ultimatum Game,
807000	809000	the theoretical prediction is very simple.
809000	811000	If we look at it
811000	813000	from the perspective of the respondent,
813000	815000	we say that
815000	817000	the balance of a game is basically
817000	819000	that if I do this option,
819000	821000	the reward is higher than the other option,
821000	823000	then I should do this.
823000	825000	So if you look at the responder,
825000	827000	no matter what positive reward he sees,
827000	829000	I should accept it.
829000	831000	For example, if I take 1 yuan,
831000	833000	it is still better than 0 yuan.
833000	835000	So in this case,
835000	837000	if I get a positive reward,
837000	839000	I should accept it.
839000	841000	If I get a negative reward,
841000	843000	I should accept it.
843000	845000	If I get a positive reward,
845000	847000	I should accept it.
847000	849000	So this is the theoretical prediction of Ultimatum Game.
849000	851000	But in fact,
851000	853000	in the past 50 years of research,
853000	855000	we all know that
855000	857000	this theory is basically written to be overturned.
857000	859000	This is because many times
859000	861000	when we do research,
861000	863000	we will find that
863000	865000	basically all the recipients
865000	867000	will not only give the other party 1 yuan.
867000	869000	This is Ultimatum Game.
869000	871000	Then in Double Option,
871000	873000	this is like a high school science textbook,
873000	875000	you will see Supply and Demand Curve.
875000	877000	If you want to solve this game,
877000	879000	it is actually very simple,
879000	881000	you have to find a price
881000	883000	to clear all the markets.
883000	885000	So if you are here,
885000	887000	this gray curve is the price
887000	889000	of our theoretical prediction.
889000	891000	It just happens to be the intersection
891000	893000	of Supply and Demand Curve.
893000	895000	If the price is higher,
895000	897000	it means that
897000	899000	there are more sellers who want to sell things at this time,
899000	901000	and fewer sellers want to sell.
901000	903000	So if the supply and demand are uneven at this time,
903000	905000	this force will force the price down.
905000	907000	But if the price is lower,
907000	909000	then there are more people who want to sell,
909000	911000	and fewer people want to sell.
911000	913000	So this force will push the price back.
913000	915000	This is also the intersection of Supply and Demand Curve.
915000	917000	This is our equilibrium price.
917000	919000	Then in our prediction market,
919000	921000	the number of equilibrium is 13,
921000	923000	and the price of equilibrium is 112 yuan.
923000	925000	So this is our game setting.
927000	929000	I want to stop here for a while.
929000	931000	Is everyone OK?
931000	933000	If there is no problem,
933000	935000	I will continue to talk about the results.
937000	939000	Wait a minute,
939000	941000	let me confirm first.
941000	943000	So the buyer's
943000	945000	willing price here is
945000	947000	150,
947000	949000	the prediction is 150,145,
949000	951000	140, and so on?
951000	953000	From 150 to 115.
957000	959000	So from 150 to minus 3,
959000	961000	how much is the last one?
961000	963000	The last one is about
963000	965000	112 or 117.
967000	969000	Then the other side is from 50,
969000	971000	and then keep adding up.
971000	973000	Yes.
973000	975000	Thank you.
975000	977000	OK, then I have no problem.
977000	979000	I want to continue.
979000	981000	Let's talk about
981000	983000	the overall results.
983000	985000	First of all, I want to show you
985000	987000	this table.
987000	989000	Let me summarize first.
989000	991000	We mainly looked at five outcome variables.
991000	993000	What are some of its numerical statistics?
993000	995000	First of all, in the Ultimation Game,
995000	997000	we mainly looked at two outcome variables.
997000	999000	One is how much proposal you give the other party.
999000	1001000	The other is how much your acceptance rate is.
1001000	1003000	First of all, we see the first one.
1003000	1005000	In the case of 100 yuan,
1005000	1007000	on average,
1007000	1009000	you will give the other party about 36 yuan.
1009000	1011000	This number is actually
1011000	1013000	very close to the result of our experiment.
1013000	1015000	For example, if we take
1015000	1017000	Rock's article in 1991 as a benchmark,
1017000	1019000	the average of the article
1019000	1021000	is 40.
1021000	1023000	In fact, our gap is only 4%,
1023000	1025000	so I think it's a very close result.
1025000	1027000	Then the second one
1027000	1029000	we look at is the acceptance rate.
1029000	1031000	What we are looking at now is unconditional.
1031000	1033000	If we look at
1033000	1035000	the unconditional acceptance rate,
1035000	1037000	the acceptance rate is 66%.
1037000	1039000	Rock's result is about 73%.
1039000	1041000	So the gap is only 6% or 7%.
1041000	1043000	But because our offer
1043000	1045000	is relatively low,
1045000	1047000	I think our result
1047000	1049000	is able to reproduce
1049000	1051000	Rock's result at the aggregate level.
1051000	1053000	Hello, I have a question.
1053000	1055000	You just said
1055000	1057000	he made 40 and then 36.
1057000	1059000	Or let's just say
1059000	1061000	how much is the experimental
1061000	1063000	and how much is the theoretical expectation.
1063000	1065000	I think it's very close.
1065000	1067000	What I want to ask is
1067000	1069000	what do you think?
1069000	1071000	Because you didn't show
1071000	1073000	your uncertainty range.
1073000	1075000	Maybe it's actually a very stable difference,
1075000	1077000	so it's not very close.
1077000	1079000	This is
1079000	1081000	what I will continue to talk about later.
1081000	1083000	Because I'm going to show you a statistic now.
1083000	1085000	Show you an approximate
1085000	1087000	rapid statistics.
1087000	1089000	If you're right,
1089000	1091000	I should do some statistics
1091000	1093000	to see if there is a significant difference.
1093000	1095000	But in fact,
1095000	1097000	the first one is
1097000	1099000	this is one point.
1099000	1101000	If I want to do an assessment,
1101000	1103000	there is another problem.
1103000	1105000	Our sample number is very unbalanced.
1105000	1107000	Very unbalanced.
1107000	1109000	So it means that our sample number
1109000	1111000	is about more than 10,000 points,
1111000	1113000	and their sample number is only more than 1,000 points.
1113000	1115000	So in fact, many times,
1115000	1117000	when you do an assessment like this,
1117000	1119000	sometimes there are some
1119000	1121000	things that you need to pay attention to.
1121000	1123000	But in fact,
1123000	1125000	at least in the case of showing data now,
1125000	1127000	I can only say it out loud.
1127000	1129000	What I can only say now is
1129000	1131000	to see if it's close or not.
1131000	1133000	Next,
1133000	1135000	the other three are
1135000	1137000	the results of the double option.
1137000	1139000	For the double option, I'm going to use three indexes
1139000	1141000	to talk about whether this market
1141000	1143000	has been able to
1143000	1145000	refine
1145000	1147000	the prediction of the theory.
1147000	1149000	The first three indexes we look at
1149000	1151000	are the average error.
1151000	1153000	The definition of the average error is actually below.
1153000	1155000	DQ is the price of
1155000	1157000	each unit
1157000	1159000	of each contract.
1159000	1161000	Subtract.
1161000	1163000	This means
1163000	1165000	how much is the difference
1165000	1167000	from our theoretical prediction.
1167000	1169000	Next, I look at the average.
1169000	1171000	Because we often have
1171000	1173000	about 800 different market configurations.
1173000	1175000	So in order to make everyone
1175000	1177000	comparable, I use
1177000	1179000	the average price to standardize it.
1179000	1181000	So we can actually use this index
1181000	1183000	to see how much our accuracy is.
1183000	1185000	The next one is
1185000	1187000	our
1187000	1189000	Smith Alpha.
1189000	1191000	Smith is to commemorate
1191000	1193000	Brown-Smith.
1193000	1195000	This index is actually very simple.
1195000	1197000	It is the distance
1197000	1199000	between my price
1199000	1201000	and
1201000	1203000	the price of my theoretical prediction.
1203000	1205000	So I take the square here.
1205000	1207000	Then I take another one.
1207000	1209000	Next, I look at the average distance.
1209000	1211000	Then I open a number.
1211000	1213000	So it's actually like my standard error.
1213000	1215000	But
1215000	1217000	what I'm doing today is not average.
1217000	1219000	What I'm doing today is
1219000	1221000	theoretical prediction.
1221000	1223000	Next, I still use
1223000	1225000	my average price to standardize it.
1225000	1227000	So I can use this index
1227000	1229000	to measure the fluctuation of price.
1229000	1231000	The next
1231000	1233000	and the third index is Efficiency.
1233000	1235000	For Efficiency, I want to use
1235000	1237000	the above picture to explain.
1237000	1239000	So in this
1239000	1241000	market equation,
1241000	1243000	if this seller
1243000	1245000	makes a deal with this buyer,
1245000	1247000	then it shows
1247000	1249000	the above section
1249000	1251000	in the middle
1251000	1253000	is the profit I made.
1253000	1255000	It's the buyer's profit.
1255000	1257000	The following section is the seller's profit.
1257000	1259000	So it tells me
1259000	1261000	the total length of this section
1261000	1263000	is the
1263000	1265000	profit I can make
1265000	1267000	from this deal.
1267000	1269000	That is to say,
1269000	1271000	I sum up the area of
1271000	1273000	the supply curve and demand curve.
1273000	1275000	In theory,
1275000	1277000	this is the total
1277000	1279000	surplus I can get.
1279000	1281000	So this year's efficiency
1281000	1283000	definition is
1283000	1285000	the efficiency I achieve
1285000	1287000	in this market
1287000	1289000	and the efficiency
1289000	1291000	I expect in theory.
1291000	1293000	The following
