start	end	text
0	9000	First of all, I would like to welcome everyone to our Chira Talk on August 4th.
9000	17000	We are honored to have Jason Hong, a student from Hong Shi An University, to give a speech on his latest research.
17000	23000	Today's topic is Coherent Exotonic Effects in 2D Materials.
23000	27000	Before we start, let me briefly introduce Jason.
27000	31000	Jason graduated from the University of Taiwan in the Department of Physics.
31000	36000	He did his Ph.D. at UC Berkeley and the Lawrence Berkeley National Lab.
36000	39000	He is currently working as a postdoc in Michigan.
39000	45000	His current field of expertise is the application of super fast light in solid matter.
45000	50000	His main research topics include graphene optical sensors,
50000	61000	coherent exotonic effects in 2D materials, and cavity exotonic polaroids.
61000	66000	In today's talk, he will introduce some basic principles and applications of super fast light.
66000	78000	He will use super fast light and light-matter interactions to understand the dynamics of electrons in solid state physics.
78000	87000	He will also discuss related research in super fast light and exotonic effects.
87000	93000	If there are no further questions, let's welcome Jason to start his talk.
93000	96000	Hello everyone.
96000	100000	I am very happy to be invited to Chira Talk.
100000	105000	Today's topic is Coherent Exotonic Effects in 2D Materials.
105000	116000	Today's topic is Coherent Exotonic Effects in 2D Materials.
124000	126000	This is today's outline.
126000	144000	In the beginning, I will talk about what super fast light is, the history of super fast light, and a very important technique called pump probe measurement.
144000	164000	On the other hand, I will briefly explain what is special about the acetone in the coherent exotonic materials.
164000	168000	Finally, I will talk about my recent research.
168000	175000	In the coherent exotonic materials, there are not only acetone, but also biacetone effects.
175000	180000	I will start with super fast light.
180000	188000	The so-called super fast light is actually a super fast phenomenon that uses light to study the extremity of time.
188000	198000	Generally speaking, the definition of a super fast phenomenon is the phenomenon between a femtosecond and a picosecond.
198000	203000	We call it a super fast phenomenon, but there is no clear definition.
203000	209000	Femtosecond is 10 to the power of negative 50 square seconds, and picosecond is 10 to the power of negative 20 square seconds.
209000	214000	However, we will briefly introduce the extent of time later.
215000	225000	The main reason why we use light to study these super fast phenomena is that there are many super fast phenomena that cannot be observed in other ways.
225000	228000	For example, the general method of electrolysis.
228000	235000	Everyone knows that electrolysis is basically to charge.
235000	241000	The charging time is actually around nanoseconds.
241000	256000	For example, the switch speed of these computers is about gigahertz, and gigahertz is about nanoseconds.
256000	268000	Even if the electrolysis is done well, the time you can observe is only about nanoseconds.
268000	271000	There is no way to do better.
271000	280000	If you want to observe these super fast phenomena with a shorter time period, you have to use light.
281000	290000	At this time, we have a technique called pump-up technique, and we can use it to observe these super fast phenomena.
290000	301000	Basically, in my own concept, light is basically photography, which is the art of capturing light.
301000	309000	For example, when we usually shoot small objects, this is called micro light.
309000	319000	When we turn a black and white camera into a color camera, what we are actually doing is photography.
319000	329000	We can study the reaction of a object to a different amount of light with different energy.
329000	331000	This is called photography.
331000	335000	The meaning of super fast photography is actually high-speed photography.
335000	344000	For example, when we watch TV, when a baseball player throws a ball, he basically uses high-speed photography to do these things.
344000	349000	Super fast photography basically uses high-speed photography to the extreme.
349000	351000	What is photography?
351000	353000	There is a picture here.
353000	360000	Basically, photography is that you have a light source, and the light source shines on your object, on your model.
360000	363000	The model will reflect light or penetrate light.
363000	367000	People don't penetrate light, so this is reflected light.
367000	377000	In the end, the reflected light is taken down by the photographer with these cameras.
377000	379000	This is called photography.
379000	383000	Sometimes you need something else.
383000	389000	For example, you need another assistant to remind your model to remember to smile.
389000	394000	When you add all these things together, this is called photography.
394000	401000	When it comes to super fast photography, I have to talk about the interesting history.
402000	406000	A long time ago, people had a question.
406000	419000	When a horse is running, is it possible that when the horse is running, the four legs will float in the air for a moment?
419000	428000	It may not seem like a problem now, but you may think it's not useful at all.
428000	434000	This was in the 1870s.
434000	438000	These people were very passionate about racing horses.
438000	441000	This was a very interesting question at the time.
441000	445000	People wanted to know how the horse ran.
445000	450000	But you can't see it with your eyes.
450000	455000	You can't record it and tell everyone how the horse ran.
456000	462000	At that time, there was a man named Leland Stanford.
462000	467000	He was the governor of California.
467000	475000	He thought that when the horse was running, the four legs might float in the air for a moment.
475000	477000	But no one believed him.
477000	481000	Leland Stanford was very rich.
481000	496000	He asked Edwin Muybridge, who was a photographer, to research how to capture these fast things.
496000	502000	He gave him a $25,000 research fund.
502000	505000	I think it was a huge amount of money at the time.
506000	513000	After several years of hard work, Muybridge invented the shutter.
513000	516000	The picture on the left is the shutter he invented.
516000	519000	Basically, it's a few boards.
519000	525000	He used a mechanical method to make the board fall.
525000	530000	When the board falls, it blocks the light.
530000	535000	When the light does not pass, it means that the camera will not continue to expose the light.
535000	544000	The shutter speed can be up to 500 microseconds.
544000	549000	This is where he did the experiment.
549000	551000	Basically, it's a racecourse.
551000	553000	The horse will run from here to here.
553000	556000	There are 24 cameras.
556000	560000	Each camera has a shutter.
560000	567000	When the horse runs like this, it will take pictures like this.
567000	571000	Then he got a picture like this.
571000	575000	Basically, you can see that there are 12 pictures here.
575000	578000	This is the continuous process of the horse running.
579000	588000	You can see that these two pictures clearly show that the horse's four legs are in the air.
588000	593000	But it's definitely not like the picture above.
593000	596000	This is a very wrong concept.
596000	600000	When the horse is in the air, it's definitely not the state of the legs.
600000	604000	It's probably the situation where the legs are shrunk.
605000	608000	This is an interesting story.
608000	619000	In that era of super fast light, the method was to take a light source and take a picture of the object you wanted to take.
619000	625000	How do we choose which time to take a picture?
625000	628000	Use a mechanical shutter.
628000	631000	The shutter switch is very fast.
631000	638000	At this time, we can take a picture that is short in time.
638000	645000	But everyone found that the mechanical shutter has a limit.
645000	648000	Basically, you can't do it faster than microseconds.
648000	651000	The next time is nanosecond.
651000	654000	How to enter this nanosecond?
655000	662000	An important invention is the light bulb.
662000	668000	The light bulb was invented in 1880.
668000	677000	So it was before Moonbridge.
677000	680000	What is a light bulb?
680000	683000	Light is produced by electricity.
683000	688000	Of course, ordinary light bulbs can't do this.
688000	691000	But the next invention is this.
691000	694000	We can use electricity to produce light.
694000	696000	So we can adjust this electricity.
696000	701000	The light we produce is a form of pulse.
701000	708000	You can turn on this light at a certain time and turn off this light at another time.
708000	718000	You can use this pulse to hit your object.
718000	722000	When the object is reflected back to the camera,
722000	728000	you just need to turn off the shutter when the pulse stops.
728000	736000	In this way, you can measure the time it takes for the pulse to stop.
737000	743000	This method is called frequency-shift observation.
743000	750000	The main concept is that we can't quickly adjust the shutter of the camera.
750000	753000	So we change it to adjust the light source.
753000	760000	Here are some photos of stroboscopes.
760000	765000	This is basically what you see in many photo studios.
765000	771000	On the left is a woman waving a golf club.
771000	774000	This speed is also very fast.
774000	783000	Basically, every frame is your flashlight hitting the woman.
783000	786000	Then it reflects back and you take a picture.
786000	795000	At the next moment, the next pulse hits the woman and you take another picture.
795000	802000	This inventor is a professor at MIT named Edgerton.
802000	805000	He has a nickname called Papa Flash.
805000	809000	Basically, Flash is Flashlight.
809000	814000	It's the light source you need for frequency-shift observation.
815000	820000	This method was invented in 1931.
820000	824000	The picture on the right is an example.
824000	833000	You can use this method to take a picture of the state of the bullet in the air.
833000	844000	We use frequency-shift observation to reach the level of nanoseconds.
844000	849000	How do we get to the level of picoseconds and femtoseconds?
849000	859000	The first thing is why we are particularly interested in picoseconds and femtoseconds.
860000	871000	It's because there are many physical phenomena that occur at this time.
871000	875000	For example, phonon vibration.
875000	883000	The vibration of the metal in this material is actually at the level of picoseconds.
884000	894000	There are also a lot of electrons in this material.
894000	908000	The events of activation and relaxation are actually at the level of femtoseconds.
908000	918000	This is why we want to get to the level of picoseconds and femtoseconds.
918000	930000	The main discovery that can break through nanoseconds is the discovery of magnetic laser.
930000	935000	Laser is basically a game media.
935000	942000	When the light passes through the game media, the light becomes stronger because of the feedback of the game media.
942000	950000	If you put the light in an optical cavity,
950000	965000	The optical cavity is basically made up of two high-reflection mirrors.
965000	968000	At this time, it becomes a laser.
968000	980000	Of course, we want the laser to output, so we use a semi-transparent mirror on one side to let the laser pass through.
980000	982000	At this time, you have a laser.
983000	993000	Another interesting thing is that when you have a cavity,
993000	1000000	What frequency of light can become a laser?
1000000	1010000	The important thing is that when the light passes through the cavity,
1010000	1015000	How to make it a coherent line?
1015000	1035000	The condition is that when the light passes through the cavity, the light-returned phase is the same.
1035000	1040000	This is the condition.
1040000	1048000	We can convert it to frequency.
1048000	1058000	At this time, you can see that the allowed optical mode is actually a positive integer.
1058000	1065000	Multiply by c divided by 2L, where L is the length of the optical cavity.
1065000	1072000	I have a question.
1072000	1080000	What kind of material is the game media?
1080000	1084000	There are many kinds of game media.
1084000	1087000	We can see all kinds of lasers on the market.
1087000	1095000	For example, there are semi-transparent lasers, CO2 lasers, and hydrogen peroxide lasers.
1095000	1099000	These are the game media.
1099000	1102000	Semi-transparent lasers are used as game media.
1102000	1106000	CO2 lasers are used as game media.
1106000	1111000	There are all kinds of game media.
1112000	1120000	As long as there are four lasers, there are two conditions.
1120000	1123000	The first condition is that there should be game media.
1123000	1125000	The second condition is that there should be an optical cavity.
1125000	1127000	All lasers are indispensable.
1127000	1132000	There are many ways to do it.
1133000	1142000	Can you give more details about the output coupler?
1142000	1145000	What is its main function?
1145000	1149000	Does it allow light to pass through?
1149000	1156000	The output coupler is actually a mirror.
1156000	1160000	It's just a semi-transparent mirror.
1160000	1169000	The first thing is that when the light travels through the cavity,
1169000	1174000	the gain should be greater than the loss.
1174000	1177000	The reflection rate should not be too low.
1177000	1180000	If the reflection rate is too low, the loss will be too high.
1180000	1187000	The gain should be greater than the loss.
1187000	1192000	The output coupler can also leak some light.
1192000	1196000	This creates a laser that can be used.
1196000	1209000	It means that half of the light can pass through the cavity.
1209000	1213000	This is the basic structure of a laser.
1213000	1218000	The current laser looks completely different from this one.
1218000	1228000	You can still point out what is game media, what is mirror, and what is its cavity.
1228000	1239000	The frequency of light that can be allowed is the frequency mode of the equality space.
1239000	1242000	Let's see what happens.
1242000	1254000	The picture above is a simulation of an optical mode in the cavity.
1254000	1257000	This is the output of the laser.
1257000	1259000	There is only one mode now.
1259000	1266000	The difference between the two modes is c divided by 2L.
1266000	1273000	You can see that the frequency of red and green are slightly different.
1273000	1276000	If we add these two modes together,
1276000	1281000	you can see that there is a beating effect.
1281000	1286000	You can see that there is something that looks like a pulse.
1286000	1289000	When there are four modes, this is more obvious.
1289000	1294000	These four modes are c divided by 2L.
1294000	1300000	You can see that the pulse of the output of the laser is more obvious.
1300000	1305000	Now we can keep adding until there are 30 modes.
1305000	1309000	You can see that there is a very obvious pulse here.
1309000	1316000	The general ultrafast laser has hundreds or thousands of modes.
1316000	1323000	This will make the pulse very obvious.
1323000	1328000	Another thing is why this thing is called a lock mode laser.
1328000	1334000	This is because when you add a lot of modes,
1334000	1338000	there is a condition that their phase must be fixed.
1338000	1342000	Then these pulses will be formed.
1342000	1347000	This blue line above
1347000	1351000	means that when the phase of these modes is locked,
1351000	1354000	you will see that there is a pulse.
1354000	1359000	However, when each optical mode has a different phase,
1359000	1361000	when they have a random phase,
1361000	1367000	you will see that this is probably a general CW laser.
1367000	1379000	The invention of lock mode laser is surprising.
1379000	1382000	The invention of lock mode laser was in the 1960s.
1382000	1384000	It was Charles Townes.
1384000	1386000	They made Mesa or something.
1386000	1391000	The first invention of lock mode laser was in 1965.
1391000	1393000	Five years after the invention of lock mode laser,
1393000	1396000	everyone has already discovered this lock mode laser.
1396000	1399000	After a period of time,
1399000	1407000	everyone tried to shorten the pulse of the laser.
1407000	1410000	In 1980,
1410000	1414000	a method called CPA was invented.
1414000	1423000	It's called True Pulse Amplification.
1423000	1428000	Basically, it stretches the laser pulse,
1428000	1431000	amplifies it, and compresses it.
1431000	1434000	At that time,
1434000	1437000	it took about 6 femtoseconds to make a die laser.
1437000	1439000	It was in 1985.
1439000	1446000	Another technology was invented.
1446000	1448000	It's called Tie Sapphire.
1448000	1453000	It just changes the laser gain media.
1453000	1458000	There are many reasons why Tie Sapphire is good.
1458000	1460000	Basically, it is a semiconductor laser.
1460000	1463000	At that time,
1463000	1469000	the technology of Tie Sapphire made rapid progress.
1469000	1472000	In 2000,
1472000	1475000	it took about 4 femtoseconds.
1475000	1482000	This is equivalent to a light oscillation.
1482000	1487000	A light in a visible oscillation.
1487000	1490000	This is a limit.
1490000	1492000	There is no way to continue.
1492000	1496000	The application of lock mode laser is very wide.
1496000	1502000	The first application is to use the laser's pulse.
1502000	1506000	It can be used for a short time.
1506000	1510000	Basically, it uses rapid pulses
1510000	1513000	to study atomic physics, solid physics,
1513000	1519000	chemical reactions, and so on.
1519000	1521000	It can also be used for light communication
1521000	1524000	and higher harmonic generation.
1524000	1526000	Another direction is
1526000	1529000	because the pulse laser
1529000	1535000	collects energy that does not have a pulse time
1535000	1542000	in the time that there is a pulse.
1542000	1545000	This means that in the pulse time,
1545000	1550000	the laser beam will be very strong.
1550000	1553000	Generally, you can get the power
1553000	1557000	to 10 to the power of 8 or 10 to the power of 4.
1557000	1562000	This can be used to do a lot of interesting things.
1562000	1565000	If you have super strong light sources,
1565000	1568000	you can use it to do non-linear light studies.
1568000	1572000	Recently, some people want to do nuclear fusion.
1572000	1576000	There are also laser cutting or cosmetic surgery.
1576000	1580000	You can see that the picture on the right
1580000	1586000	is basically the laser's peak power.
1586000	1591000	It is the laser beam within the pulse time.
1592000	1599000	It is also a very fast-growing laser.
1599000	1607000	It can now reach the power of 1 terawatt.
1607000	1620000	Of course, you can use the laser as a light source.
1620000	1625000	Because the pulse time is very short,
1625000	1631000	you should be able to take very short pictures.
1631000	1633000	But there is a problem here.
1633000	1636000	The time is too short to figure out
1636000	1639000	how to trigger an event.
1639000	1645000	How do you know when the event will happen?
1645000	1647000	If you don't know when it will happen,
1647000	1649000	you can't take pictures at all.
1649000	1652000	So the next question is
1652000	1655000	how to find the event you want.
1655000	1658000	The general approach is like this.
1658000	1660000	The picture on the right.
1661000	1666000	We are using a pulse laser.
1666000	1668000	It will emit a pulse.
1668000	1670000	The red dot is a pulse.
1670000	1677000	When the red dot reaches the beam splitter,
1677000	1680000	the pulse will be divided into two parts.
1680000	1688000	One part will go through the pump beam.
1688000	1693000	The other part will go through the pull beam.
1693000	1699000	The pump beam will hit the sample first.
1699000	1703000	The pump beam will hit the sample first.
1703000	1709000	After the pump beam hits the sample,
1709000	1714000	the pull beam will pass the sample
1714000	1717000	and reach the detector.
1718000	1721000	What is the purpose of doing this?
1721000	1726000	We use pump beam to trigger the sample,
1726000	1730000	such as electrons or electrons.
1730000	1733000	Anyway, no matter what we do,
1733000	1735000	we generate an event.
1735000	1738000	After a while,
1738000	1744000	we use pull beam to observe the event.
1744000	1749000	Another thing you can do is
1749000	1751000	to adjust the time difference
1751000	1755000	between the pull beam and pump beam.
1755000	1758000	You can adjust the time difference
1758000	1763000	between the pull beam and pump beam.
1763000	1768000	You will put the pull beam on a delay stage.
1768000	1772000	When you adjust the delay stage,
1772000	1775000	the pull beam will start to change.
1775000	1777000	Then you can see
1777000	1781000	the evolution of the event over time.
1781000	1783000	For example,
1783000	1789000	this is a pump probe measurement on a pull beam.
1789000	1791000	This is how it works.
1791000	1793000	Basically,
1793000	1799000	a pull beam with a wavelength of 800 nm
1799000	1802000	hits the sample.
1802000	1808000	Then you use a wavelength of 100 nm
1808000	1810000	as a probe.
1810000	1813000	When the probe passes the sample,
1813000	1819000	you use the detector to observe the pull beam.
1819000	1824000	To simplify it into a dynamic picture,
1824000	1826000	it looks like this.
1826000	1829000	First, you use the pump beam
1829000	1834000	to stimulate the electron.
1834000	1838000	When the electron decays for a while,
1838000	1841000	you use the pull beam
1841000	1844000	to observe the graphene absorption
1844000	1847000	under the current situation.
1847000	1853000	The experimental picture looks like this.
1854000	1858000	When the time is zero,
1858000	1860000	the pump beam and the pull beam
1860000	1862000	are in synch.
1862000	1865000	This is when you get the biggest reaction.
1865000	1867000	As time goes by,
1867000	1870000	the electron slowly relaxes
1870000	1875000	and decays back to its original state.
1875000	1878000	I have a question.
1878000	1879000	Sorry.
1879000	1883000	Why does the curve
1883000	1887000	have a different direction?
1887000	1891000	This is the experimental detail.
1891000	1893000	Okay.
1893000	1895000	This is not what I want to talk about.
1895000	1897000	But this is an interesting thing.
1897000	1904000	This is what the paper discusses.
1904000	1907000	The blue line is graphene in charge neutral,
1907000	1910000	which means it is not doping.
1910000	1913000	You can see this.
1913000	1917000	This should be the absorption increase.
1917000	1920000	I can tell you that
1920000	1923000	this line represents the absorption increase.
1923000	1927000	It means that when you hit an optical beam
1927000	1929000	to stimulate the electron,
1929000	1931000	you will produce more carriers,
1931000	1939000	resulting in a higher conductivity of graphene.
1939000	1941000	When the conductivity increases,
1941000	1943000	the absorption increases.
1943000	1950000	The red line is graphene in doping state.
1950000	1953000	Why is it negative?
1953000	1955000	It means that the absorption is decreasing.
1955000	1957000	The reason is that
1957000	1959000	when you hit an optical beam,
1959000	1962000	you will increase the temperature of the electron.
1962000	1965000	When the temperature of the electron increases,
1965000	1967000	the conductivity will decrease.
1967000	1970000	Because it has more scattering.
1970000	1973000	When the conductivity decreases,
1973000	1976000	the absorption decreases.
1976000	1979000	Do you mean that it will produce photons?
1979000	1981000	Yes.
1981000	1983000	Okay. Thank you.
1983000	1985000	Basically,
1985000	1987000	this means that
1987000	1989000	there are a lot of things to study
1989000	1992000	in the super fast speed.
1992000	1994000	Very interesting.
1994000	1996000	Thank you. Please go on.
1996000	1998000	On the other hand,
1998000	2000000	I want to talk about
2000000	2002000	the two-dimensional semiconductor.
2002000	2004000	The first two-dimensional material discovered is graphene.
2004000	2006000	As you know,
2006000	2010000	graphene is made by the method of exfoliation.
2010000	2012000	Basically, you take a tape
2012000	2015000	and put the graphite on it.
2015000	2018000	Then you stick the tape on the substrate
2018000	2020000	and tear it up.
2020000	2022000	Then you will find that
2022000	2025000	there is a layer of graphene on the substrate.
2025000	2027000	It looks like this.
2027000	2029000	Then you look under the microscope
2029000	2031000	and you can find these
2031000	2034000	only one-dimensional flakes.
2034000	2037000	This is the band structure of graphene.
2037000	2039000	Another thing is
2039000	2042000	this is the band structure of graphene.
2042000	2047000	There are two Dirac cones.
2047000	2051000	There are two different Dirac cones.
2051000	2053000	The reason for these two cones
2053000	2055000	is that
2055000	2057000	graphene has inversion symmetry
2057000	2059000	and time reversal symmetry.
2059000	2061000	As a result,
2061000	2063000	this conduction band
2063000	2065000	and valence band
2065000	2067000	will always have
2067000	2069000	a intersection point.
2069000	2071000	Basically,
2071000	2073000	this thing
2073000	2075000	means that
2075000	2077000	graphene is always a metal.
2077000	2079000	It is always a metal.
2079000	2081000	Metal is often bad
2081000	2083000	and can't do what we want to do.
2083000	2085000	Another thing is
2085000	2089000	because it has two different values,
2089000	2092000	there is another degree of freedom
2092000	2094000	called pseudo-spin degree of freedom.
2094000	2096000	This means that
2096000	2098000	you can put these messages
2098000	2101000	on these two different values.
2101000	2105000	If you can manipulate this value,
2105000	2108000	you can treat it as 0 and 1.
2108000	2110000	For example, 0 is the k-value
