start	end	text
0	4000	Q&A
4000	23000	Hello, I am today's representative host, Zhang Yanyong, because our host, Zhang Jianyuan, he is actually more suitable, because he is doing Qubits, doing condensed matter, but he is now stuck on the road, he has no time for transportation, so I will represent the host.
23000	43000	Let me introduce our speaker today. Our speaker today is Dr. Zeng Yuqing. The topic he is going to talk to us today is ... I want to read it right, wait a minute, I suddenly can't find it, wait a minute, wait a minute.
43000	68000	Topological quantum phase transitions in Haldane spin chains. This is a very popular topic, because in 2016 or 2017, Topological Matter won the Nobel Prize, so we have always hoped that we could invite an expert to introduce to us what topological phases are.
68000	95000	Then, Zeng Yuqing, in 2005, got a college degree from Donghai University, a physics major, right? Then he went to serve in the military, and then served in the military for 1.5 years, but he served in the military at Donghai University. Why?
95000	99000	After I served in the military, I returned to Donghai University as a research assistant.
125000	143000	Then there is a published paper in PRB, if you are interested, because I don't have that number, so you can directly ask our speaker for this thing. Then he transferred to Central University and completed his Ph.D. degree. The main function is also condensed matter theory.
143000	166000	At present, Zeng Yuqing is at the University of Kent in the UK, and he is now focusing on numerical study on the time-reversal invariant fractional topological insulator. This is a very hot topic, so we don't have much to say, we applaud and welcome today's speaker. Oh, if you want to applaud or ask a question, remember to turn on the microphone.
173000	181000	Let's get started. Today I prepared some props.
203000	214000	I have some props. You can play with some props later.
233000	250000	I will talk about some of the things I have done before, which will be more professional. First of all, what is physics?
250000	265000	What we mainly learn in physics is quantum mechanics. Quantum mechanics is like classical mechanics, which is mechanics, or kinetic mechanics of electricity, quantum mechanics, thermal mechanics, and statistical mechanics.
265000	284000	This whole thing is actually studying the interaction between time, space, and matter. The interaction between matter has, for example, strong, weak, electromagnetic, or gravity.
284000	305000	You can take the whole world, these substances, as if they were actors on stage. The stage is the background between time and space, and there will be some interaction between the actor and the actor.
306000	314000	The whole thing will form a movie or a stage play.
315000	334000	What about matter? This is from when I was very young, for example, in high school or elementary school, I learned that we can classify matter in this way.
334000	345000	First, divide it into solid matter or mixtures. Mixtures, such as beer, milk tea, or air, are mixtures.
346000	357000	For example, alcohol, water, and many other substances, such as beer, flowers, and so on.
357000	365000	For example, most of the air is 4 out of 5 gas, and 1 out of 5 oxygen, for example.
366000	384000	Pure matter can be divided into elements and mixtures. For example, the elements in the cycle table, such as gold, iron, oxygen, and O2.
385000	393000	For example, the previously well-known graphene, which is basically carbon.
394000	405000	For example, alcohol is a mixture of alcohol and water.
406000	415000	Alcohol has a chemical form, such as CH3CH2OH, which is alcohol.
415000	424000	Chlorine is also a mixture of pure matter.
424000	429000	Oxygen is also a mixture of pure matter.
429000	436000	For example, ice is water, which is the solid of water.
436000	441000	Ice is also pure matter, which is H2O.
442000	450000	This classification is probably a little bit of preliminary understanding of matter.
450000	458000	To understand this understanding further, we can see that matter has many states.
458000	462000	This state is called phase.
462000	469000	There is a change between the phase and the phase, which is called phase change.
469000	481000	For example, the ice or water we just talked about is under pressure in the horizontal axis and temperature in the vertical axis.
481000	490000	For example, at the bottom of atmospheric pressure, below 0 ° C, it is solid.
490000	496000	This side will be liquid and this side will be gas.
496000	505000	The red line is from here, it will pass through a waste point and then become water vapor.
505000	513000	From here, it will pass through this ice point and solidify into ice.
513000	515000	For example, this picture.
515000	519000	Of course, you can't see the water vapor with your naked eye.
519000	523000	Because the water vapor is transparent and colorless.
524000	530000	If it is connected to this water drop on the glass, it will become a liquid.
530000	532000	You can see that this is water.
532000	535000	This is the water we usually see.
535000	539000	Ice is solid.
539000	543000	This picture is in our present.
545000	551000	It's snowing in the UK recently, and it's cold.
552000	560000	After the snow, many people want to do an experiment.
560000	571000	Put the liquid nitrogen on the snowman and then destroy it.
571000	574000	See what the result is.
574000	583000	In short, this picture of water should have been seen in elementary school.
583000	588000	I don't know if there is any problem.
588000	593000	If not, I want to emphasize that there is a critical point here.
593000	618000	The meaning of this critical point is that if the temperature and pressure are very high from here to the critical point, you will not be able to distinguish whether the water is a liquid or a gas.
619000	625000	After this critical point, there is no red line.
625000	631000	The red line on the left has been extended.
631000	637000	This point stops at this critical point.
637000	644000	So if this side is gas, this side is liquid, this side is solid.
644000	652000	This line completely separates solid and liquid.
652000	661000	But here you can adjust the temperature and pressure appropriately.
661000	665000	Then let it slowly go around this critical point from here.
665000	670000	Then enter another item.
671000	685000	In other words, the phase of the liquid and the phase of the gas are the same phase.
685000	693000	The three-dimensional picture of water here is actually only two phases.
693000	696000	There are only two images like this.
696000	700000	There should be no problem.
700000	705000	This is a relaxing video.
705000	719000	A few days ago, we put the liquid and gas on the snowman.
719000	723000	Many people came to see.
723000	726000	There are about 100 people here.
726000	729000	Other dramas have come to see.
729000	732000	I think this is interesting.
733000	744000	You can see that gas is also a pure material.
744000	749000	Pure materials have three-dimensional pictures of water like just now.
749000	752000	Now pour out the liquid and gas.
752000	760000	The liquid and gas are about 70K.
760000	766000	It's about 100 degrees below zero.
790000	808000	The temperature of the ice is very high compared to the temperature of the liquid and gas.
808000	821000	The temperature of the liquid and gas is very high compared to the temperature of the liquid and gas.
821000	823000	The temperature is lower.
823000	828000	You can see the picture of the liquid and gas.
828000	833000	It is still solid.
833000	835000	That's about it.
835000	838000	What is a phase?
838000	848000	What does it mean?
848000	851000	You have an external parameter.
851000	856000	For example, you just saw that there is temperature and pressure.
857000	860000	You have an external parameter.
860000	867000	What is the state of a huge macro of this material?
867000	868000	What are the external parameters?
868000	877000	For example, temperature pressure, magnetic field, or external control.
877000	879000	You can control the outside.
879000	880000	For example, you add a power plant.
880000	889000	Or you use other elements to replace these compounds.
889000	891000	You do some mixing.
891000	895000	This mixing can also be regarded as an external parameter.
895000	897000	Mainly these parameters.
897000	899000	You made these modifications.
899000	902000	Will affect these.
902000	906000	Because the matter is composed of those atoms.
906000	908000	It is composed of those particles.
908000	911000	You modified these external parameters.
911000	916000	Will affect the interaction between particles.
916000	920000	What about the interaction between particles?
920000	925000	It will have different phases.
925000	937000	The higher the temperature, the more chaotic the material is.
937000	952000	But if you have an interaction, the material may have a different order.
952000	955000	What is a macro state?
955000	959000	For example, the three-phase change just now.
959000	962000	The three-phase change is the solid, solid, gas.
962000	967000	But it's not just solid, solid, gas.
967000	972000	It's a macro state.
972000	974000	For example, conductivity.
974000	977000	Conductivity is also a macro state.
977000	981000	Magnetic field is also a macro state.
981000	983000	For example, mercury.
984000	991000	In 1911, it was discovered by Ernst.
991000	998000	After the temperature dropped very low, it suddenly became a superconductor.
998000	1000000	What about conductivity?
1000000	1005000	For example, the angle is the temperature.
1005000	1010000	When the temperature is very high.
1010000	1013000	This temperature is the absolute temperature.
1013000	1018000	From this place, you can see that there is a conductor here.
1018000	1020000	Satisfy the Ohm's law.
1020000	1025000	When the temperature drops, the conductor becomes smaller and smaller.
1025000	1026000	But there is still a conductor.
1026000	1033000	But when the temperature is about 4K, about 4.2K.
1033000	1037000	The conductor suddenly disappears.
1037000	1038000	There is almost nothing.
1038000	1039000	There is nothing at all.
1039000	1041000	There is nothing here.
1041000	1046000	This can be regarded as a phase change.
1046000	1049000	Because this is a very macro state.
1049000	1051000	The whole change.
1051000	1053000	Because there is a conductor here.
1053000	1055000	There is no conductor here at all.
1055000	1060000	Here is the general conductor.
1060000	1066000	On the left side, it suddenly becomes a superconductor.
1066000	1070000	The superconductor has great application value.
1070000	1080000	For example, later we found that mercury is a pure material.
1080000	1082000	Mercury is an element.
1082000	1087000	But other compounds may also become superconductors.
1087000	1090000	Like these high-temperature superconductors.
1090000	1099000	High-temperature superconductors can become superconductors as long as they are at the temperature of the liquid nitrogen.
1099000	1102000	For example, these copper oxides.
1102000	1107000	You will see that there is an X in these different compounds.
1107000	1109000	There is an X here, right?
1109000	1112000	This X is when you synthesize this compound.
1112000	1115000	How much ratio do you want to put in?
1115000	1117000	How much ratio do you put in?
1117000	1121000	Then you go to burn this compound.
1121000	1126000	Then you are equal to saying that this X is your external parameter.
1126000	1129000	That's your temperature with your axis.
1129000	1133000	Different temperatures and different cross-sections.
1133000	1135000	The horizontal axis is the cross-section.
1135000	1137000	The horizontal axis is the cross-section.
1137000	1139000	Write a P on the right.
1139000	1141000	You are the cross-sectional electric.
1141000	1143000	This is the meaning of the X.
1143000	1145000	Write an N on the left.
1145000	1146000	Write N on the left.
1146000	1148000	You are the cross-sectional electric.
1148000	1151000	Here is the electron dot and the hole dot.
1151000	1156000	This place is when you are not in the cross-section.
1156000	1162000	This is a counter-iron-magnetic superconductor.
1162000	1165000	When you cross-section to a certain degree,
1165000	1167000	When you drop to a low enough temperature,
1167000	1169000	It becomes a superconductor.
1169000	1174000	So this area is a superconductor phase.
1174000	1178000	This area is a counter-iron-magnetic phase.
1178000	1180000	What is a counter-iron-magnetic?
1180000	1183000	Then go on.
1183000	1185000	Magnetic.
1185000	1189000	There are many kinds of magnetic.
1189000	1192000	The magnet we usually see,
1192000	1194000	Like this magnet.
1194000	1196000	When we were in elementary school,
1196000	1199000	Take the magnet and sprinkle some magnetic powder.
1199000	1201000	Look at the magnetic field.
1201000	1206000	The magnetic nature of this magnet is called magnetism.
1206000	1208000	That is to say,
1208000	1212000	There are many magnetic poles inside the magnet.
1212000	1214000	Many small magnetic poles.
1214000	1218000	These magnetic poles are originally,
1218000	1220000	If it is messy,
1220000	1223000	If the temperature is very high,
1223000	1227000	Then these magnetic poles are messy.
1227000	1232000	After the mess, the whole is not magnetic.
1232000	1236000	But if you lower the temperature,
1236000	1240000	Then because of this magnetic pole and the magnetic pole,
1240000	1242000	There will be some interaction.
1242000	1247000	These interactions will make these magnetic poles,
1247000	1251000	The direction is still in the same direction.
1251000	1257000	When everyone is lined up in roughly the same direction,
1257000	1262000	The overall magnetic nature will be displayed.
1262000	1264000	You will see that it is a magnet.
1264000	1267000	It is the overall direction.
1267000	1271000	For example, this arrow here is N-level,
1271000	1272000	This is S-level.
1272000	1273000	If everyone is messy,
1273000	1275000	The whole thing is offset.
1276000	1281000	I found a YouTube video.
1281000	1283000	It's probably like this.
1283000	1286000	Can you see it now?
1286000	1288000	Should be no problem.
1288000	1291000	Yes, I can see it.
1291000	1294000	There is a piece of iron on the top.
1294000	1295000	Put a piece of iron.
1295000	1299000	After the magnetic iron below is red,
1299000	1307000	The red magnetic iron is magnetic.
1307000	1309000	Its magnetic pole is messy.
1309000	1312000	Messy, then there is no magnetic nature.
1312000	1314000	But after it slowly cools down,
1314000	1317000	The temperature is low enough.
1317000	1322000	Because it has an interaction between the magnetic pole and the magnetic pole.
1323000	1327000	When the temperature is low enough,
1327000	1330000	It will be aligned with everyone in the same direction.
1330000	1332000	There is a magnetic pole in the same direction.
1332000	1334000	If there is a magnetic pole,
1334000	1337000	It becomes iron magnetic.
1337000	1341000	Iron magnetic is the meaning of this magnetic iron.
1341000	1345000	There should be no problem.
1345000	1350000	Another one is that it is lined up well.
1350000	1356000	But it does not have a total magnetic force.
1356000	1359000	The total magnetic iron.
1359000	1368000	Although the super island I just talked about.
1368000	1371000	When you are not mixed, it is iron magnetic.
1371000	1374000	What does iron magnetic mean?
1374000	1377000	That is to say, your magnetic pole.
1377000	1379000	This magnetic pole.
1379000	1381000	How did this magnetic pole come?
1381000	1387000	Part of it is the orbital momentum of the electron.
1387000	1390000	And the other part is the magnetic circle.
1390000	1396000	If these magnetic poles are interspersed.
1396000	1401000	For example, here is up, down, up, down, up, down, up.
1401000	1403000	Interspersed.
1403000	1406000	It is also lined up well.
1406000	1413000	But it does not have the iron magnetic force of the magnet just now.
1413000	1416000	But it still has order.
1416000	1419000	This iron magnetic force.
1419000	1426000	Although there is no total magnetic force.
1426000	1436000	But it is completely different from the one that was completely messed up just now.
1436000	1442000	Because the magnetic pole of the burning red iron is messy.
1442000	1446000	This iron magnetic pole.
1446000	1451000	The magnetic pole is very well arranged.
1452000	1457000	After that, I will mainly talk about.
1457000	1464000	If these magnetic poles are arranged into a chain.
1464000	1468000	Of course, this is the intention below.
1468000	1471000	Because you are not taking a magnet.
1471000	1474000	Then directly this magnet.
1474000	1479000	Because there are countless magnetic poles in a magnet.
1479000	1482000	Or there are already a lot of magnetic poles inside.
1482000	1485000	Then we have to discuss later.
1485000	1490000	It is said that the magnetic pole is arranged into a circle.
1490000	1496000	Then the magnetic pole and the magnetic pole next door have some interaction.
1496000	1502000	Will this cause the whole?
1502000	1506000	Will there be a state of order?
1506000	1513000	Or will it be a whole?
1513000	1515000	What is the order?
1515000	1520000	Simply put, everything has an order.
1520000	1525000	For example, electrons also have an order.
1525000	1528000	The light also has an order.
1528000	1530000	The magnet also has an order.
1530000	1532000	Quark also has an order.
1533000	1536000	Everything has an order.
1536000	1546000	Order is a basic physical nature.
1546000	1550000	Quark also has an order.
1550000	1552000	Quark's order is 1.
1553000	1557000	But Quark's order is 1.
1557000	1562000	Its z-direction can only be positive or negative 1.
1562000	1570000	So we see that light has a polarizing direction.
1570000	1572000	There is a left-handed light and a right-handed light.
1572000	1574000	Light has an order.
1574000	1576000	The order of light is 1.
1576000	1581000	All orders should be divided into two categories.
1581000	1592000	One is the order of one-half, three-thirds, five-fifths, seven-fifths.
1592000	1602000	This kind of half-order is called quark.
1602000	1605000	The other is the order of the whole.
1605000	1609000	For example, the order is 0, 1, 2, 3, 4, 5.
1609000	1611000	This is called quark.
1611000	1614000	Light has an order of 1.
1614000	1616000	So it is quark.
1616000	1621000	Electrons have an order of one-half.
1621000	1623000	So it is quark.
1624000	1626000	Like this.
1626000	1627000	Sorry.
1627000	1628000	Go on.
1628000	1629000	That's right.
1629000	1630000	Yes.
1630000	1631000	Is it OK?
1631000	1632000	Yes.
1632000	1633000	OK.
1633000	1644000	So the spin-chain discussed later is related to quark.
1644000	1650000	Is it an order or a half-order?
1650000	1652000	This is a big deal.
1652000	1658000	These are two very different types.
1658000	1666000	Before talking about these orders,
1666000	1670000	what is symmetry?
1670000	1674000	What is asymmetry?
1674000	1677000	What is asymmetry?
1677000	1689000	Asymmetry means that after you have done a certain operation, the result does not change.
1689000	1692000	For example, as I just said,
1692000	1698000	parallel symmetry, rotation symmetry, mirror symmetry, time parallel, time inverse,
1698000	1700000	any kind of operation.
1700000	1708000	Can you see me now?
1708000	1710000	Yes.
1710000	1713000	For example, I take this.
1713000	1722000	If you don't look at the pattern on this ball,
1722000	1725000	if they are all the same color,
1725000	1728000	I just turn 360 degrees like this.
1728000	1731000	I'll cover it up first.
1731000	1735000	Then I'll turn a little bit.
1735000	1736000	Then I'll show you.
1736000	1738000	Then you don't know.
1738000	1743000	You will never be able to tell if I'm turning or not.
1743000	1744000	Right?
1744000	1750000	So it means that this ball has the symmetry of this rotation.
1750000	1752000	There is already a pattern on it.
1752000	1756000	Of course, this pattern will destroy its rotation.
1756000	1759000	Because if I turn like this, you will recognize this pattern.
1759000	1762000	You know I have turned.
1762000	1767000	But if this is all blue,
1767000	1771000	I can turn this three-dimensional corner.
1771000	1777000	This is a rotation symmetry.
1777000	1783000	What about this apple?
1783000	1787000	This apple, you have an imagination first.
1787000	1789000	There is a meme here.
1789000	1792000	And then, here,
1792000	1797000	So if I turn like this,
1797000	1799000	Then you will find that it is different.
1799000	1804000	But if I turn like this along this axis,
1805000	1807000	Assuming its shape is perfect.
1807000	1814000	Then you will see that it also has this rotation symmetry.
1814000	1817000	But this rotation symmetry
1817000	1824000	Only with this Z axis as the rotation axis
1824000	1826000	You have this symmetry.
1826000	1829000	I can turn like this.
1829000	1834000	I can also turn like this.
1834000	1838000	I can also turn like this.
1838000	1844000	I can also turn like this.
1844000	1853000	The symmetry of this apple is less than the symmetry of this ball.
1853000	1856000	Because it only rotates like this.
1856000	1862000	This ball can rotate in any way.
1862000	1867000	If so, you will see that this and this ring
1867000	1869000	I made a ring.
1869000	1873000	This ring is the same.
1873000	1879000	I turn like this, the result is unchanged.
1879000	1885000	What about this bagel?
1885000	1888000	If I turn like this,
1888000	1894000	You will not know that I have turned.
1894000	1901000	Of course, if this is the case,
1901000	1906000	If I put a sticker on it,
1906000	1908000	Do you know that I have turned?
1908000	1911000	For example, I'm hungry now.
1911000	1918000	I'm hungry, I take a bite.
1918000	1923000	Now after being bitten by me
1923000	1930000	It has lost the symmetry of this rotation.
1930000	1931000	This is also the same.
1931000	1933000	This bagel is also the same.
1933000	1937000	If I don't bite too big
1937000	1939000	I take a bite first.
1939000	1944000	I bought a lot today.
1944000	1947000	I bite a little bit.
1947000	1950000	I don't bite this hole.
1950000	1956000	Then it has no symmetry of this rotation.
1956000	1961000	In other words, what does this bite cause?
1961000	1964000	Causing a defect
1964000	1966000	Causing a defect
1966000	1977000	Defects will affect a lot of things.
1977000	1981000	What I'm going to talk about later is Torpo.
1981000	1986000	Torpo
1986000	1990000	Let's play a little game first.
1990000	1993000	I have a ring here.
1993000	2000000	I have a ring here.
2000000	2004000	If I use a pen
2004000	2008000	Many people should know that
2008000	2009000	If I go from here
2009000	2012000	Then follow this ring
2012000	2021000	Go around like this
2022000	2025000	Go around and pick it up.
2025000	2030000	Wait for the paper to turn 360 degrees
2030000	2034000	I'll go back to the origin.
2034000	2038000	These two are not the same.
2038000	2041000	One
2041000	2044000	I do this too.
2045000	2049000	I am also back to the origin.
2049000	2051000	But this is not.
2051000	2053000	When this is done
2053000	2058000	This ring is very different from these two rings.
2058000	2063000	This ring is just like this one.
2063000	2065000	This ring is just like this one.
2065000	2068000	These two rings are very different.
2068000	2072000	This ring is just like this one.
2072000	2074000	This ring is just like this one.
2074000	2076000	In fact, the same
2076000	2080000	I twisted it a little bit.
2080000	2082000	In fact, this ring is just like this.
2082000	2085000	This ring is like this.
2085000	2087000	So you see, I just painted black here.
2087000	2089000	If there is
2089000	2093000	Usually there is an ant walking up
2093000	2095000	After going around
2095000	2098000	You will return to the original place.
2098000	2100000	This ring is like this.
2100000	2102000	This ring is not
2102000	2108000	This ring is the so-called Mobius ring.
2108000	2110000	What if
2110000	2112000	I have an ant here
2112000	2115000	Walk like this
2115000	2118000	Walk like this
2118000	2120000	Go go go
2120000	2122000	Go go go
2122000	2124000	Go around
2124000	2126000	Go
2126000	2129000	After going around
2129000	2130000	He will
2130000	2131000	He actually
2131000	2133000	I'm going around now.
2133000	2134000	Go around
2134000	2136000	As a result, I ran to this path.
2136000	2138000	Run to the back of this ring
2138000	2140000	Not the same as this
2140000	2143000	After two laps
2143000	2146000	Will return to the origin
2146000	2148000	This is a
2149000	2153000	It's completely different from a few boxes.
2153000	2155000	This thing
2155000	2159000	And then go back to the video.
2168000	2169000	That
2169000	2173000	What I just said is symmetrical.
2173000	2175000	This is symmetrical.
2175000	2177000	That
2177000	2179000	This is symmetrical.
2179000	2181000	Has been destroyed
2181000	2182000	That
2182000	2183000	With
2183000	2186000	What does it have to do with the photo?
2186000	2188000	Because we know
2188000	2189000	Is
2189000	2190000	Ah
2190000	2191000	If you
2191000	2192000	If
2192000	2193000	Ah
2193000	2194000	You have one
2194000	2196000	Energy or free energy
2196000	2197000	He
2197000	2199000	If he is a certain parameter
2199000	2201000	If the function
2201000	2204000	Then you basically free energy should be like
2205000	2207000	Energy is like the lower the better
2207000	2208000	Will be stable
2208000	2209000	If your
2209000	2212000	At first your function is like this
2212000	2213000	So
2213000	2215000	If you have a ball here
2215000	2216000	He is of course symmetrical
2216000	2218000	Because of this symmetry
2218000	2220000	Symmetry is of course
2220000	2224000	Is the lowest point of energy
2224000	2227000	But if your external parameters
2227000	2228000	Change
2228000	2229000	For example, your temperature
2229000	2231000	Temperature changes
2231000	2232000	Temperature
2232000	2233000	Low temperature
2233000	2234000	Your temperature is getting lower and lower
2234000	2237000	That causes this function to change
