start	end	text
1364000	1365000	According to our previous results,
1365000	1368000	if this sound is consistent with this pattern,
1368000	1371000	it should help the receiver see this pattern.
1371000	1373000	Is that true?
1373000	1374000	The answer is that this is true.
1374000	1376000	We found that if the sound is played
1376000	1381000	at 150 milliseconds before the shape,
1381000	1384000	the receiver will have a significant threshold reduction phenomenon.
1384000	1385000	yx is the threshold.
1385000	1386000	You can think of this as
1386000	1389000	how many luminance they need to see the shape.
1389000	1392000	So the lower it is, the easier it is to see the shape.
1392000	1395000	So when the sound is played at 150 milliseconds before,
1395000	1397000	if the sound is consistent with the shape,
1397000	1399000	the receiver will be easier to see the shape.
1399000	1400000	Again, it means that
1400000	1403000	the integration between the sound and the shape
1403000	1406000	is very likely to occur in a preconscious state
1406000	1409000	or unconscious state.
1409000	1411000	Through this series of studies,
1411000	1412000	the first thing we found was that
1412000	1413000	the effect of boobakiki
1413000	1416000	can occur in an unconscious state
1416000	1418000	or in a conscious state.
1419000	1421000	We also explained that
1421000	1423000	the important thing is what the word itself represents,
1423000	1424000	what the sound is,
1424000	1426000	not what the shape of the word is.
1426000	1427000	Finally, we found that
1427000	1429000	if you use a sound directly,
1429000	1430000	it will help a shape
1430000	1433000	that should have been hidden by the mask
1433000	1434000	to be seen more easily.
1434000	1436000	So again, it proves that
1436000	1438000	the correspondence between sound and shape
1438000	1439000	is very likely to occur
1439000	1443000	before the conscious threshold.
1443000	1446000	This is the first part of the experiment.
1446000	1448000	Do you have any questions?
1448000	1450000	If it's too fast or too slow,
1450000	1451000	you can tell me.
1456000	1458000	If you have any questions,
1458000	1460000	you can type next to me,
1460000	1461000	and I will help you ask.
1461000	1464000	You can also turn on the microphone yourself to ask.
1464000	1467000	But we set the microphone to silent.
1467000	1470000	So if you didn't notice,
1470000	1472000	you have to turn on the microphone
1472000	1474000	to ask questions.
1474000	1475000	I have a question.
1475000	1476000	Sorry.
1476000	1477000	Go ahead.
1477000	1480000	In the picture of the contrast,
1480000	1482000	does the contrast mean
1482000	1484000	that 22% and 23%
1484000	1489000	are gray and black?
1489000	1492000	The contrast is actually the alpha value.
1492000	1493000	OK.
1493000	1495000	Isn't 22% and 23% very different?
1495000	1498000	I can't see it with my naked eye.
1498000	1500000	Yes, it's very different.
1500000	1503000	The unconscious effect is usually very small.
1503000	1505000	One of the reasons is that
1505000	1507000	in the process of doing these experiments,
1507000	1510000	we want to make the audience unable to see.
1510000	1513000	For example, there are two ways.
1513000	1516000	The first is to make it very dark.
1516000	1519000	The second is to use masking or CFS
1519000	1521000	to make people unable to see.
1521000	1523000	So we intentionally or unintentionally
1523000	1525000	make the amount of information very small.
1525000	1528000	Usually the effect will not be very large.
1528000	1530000	Of course, this is statistically significant.
1530000	1532000	But it's hard to tell the difference
1532000	1533000	between the two.
1533000	1535000	But this is actually the point.
1535000	1537000	The point is that
1537000	1539000	in your consciousness,
1539000	1542000	you can't tell the difference.
1542000	1543000	OK.
1543000	1545000	But maybe your eyes
1545000	1548000	can still tell the difference.
1548000	1551000	But we consciously eliminated it.
1551000	1554000	So I can't feel it.
1554000	1556000	You can say that.
1556000	1558000	OK. Thank you.
1559000	1560000	OK.
1560000	1563000	Let's move on to the next research.
1563000	1564000	If you have any questions,
1564000	1565000	we can come back and discuss.
1565000	1566000	OK.
1566000	1567000	In this experiment,
1567000	1569000	we will explain to you that
1569000	1571000	the integration between sound and shape
1571000	1574000	can occur in the unconscious state.
1574000	1577000	The next research I want to talk to you about is...
1577000	1578000	Sorry.
1578000	1580000	Someone has a question.
1580000	1581000	He's next to me.
1581000	1582000	OK.
1582000	1584000	His question is this.
1584000	1586000	He said he wanted to ask
1586000	1588000	how to test the difference between
1588000	1590000	the dominant eye
1590000	1593000	and the dominant eye.
1593000	1595000	What part of the experiment will it affect?
1595000	1596000	OK.
1596000	1598000	This is a good question.
1598000	1601000	I don't have the official results
1601000	1603000	to support the second question.
1603000	1606000	But if I remember correctly,
1606000	1607000	the dominant eye is
1607000	1609000	when you put the design material
1609000	1611000	and what you want the other person to see,
1611000	1613000	which we call the suppressor,
1613000	1614000	in which eye?
1614000	1615000	I remember doing it.
1615000	1617000	The results are similar.
1617000	1619000	So it's a bit like a convention.
1619000	1621000	We put the suppressor on the dominant eye
1621000	1623000	because it's usually easier for you
1623000	1625000	to see what's on the other eye.
1625000	1627000	Because it's your superior eye.
1627000	1628000	So relatively speaking,
1628000	1630000	if what's on that eye is very salient,
1630000	1632000	it's even harder for you to see
1632000	1633000	what's on the other eye.
1633000	1634000	This is the reason.
1634000	1636000	So how do we know the dominant eye?
1636000	1638000	There are many ways to test it.
1638000	1639000	The simplest way is that
1639000	1641000	you can, for example,
1641000	1643000	form a small hole.
1643000	1645000	You can stretch out your hand
1645000	1647000	and look at something through the hole.
1647000	1649000	Both of your eyes have to open.
1649000	1650000	At this time,
1650000	1651000	you close one of your eyes,
1651000	1652000	and you'll find that
1652000	1654000	only one eye can see
1654000	1656000	what you're looking at.
1656000	1657000	That eye,
1657000	1659000	we usually call it the dominant eye.
1659000	1660000	When I force you to use one eye,
1660000	1662000	which eye will you look at?
1664000	1666000	You can try it later.
1668000	1669000	Excuse me.
1669000	1671000	Can I ask a question?
1671000	1672000	Go ahead.
1673000	1675000	My name is Wen Wen.
1675000	1677000	I'm from the University of Tokyo.
1677000	1678000	Hello.
1679000	1680000	I'd like to ask,
1680000	1682000	will there be a discussion later
1682000	1684000	about why there's this
1684000	1686000	congruence benefit?
1686000	1687000	Why do consistent things
1687000	1689000	enter the conference earlier
1689000	1691000	than inconsistent things?
1691000	1694000	Because in different fields,
1694000	1696000	sometimes inconsistent things
1696000	1698000	may be more salient.
1698000	1699000	And consistent things
1699000	1702000	are not very attractive.
1702000	1704000	Why do consistent things
1704000	1706000	in perception
1706000	1711000	have a more attractive position?
1712000	1713000	That's a good question.
1713000	1715000	And I've been facing this question myself.
1715000	1716000	Because in my different experiments,
1716000	1718000	sometimes consistent things
1718000	1719000	enter the state of consistency earlier,
1719000	1720000	and sometimes inconsistent things
1720000	1722000	enter the state of consistency earlier.
1722000	1723000	I'll come back.
1723000	1724000	I'll come back to this question
1724000	1726000	after all three of my research is done.
1726000	1727000	Okay, thank you.
1729000	1731000	I don't know how you control your time,
1731000	1733000	but I have a question.
1733000	1735000	If you think this is too much,
1735000	1737000	we can ask together at the end.
1737000	1738000	Okay, I'll speak faster.
1738000	1740000	How do you control
1740000	1742000	the age and gender of the audience?
1743000	1745000	There's no control in this study.
1745000	1747000	So we basically collect young people,
1747000	1748000	18 to 35 years old.
1748000	1749000	This is a visual study.
1749000	1751000	It's a bit of a conventional convention.
1751000	1753000	And gender is balanced.
1754000	1756000	Age is that period.
1756000	1758000	Gender is balanced.
1759000	1762000	Okay, I'm going to move on to the next study.
1764000	1765000	So in the next study,
1765000	1767000	I'm going to talk about a
1767000	1768000	unconscious science.
1768000	1770000	Everyone is relative.
1770000	1771000	Unconscious science is not a very popular science.
1771000	1772000	But in unconscious science,
1772000	1773000	of course, there are also more popular things.
1773000	1774000	That is,
1774000	1777000	unconscious meaning or language processing.
1777000	1778000	Okay, I want to tell you that
1778000	1780000	this language processing
1780000	1781000	will still be controlled by
1781000	1784000	the high and low difficulty of what we do.
1784000	1785000	Okay, like I said,
1785000	1787000	Unconscious meaning or language processing
1787000	1788000	has always been a
1788000	1789000	prominent field in this field.
1789000	1790000	Why?
1790000	1791000	In fact, intuitively speaking,
1791000	1793000	if we find that there is unconscious processing today,
1793000	1795000	the first thing I will be interested in is
1795000	1797000	that when I didn't see this word
1797000	1798000	or didn't hear this word,
1798000	1800000	can I understand what it means?
1800000	1802000	This is actually a pretty intuitive
1802000	1803000	and everyone wants to know the problem.
1803000	1804000	That's true.
1804000	1806000	This field has been studied for decades.
1806000	1808000	Everyone in different visual paradigms,
1808000	1810000	including Mr. Ye Su-lin of the Taiwan Psychological Department,
1810000	1811000	also found that
1811000	1812000	the meaning of a word,
1812000	1814000	even if you don't see it,
1814000	1815000	can also be read by you.
1815000	1817000	It will even affect the judgment of another word.
1817000	1818000	Okay, as you can see,
1818000	1820000	in the third Continuous Flash Suppression,
1820000	1821000	this is the paradigm we used
1821000	1823000	in the first experiment.
1823000	1825000	Okay, under this paradigm,
1825000	1827000	unfortunately or even luckily,
1827000	1829000	in fact, its results have not been stable.
1829000	1831000	Some experimenters found that
1831000	1833000	the meaning of the word can indeed
1833000	1835000	survive under this paradigm.
1835000	1837000	Even if the recipient can't see the word,
1837000	1838000	the meaning of the word seems to be able to be extracted
1838000	1840000	and then affect their judgment of another task.
1840000	1842000	Some of the experiments
1842000	1843000	did not work.
1843000	1845000	Okay, this experiment,
1845000	1846000	this study,
1846000	1848000	the initial intention
1848000	1849000	is actually to know
1849000	1850000	why there is this difference.
1850000	1853000	We want to make a big assumption
1853000	1855000	that maybe in different paradigms,
1855000	1856000	everyone uses the same paradigm,
1856000	1857000	but some people find it,
1857000	1858000	some people can't find it.
1858000	1860000	The reason is actually something else.
1860000	1862000	The reason we want to mention here is
1862000	1865000	whether it is related to the difficulty of the task.
1865000	1866000	What does this mean?
1866000	1867000	It means that
1867000	1870000	we assume that there is conscious processing
1870000	1871000	and unconscious processing.
1871000	1872000	Conscious processing
1872000	1874000	actually shares the same resources.
1874000	1876000	You can think of it as attention.
1876000	1878000	If they share the same resources,
1878000	1880000	then conscious processing,
1880000	1882000	if the task is more difficult,
1882000	1883000	then you spend all the resources.
1883000	1884000	Your unconscious processing
1884000	1885000	can't be produced.
1885000	1886000	In other words,
1886000	1887000	if you do this conscious task now,
1887000	1888000	it's actually quite simple.
1888000	1889000	Then you have more resources
1889000	1891000	that can be distributed to unconscious processing.
1891000	1893000	Next, we want to discuss this study
1893000	1895000	with everyone
1895000	1898000	to see if this hypothesis is true.
1898000	1900000	In order to test this hypothesis,
1900000	1902000	we made a paradigm called
1902000	1903000	Double Stroke Paradigm.
1903000	1905000	What is this paradigm?
1905000	1907000	For example, I will show you two words now.
1907000	1909000	You may be very intuitive to read red and blue.
1909000	1911000	Of course, there are other reasons
1911000	1913000	why people don't read blue and red.
1913000	1914000	But one of the reasons is
1914000	1917000	if I ask you to read the colors of these words now,
1917000	1919000	the left is blue and the right is red,
1919000	1920000	you will find that reading colors
1920000	1923000	is much more difficult than reading words.
1923000	1924000	Why?
1924000	1925000	Because when we read colors,
1925000	1927000	we are easily disturbed by words.
1927000	1928000	This is a famous
1928000	1930000	Stroke phenomenon.
1930000	1931000	You don't have to worry that
1931000	1933000	our readers will not read red and blue,
1933000	1936000	because we are doing research in English.
1936000	1939000	So in the case of reading colors,
1939000	1940000	as I just said,
1940000	1942000	usually the reader will have a higher
1942000	1945000	level of language interference,
1945000	1946000	so they want to read words.
1946000	1948000	Because reading words is a stronger process,
1948000	1951000	and it is usually relatively automated.
1951000	1952000	On the other hand,
1952000	1954000	when they read words,
1954000	1956000	they usually read better.
1956000	1958000	Because the color here
1958000	1960000	has a weaker effect.
1960000	1961000	If there is an effect,
1961000	1963000	it is usually called the Reverse Stroke Effect.
1963000	1967000	Let's define these two different conditions
1967000	1969000	as high-low and low-low.
1969000	1970000	In the case of reading words,
1970000	1972000	it is relatively simple, it is low-low.
1972000	1974000	But in the case of reading colors,
1974000	1976000	it is more difficult, it is high-low.
1976000	1977000	What we want to know is
1977000	1978000	if we put another word
1978000	1980000	before they react to this word
1980000	1982000	so that they can't see it,
1982000	1985000	will the consistency between the two words
1985000	1988000	affect their judgment of this word?
1988000	1989000	If it does,
1989000	1990000	what should it be in?
1990000	1991000	Should it be in a high-difficulty situation
1991000	1994000	or a low-difficulty situation?
1994000	1997000	I will go into the details of our research.
1997000	1998000	The same is used here
1998000	2000000	is the paradigm of double-eyed reading.
2000000	2001000	So you will still see
2001000	2003000	three different strings later.
2003000	2004000	At the beginning,
2004000	2005000	we just try to
2005000	2007000	keep the first word from being seen.
2007000	2009000	This is a bit different from before.
2009000	2010000	Before, we wanted to measure
2010000	2011000	how long that thing would be seen.
2011000	2012000	In this experiment,
2012000	2014000	we don't want it to be seen.
2014000	2015000	So let's show you again.
2015000	2016000	This is actually a
2016000	2017000	slightly different paradigm.
2017000	2018000	You will find that the way it flashes
2018000	2019000	is a bit different.
2019000	2021000	If you want to know the technical details,
2021000	2022000	we can discuss it later.
2022000	2023000	What we want to do
2023000	2025000	is just to make the receiver see this word.
2025000	2027000	So the receiver in this process,
2027000	2028000	when we put the first word
2028000	2029000	prime,
2029000	2030000	it can actually react.
2030000	2031000	If it says, oh, I saw it,
2031000	2032000	they press a button,
2032000	2033000	we will label this trial
2033000	2034000	as a conscious trial.
2034000	2035000	These trials
2035000	2036000	will not be analyzed later.
2036000	2037000	What we are interested in
2037000	2039000	is when they can't see this word,
2039000	2041000	how do they affect the next word?
2041000	2042000	In this process,
2042000	2043000	they say they can see it.
2043000	2044000	In the process of not seeing it,
2044000	2046000	we will adjust the brightness of this word
2046000	2047000	to keep this word
2047000	2049000	always almost visible
2049000	2051000	and a little bit invisible.
2051000	2053000	If they don't see the word
2053000	2054000	in this situation,
2054000	2056000	we will move on to the next stage.
2056000	2058000	We will present a word with color.
2058000	2059000	We will teach it
2059000	2060000	to read words in some experiments.
2060000	2061000	In some experiments,
2061000	2062000	we teach it to read colors.
2062000	2064000	That's the case of low difficulty
2064000	2066000	and high difficulty.
2066000	2069000	In the first layer,
2069000	2070000	when we say,
2070000	2071000	oh, it can actively report
2071000	2072000	that it has seen
2072000	2074000	or has not seen the word,
2074000	2076000	that is a subjective report
2076000	2078000	that they have not realized this word.
2078000	2079000	We also want to establish
2079000	2081000	an objective standard
2081000	2082000	that when it really
2082000	2083000	didn't see this word,
2083000	2084000	what would happen?
2084000	2085000	What we do is
2085000	2086000	we add a location task.
2086000	2087000	What is this?
2087000	2089000	At the end of each trial,
2089000	2090000	we ask it to judge
2090000	2091000	and ask it to guess
2091000	2092000	that you just didn't see that word,
2092000	2093000	that prime.
2093000	2094000	Please guess
2094000	2095000	whether the word
2095000	2096000	is above or below.
2096000	2097000	That's the logic.
2097000	2099000	If it really didn't see that word,
2099000	2101000	then its performance on this task
2101000	2102000	should be chance,
2102000	2103000	because it didn't see that word.
2103000	2105000	Indeed, across several experiments,
2105000	2106000	we found in this study
2106000	2107000	that their performance
2107000	2109000	on the location task
2109000	2110000	is about chance,
2110000	2112000	and there is no difference
2112000	2113000	with 50%.
2113000	2114000	So we want to establish
2114000	2116000	that subjectively and objectively,
2116000	2118000	it really didn't see that word.
2118000	2119000	In the case that it didn't see
2119000	2120000	that word,
2120000	2121000	if the two words
2121000	2122000	are not the same,
2122000	2123000	will it affect you
2123000	2125000	to read words or read colors?
2125000	2126000	The answer is yes.
2126000	2128000	This is the case of reading words.
2128000	2129000	The case of reading words
2129000	2130000	is a relatively low-difficulty situation.
2130000	2131000	You can see that the left corner
2131000	2133000	is our result.
2133000	2134000	This is when the two words
2134000	2135000	are the same,
2135000	2136000	it is congruent.
2136000	2137000	This is the case where the two words
2137000	2138000	are inconsistent.
2138000	2139000	In an inconsistent situation,
2139000	2140000	they will take about 5% of the time.
2140000	2141000	This is a standardized
2141000	2142000	normalized RT,
2142000	2143000	because we put a lot of
2143000	2144000	blank trials
2144000	2145000	at the same time
2145000	2146000	in this experiment,
2146000	2147000	that is,
2147000	2148000	in the case
2148000	2149000	where the word should be put,
2149000	2150000	the word should be put,
2150000	2151000	we sometimes
2151000	2152000	didn't show anything.
2152000	2153000	So that's our baseline.
2153000	2154000	So compared to the baseline,
2154000	2156000	if the two words are inconsistent,
2156000	2157000	they will take
2157000	2158000	about 5% of the time.
2158000	2160000	This is a relatively simple
2160000	2161000	case of reading words.
2161000	2162000	In the case of reading colors,
2162000	2163000	this is a high-low,
2163000	2164000	a more difficult situation.
2164000	2165000	We found that this effect
2165000	2166000	disappeared.
2166000	2167000	So at least so far,
2167000	2168000	this seems to indicate that
2168000	2170000	unconscious processing
2170000	2171000	does not seem to be so automated.
2171000	2173000	Because the exact same design
2173000	2174000	is in one situation,
2174000	2175000	there will be
2175000	2176000	unconscious interference.
2176000	2177000	In another situation,
2177000	2178000	there will be
2178000	2179000	unconscious interference.
2179000	2180000	What happened?
2180000	2181000	Just like we just said,
2181000	2182000	we just assumed at the beginning
2182000	2183000	that this was related to
2183000	2184000	the difficulty of the task,
2184000	2185000	the high and low.
2185000	2186000	If it really has
2186000	2187000	something to do with
2187000	2188000	the difficulty of the task,
2188000	2189000	then think about it.
2189000	2190000	This is a
2190000	2191000	reading color is
2191000	2192000	a relatively difficult task.
2192000	2193000	If I keep training
2193000	2194000	the collector to do this task,
2194000	2195000	let him do it for a long time,
2195000	2196000	do it to a level
2196000	2197000	that he becomes very powerful.
2197000	2198000	In theory,
2198000	2199000	this high-difficulty task
2199000	2200000	becomes simpler and simpler,
2200000	2201000	becoming a low-difficulty task.
2201000	2202000	When this high-difficulty task
2202000	2203000	becomes a low-difficulty task,
2203000	2205000	if we follow our theory,
2205000	2206000	it should have more resources
2206000	2207000	that can be distributed to
2207000	2208000	unconscious information processing.
2208000	2209000	At this time,
2209000	2211000	interference should be re-generated.
2211000	2212000	If you have participated in
2212000	2213000	visual research,
2213000	2214000	you will find that
2214000	2215000	visual scientists love to
2215000	2216000	do a lot of trials.
2216000	2217000	In fact,
2217000	2218000	at this time,
2218000	2219000	we have also
2219000	2220000	taught everyone to do
2220000	2221000	about 350 trials.
2221000	2222000	So they did
2222000	2223000	a total of
2223000	2224000	30-40 minutes.
2224000	2225000	The first thing we want to do
2225000	2226000	is to see
2226000	2227000	if there is a difference
2227000	2228000	in the performance of the
2228000	2229000	previous trial and the
2229000	2230000	subsequent trial.
2230000	2231000	Compared with the
2231000	2232000	previous quarter trial
2232000	2233000	and the subsequent quarter trial,
2233000	2234000	they are faster
2234000	2235000	in the subsequent quarter trial.
2235000	2236000	We found that
2236000	2237000	this may mean that
2237000	2238000	the difficulty of this task
2238000	2239000	has relatively
2239000	2240000	become lower
2240000	2241000	because they do better and better.
2241000	2242000	At this time,
2242000	2243000	let's look at
2243000	2244000	the first
2244000	2245000	quarter trial.
2245000	2246000	Basically,
2246000	2247000	their performance
2247000	2248000	is very similar
2248000	2249000	to that of all
2249000	2250000	trials.
2250000	2251000	They will not be
2251000	2252000	interfered with
2252000	2253000	by
2253000	2254000	this
2254000	2255000	unconscious word.
2255000	2256000	In the subsequent
2256000	2257000	quarter trial,
2257000	2258000	we found that
2258000	2259000	the original interference
2259000	2260000	phenomenon
2260000	2261000	was produced
2261000	2262000	when we
2262000	2263000	saw the
2263000	2264000	interference
2264000	2265000	phenomenon
2265000	2266000	when we
2266000	2267000	read the
2267000	2268000	words.
2268000	2269000	At this time,
2269000	2270000	it conforms to
2270000	2271000	our assumption
2271000	2272000	that
2272000	2273000	when the
2273000	2274000	first
2274000	2275000	quarter trial
2275000	2276000	occurs,
2276000	2277000	the
2277000	2278000	second
2278000	2279000	quarter trial
2279000	2280000	occurs.
2280000	2281000	The
2281000	2282000	combination of
2282000	2283000	the two
2283000	2284000	experiments
2284000	2285000	at least
2285000	2286000	explains
2286000	2287000	one thing,
2287000	2288000	which is
2288000	2289000	the
2289000	2290000	unconscious
2290000	2291000	prime
2291000	2292000	that
2292000	2293000	they can't
2293000	2294000	see,
2294000	2295000	and
2295000	2296000	the
2296000	2297000	unconscious
2297000	2298000	target
2298000	2299000	that
2299000	2300000	they
2300000	2301000	are reacting
2301000	2302000	to.
2302000	2303000	When the
2303000	2304000	first
2304000	2305000	quarter trial
2305000	2306000	occurs,
2306000	2307000	they are
2307000	2308000	more likely
2308000	2309000	to be
2309000	2310000	interfered with
2310000	2311000	by
2311000	2312000	this
2312000	2313000	unconscious
2313000	2314000	word.
2314000	2315000	When the
2315000	2316000	second
2316000	2317000	quarter trial
2317000	2318000	occurs,
2318000	2319000	they are
2319000	2320000	more likely
2320000	2321000	to be
2321000	2322000	interfered with
2322000	2323000	by
2323000	2324000	this
2324000	2325000	unconscious
2325000	2326000	word.
2326000	2327000	When the
2327000	2328000	first
2328000	2329000	quarter trial
2329000	2330000	occurs,
2330000	2331000	they are
2331000	2333000	more likely
2333000	2334000	to be
2334000	2336000	interfered with
2336000	2337000	by
2337000	2338000	this
2338000	2339000	cold
2339000	2340000	object
2340000	2341000	or
2341000	2343000	subconscious
2343000	2344000	object.
2344000	2346000	When the
2346000	2347000	second
2347000	2348000	quarter trial
2348000	2349000	occurs,
2349000	2350000	they
2350000	2351000	are
2351000	2352000	more likely
2352000	2353000	to be
