start	end	text
1302000	1304000	Therefore, news from London
1304000	1306000	had to wait three or five days
1306000	1308000	before it could be sent to Amsterdam.
1308000	1310000	He thought
1310000	1312000	that the agent variables
1312000	1314000	of economic development
1314000	1316000	were the high and low prices
1316000	1318000	of East India Company's shares.
1318000	1320000	Whenever a judicial independence
1320000	1322000	law or reform
1322000	1324000	occurred in the UK,
1324000	1326000	East India Company's shares
1326000	1328000	would rise or fall
1328000	1330000	when the news
1330000	1332000	was sent to Amsterdam.
1332000	1334000	He used statistics
1334000	1336000	to infer the situation in the UK.
1336000	1338000	In the end,
1338000	1340000	he concluded that
1340000	1342000	every judicial independence reform
1342000	1344000	in the UK
1344000	1346000	had something to do
1346000	1348000	with the rise of
1348000	1350000	East India Company's shares.
1350000	1352000	Without historical training,
1352000	1354000	East India Company's shares
1354000	1356000	would not have risen.
1356000	1358000	This is another theory.
1358000	1360000	In the early years,
1360000	1362000	there was a theory
1362000	1364000	that asked
1364000	1366000	why there was
1366000	1368000	no China in the West.
1368000	1370000	In the early years,
1370000	1372000	historians liked to ask
1372000	1374000	why there was no capitalism in China,
1374000	1376000	why there was no scientific revolution in China,
1376000	1378000	and why there was no
1378000	1380000	revolution in China.
1380000	1382000	The next theory is
1382000	1384000	very popular recently,
1384000	1386000	but it is a bit similar
1386000	1388000	to the idea of a national state.
1388000	1390000	Historians believe that
1390000	1392000	the people's historical memory
1392000	1394000	should not serve the country.
1394000	1396000	Therefore,
1396000	1398000	historians began to write
1398000	1400000	some important historical memories.
1400000	1402000	For example,
1402000	1404000	transitional justice should tell you
1404000	1406000	that the Nazi massacre
1406000	1408000	against the Jews
1408000	1410000	was really horrible.
1410000	1412000	We should remember this
1412000	1414000	forever.
1414000	1416000	Because it happened once,
1416000	1418000	it may happen again.
1418000	1420000	The main consciousness of Taiwan
1420000	1422000	must be awakened,
1422000	1424000	because the people of Taiwan
1424000	1426000	have been oppressed for the past 400 years.
1426000	1428000	These popular historical writings
1428000	1430000	are actually shaping historical memory.
1430000	1432000	Another group of people
1432000	1434000	believe that
1434000	1436000	history should not serve the country,
1436000	1438000	so there are a lot of historical studies
1438000	1440000	to deconstruct the national state.
1440000	1442000	For example,
1442000	1444000	tradition is invented,
1444000	1446000	and tradition does not have
1446000	1448000	a long history of 5,000 years.
1448000	1450000	The so-called descendants of the King of Japan
1450000	1452000	only appeared for 100 years.
1452000	1454000	The so-called Japanese cuisine
1454000	1456000	was invented after the Ming Dynasty.
1456000	1458000	In the Middle Ages,
1458000	1460000	the Emperor of Japan believed in Buddhism,
1460000	1462000	so he told everyone not to eat meat.
1462000	1464000	In ancient East Asia,
1464000	1466000	there were four categories of animals
1466000	1468000	in the world,
1468000	1470000	such as grass fish and birds.
1470000	1472000	At that time,
1472000	1474000	the Emperor of Japan said
1474000	1476000	that everyone was not allowed to eat meat,
1476000	1478000	grass fish and birds.
1478000	1480000	In fact,
1480000	1482000	before the Ming Dynasty,
1482000	1484000	the Japanese did not eat beef or pork,
1484000	1486000	so the so-called barbecue and fried pork chops
1486000	1488000	were far-fetched Japanese cuisine.
1488000	1490000	They appeared in the late 19th century
1490000	1492000	and even in the early 20th century.
1493000	1495000	Finally, I think history
1495000	1497000	is different from everyone else.
1497000	1499000	In politics and sociology,
1499000	1501000	they ask more objective questions,
1501000	1503000	but in history,
1503000	1505000	they also ask subjective questions.
1505000	1507000	Traditional sociology
1507000	1509000	may ask a question,
1509000	1511000	such as
1511000	1513000	whether the exam system
1513000	1515000	has promoted social movement.
1515000	1517000	So some historical sociologists
1517000	1519000	will look for a lot of past history
1519000	1521000	to see if there are some
1521000	1523000	poor and hard-working people
1523000	1525000	who became good officials
1525000	1527000	because of the imperial examination,
1527000	1529000	and then flew to Tengda
1529000	1531000	and became famous
1531000	1533000	from the Han dynasty.
1533000	1535000	But historical sociology
1535000	1537000	will ask a question.
1537000	1539000	Objectively,
1539000	1541000	even if the imperial examination
1541000	1543000	really promoted social movement,
1543000	1545000	did the people at that time
1545000	1547000	really realize that
1547000	1549000	the imperial examination
1549000	1551000	promoted social movement?
1551000	1553000	In the Han dynasty,
1553000	1555000	there were some economic works.
1555000	1557000	We can find out from economics
1557000	1559000	what is the meaning of
1559000	1561000	Chou Chou's The Theory of Economics?
1561000	1563000	What does it mean in economics?
1563000	1565000	But historians may ask
1565000	1567000	a person who has not studied
1567000	1569000	modern economics,
1569000	1571000	has not studied Adam Smith,
1571000	1573000	or has not studied economics
1573000	1575000	in NTU,
1575000	1577000	how can he write The Theory of Economics?
1577000	1579000	I think this is the difference
1579000	1581000	between historical sociology
1581000	1583000	and other subjects.
1583000	1585000	The next question is
1585000	1587000	what is legal history?
1587000	1589000	Why is legal history
1589000	1591000	a field worth studying
1591000	1593000	for me?
1593000	1595000	The first argument is,
1595000	1597000	of course,
1597000	1599000	all the legal experts in the court
1599000	1601000	are historians,
1601000	1603000	because the court can only
1603000	1605000	judge what has happened.
1605000	1607000	I am going to discuss
1607000	1609000	whether Su Jianhe killed someone
1609000	1611000	in the past or not.
1611000	1613000	Is he guilty or not?
1613000	1615000	We can only discuss
1615000	1617000	whether he killed someone in the past.
1617000	1619000	The court cannot decide
1619000	1621000	whether he will kill someone in the future.
1621000	1623000	This is a matter of fact.
1623000	1625000	The court can only deal with
1625000	1627000	what has happened.
1627000	1629000	From the legal point of view,
1629000	1631000	when we make a judgment,
1631000	1633000	the court will always
1633000	1635000	make a judgment.
1635000	1637000	In the tradition of British and American law,
1637000	1639000	there are many cases
1639000	1641000	that are not in the text,
1641000	1643000	so you have to tell everyone
1643000	1645000	whether the case in front of you
1645000	1647000	is the same as the case in the past.
1647000	1649000	If it is the same,
1649000	1651000	you should apply the same law.
1651000	1653000	If it is different,
1653000	1655000	you should make another explanation.
1655000	1657000	There are some famous cases
1657000	1659000	where, for example,
1659000	1661000	a court said that
1661000	1663000	A car must pay
1663000	1665000	$10,000.
1665000	1667000	Later,
1667000	1669000	a new case came out
1669000	1671000	where
1671000	1673000	A was hit by B car.
1673000	1675000	Then
1675000	1677000	A told the court
1677000	1679000	that the driver of B car
1679000	1681000	should pay me $10,000.
1681000	1683000	But the lawyer of B car said
1683000	1685000	no, no, no,
1685000	1687000	our case is different from A car.
1687000	1689000	Because A car is black
1689000	1691000	and B car is red.
1691000	1693000	Because humans are more alert
1693000	1695000	when they see a red car.
1695000	1697000	So
1697000	1699000	when they are hit,
1699000	1701000	they have to take more responsibility
1701000	1703000	because they see a red car.
1703000	1705000	British and American law
1705000	1707000	has been debating this kind of thing,
1707000	1709000	so you have to keep looking at
1709000	1711000	the past cases
1711000	1713000	as they are now.
1713000	1715000	Then you need a lot of
1715000	1717000	historical training
1718000	1720000	The second thing is that
1720000	1722000	there is a saying in English
1722000	1724000	that the past is like a foreign country.
1724000	1726000	So when we study
1726000	1728000	the history of law,
1728000	1730000	it's like we are studying
1730000	1732000	another country.
1732000	1734000	So it's like we are now in Taiwan,
1734000	1736000	we are going to legislate.
1736000	1738000	We will refer to what the Japanese do,
1738000	1740000	what the Germans do,
1740000	1742000	what the Americans do.
1742000	1744000	Because these comparisons
1744000	1746000	can give you some ideas.
1746000	1748000	But if you refer to other countries,
1748000	1750000	you will be surprised.
1750000	1752000	Because from a psychological point of view,
1752000	1754000	people all have this
1754000	1756000	in-domain effect.
1756000	1758000	It's not good to play big
1758000	1760000	in front of the case.
1760000	1762000	But you will think
1762000	1764000	what you have is the best.
1764000	1766000	But sometimes when you look at
1766000	1768000	foreign things,
1768000	1770000	you will know that
1770000	1772000	there are many different ways
1772000	1774000	in this world.
1774000	1776000	For example, if I want to control
1776000	1778000	cigarettes,
1778000	1780000	can I refer to
1780000	1782000	how people controlled
1782000	1784000	opium in the past?
1784000	1786000	Of course, opium and cigarettes
1786000	1788000	are different things.
1788000	1790000	But you can think about
1790000	1792000	some new ideas.
1792000	1794000	The second thing is that
1794000	1796000	we all know that
1796000	1798000	humans have a path to rely on.
1798000	1800000	There is one thing that people
1800000	1802000	have been doing for a long time,
1802000	1804000	and the legal history
1804000	1806000	can help you understand
1806000	1808000	the background of this system
1808000	1810000	and its reasons.
1810000	1812000	What did people think at that time?
1812000	1814000	After understanding the reason for
1814000	1816000	the path to rely on,
1816000	1818000	we should now verify that
1818000	1820000	this condition no longer exists
1820000	1822000	or the condition has changed,
1822000	1824000	which means that
1824000	1826000	we should do something different.
1826000	1828000	For example,
1828000	1830000	in the debate on same-sex marriage,
1830000	1832000	it is said that two people
1832000	1834000	of the same sex can get married.
1834000	1836000	If not, why?
1836000	1838000	If there is, why?
1838000	1840000	Has it really changed now?
1840000	1842000	Another common legal history
1842000	1844000	is the debate on
1844000	1846000	the structure of mainstream.
1846000	1848000	For example, we used to think
1848000	1850000	that Hitler's Nazi was terrible
1850000	1852000	because he killed Jews.
1852000	1854000	He set up a prison court
1854000	1856000	and let the judge judge
1856000	1858000	that homosexuals and Jews
1858000	1860000	are inferior species
1860000	1862000	and are not suitable for having children.
1862000	1864000	On the other hand,
1864000	1866000	the United States
1866000	1868000	is a free and democratic defender.
1868000	1870000	Through World War II,
1870000	1872000	the United States
1872000	1874000	liberated
1874000	1876000	these oppressed people.
1876000	1878000	James Whitman,
1878000	1880000	a professor at Yale University,
1880000	1882000	is also a doctor of history.
1882000	1884000	He wrote a book
1884000	1886000	called Hitler's American Model.
1886000	1888000	He said that
1888000	1890000	Hitler's
1890000	1892000	racial discrimination law
1892000	1894000	was widely referred to
1894000	1896000	in the United States
1896000	1898000	as the law of racial discrimination
1898000	1900000	that oppresses black people.
1900000	1902000	In fact, Hitler once said
1902000	1904000	that Americans were too fierce to black people.
1904000	1906000	We can't be so fierce.
1906000	1908000	So, how did Hitler
1908000	1910000	know how to use the law
1910000	1912000	to oppress minorities?
1912000	1914000	It came from the United States.
1914000	1916000	This is what I am doing now.
1916000	1918000	I am using the third world approach
1918000	1920000	to look at the international law.
1920000	1922000	In the past,
1922000	1924000	we thought that the international law
1924000	1926000	was a principle of equal interaction
1926000	1928000	between sovereign states.
1928000	1930000	But in fact, it was not.
1930000	1932000	We know that the international law
1932000	1934000	was once used to oppress
1934000	1936000	and to colonize.
1936000	1938000	The Third World Approach
1938000	1940000	to International Law
1940000	1942000	has a group of scholars.
1942000	1944000	Their goal is to tell you
1944000	1946000	how the international law
1946000	1948000	from the European international law
1948000	1950000	to the international law of the world
1950000	1952000	has contributed a lot to China,
1952000	1954000	Japan, Latin America, etc.
1954000	1956000	They want to tell you
1956000	1958000	that the international law
1958000	1960000	is a tool of oppression.
1960000	1962000	We should not allow the international law
1962000	1964000	to become a tool of oppression again.
1964000	1966000	We must preserve these historical memories.
1966000	1968000	This is what I think
1968000	1970000	the legal history is doing.
1970000	1972000	Before I share my research,
1972000	1974000	I would like to know
1974000	1976000	if you have any questions.
1976000	1978000	I can answer first.
1978000	1980000	I would like to know
1980000	1982000	what is the general history
1982000	1984000	and what is the legal history.
1986000	1988000	I think I have learned a lot.
1988000	1990000	Even if I am a lawyer,
1990000	1992000	I think I have learned a lot.
1996000	1998000	Should I continue?
1998000	2000000	It seems that
2000000	2002000	everyone is still digesting.
2002000	2004000	The information is a bit large.
2004000	2006000	I will try to speak in plain language.
2006000	2008000	I don't know if
2008000	2010000	everyone can understand.
2012000	2014000	I think I have made it clear.
2014000	2016000	I have heard a lot of concepts
2016000	2018000	for the first time.
2018000	2020000	I am not sure
2020000	2022000	but you have made it clear today.
2022000	2024000	The language is very good.
2024000	2026000	I think it has helped me
2026000	2028000	to digest so much information.
2030000	2032000	Can you hear me?
2032000	2034000	Yes.
2034000	2036000	I have a question.
2036000	2038000	I am curious
2038000	2040000	about the background
2040000	2042000	you set up
2042000	2044000	in the beginning.
2044000	2046000	What is history?
2046000	2048000	The front part
2048000	2050000	and the back part
2050000	2052000	are there any differences in views?
2052000	2054000	If so,
2054000	2056000	what do you think?
2058000	2060000	Today's speech
2060000	2062000	is mainly to
2062000	2064000	deconstruct nationalism.
2064000	2066000	In the past, foreign law
2066000	2068000	was described as
2068000	2070000	a symbol of
2070000	2072000	a third world people,
2072000	2074000	Chinese, Japanese,
2074000	2076000	or non-Western people
2076000	2078000	being oppressed.
2078000	2080000	But I will tell you
2080000	2082000	that the actual operation
2082000	2084000	of this theory
2084000	2086000	is based on two things.
2086000	2088000	The first is that
2088000	2090000	I want to improve
2090000	2092000	the meaning of the theory.
2094000	2096000	In the future,
2096000	2098000	I may want to
2098000	2100000	use other methods
2100000	2102000	of political,
2102000	2104000	economic,
2104000	2106000	and socialization
2106000	2108000	to make it more abstract
2108000	2110000	and more applicable.
2110000	2112000	I also hope you can
2112000	2114000	give me some advice.
2116000	2118000	Many people
2118000	2120000	are not familiar with
2120000	2122000	law and history,
2122000	2124000	so I hope I can
2124000	2126000	give you a brief introduction
2126000	2128000	of what I am doing in this field.
2128000	2130000	I also want to
2130000	2132000	take this opportunity
2132000	2134000	to let you know
2134000	2136000	what is the purpose
2136000	2138000	of the American Academy of Law
2138000	2140000	and what is the purpose
2140000	2142000	of the American Academy of Law.
2146000	2148000	Did I answer your question?
2148000	2150000	Yes, you did.
2150000	2152000	Thank you.
2168000	2170000	If not,
2170000	2172000	please continue.
2172000	2174000	Thank you.
2180000	2182000	I think the training
2182000	2184000	from Northwestern University
2184000	2186000	is very interesting.
2186000	2188000	Foreign students
2188000	2190000	have to take a class
2190000	2192000	in English.
2192000	2194000	The teacher will teach us
2194000	2196000	some tips.
2196000	2198000	When you don't know what to say,
2198000	2200000	just take a sip of water.
2200000	2202000	No one will ask you
2202000	2204000	why you are drinking water.
2204000	2206000	Sometimes,
2206000	2208000	you can relax
2208000	2210000	and think about
2210000	2212000	what you want to say.
2212000	2214000	Let's move on
2214000	2216000	to the topic of
2216000	2218000	extracurricular law.
2218000	2220000	Extracurricular law,
2220000	2222000	at least for me,
2222000	2224000	is a term
2224000	2226000	but we don't know
2226000	2228000	what actually happens
2228000	2230000	to it.
2230000	2232000	To put it simply,
2232000	2234000	extracurricular law
2234000	2236000	is the privilege that
2236000	2238000	foreigners are not
2238000	2240000	under the jurisdiction
2240000	2242000	of the local courts.
2242000	2244000	In other words,
2244000	2246000	in 1900,
2246000	2248000	if an American
2248000	2250000	stole or committed a crime
2250000	2252000	in China
2252000	2254000	or any other country
2254000	2256000	wanted to sue him,
2256000	2258000	the Chinese government
2258000	2260000	and the Chinese courts
2260000	2262000	couldn't do anything
2262000	2264000	because he was under the jurisdiction
2264000	2266000	of the local courts.
2266000	2268000	Only the U.S. courts
2268000	2270000	or the U.S. courts
2270000	2272000	can deal with such cases.
2272000	2274000	This is extracurricular law.
2274000	2276000	Extracurricular law still exists
2276000	2278000	in some countries.
2278000	2280000	For example,
2280000	2282000	if an American
2282000	2284000	raped a woman
2284000	2286000	or a child
2286000	2288000	in a local court,
2288000	2290000	the Japanese courts
2290000	2292000	couldn't bring him to trial
2292000	2294000	because he was under the jurisdiction
2294000	2296000	of the U.S. courts.
2296000	2298000	It's not that the U.S. courts
2298000	2300000	couldn't bring him to trial,
2300000	2302000	but the U.S. courts.
2302000	2304000	It sounds unreasonable.
2304000	2306000	Let's move on.
2306000	2308000	The first time that
2308000	2310000	the U.S. signed a treaty
2310000	2312000	was in 1842,
2312000	2314000	the Treaty of Nanjing,
2314000	2316000	China signed a treaty
2316000	2318000	after the Opium War.
2318000	2320000	In this treaty,
2320000	2322000	the U.K. required
2322000	2324000	China to provide
2324000	2326000	extracurricular law to the U.K.
2326000	2328000	The U.S. signed the treaty
2328000	2330000	in 1844,
2330000	2332000	the Treaty of Wangxia,
2332000	2334000	China.
2334000	2336000	In Chinese textbooks,
2336000	2338000	extracurricular law
2338000	2340000	is a symbol of
2340000	2342000	imperialism.
2342000	2344000	Today, our country's citizens
2344000	2346000	are being bullied.
2346000	2348000	Why doesn't our country
2348000	2350000	promote justice?
2350000	2352000	Why does the U.S. court
2352000	2354000	have to bring him to trial?
2354000	2356000	The U.S. court
2356000	2358000	must be very biased.
2358000	2360000	The U.S. court
2360000	2362000	must tolerate
2362000	2364000	the U.S. people
2364000	2366000	because the U.S. people
2366000	2368000	betrayed the sovereignty
2368000	2370000	of China.
2370000	2372000	The U.S. court must
2372000	2374000	revolutionize the U.S.
2374000	2376000	The U.S. court
2376000	2378000	must abolish extracurricular law
2378000	2380000	so that the Chinese people
2380000	2382000	will no longer be bullied.
2382000	2384000	Is it really like this?
2384000	2386000	Let's move on.
2386000	2388000	For example,
2388000	2390000	when the U.S. came to China
2390000	2392000	to negotiate the Treaty of Wangxia,
2392000	2394000	the U.S. diplomat,
2394000	2396000	William Cushing,
2396000	2398000	gave a speech
2398000	2400000	in the U.S. Congress.
2400000	2402000	He said,
2402000	2404000	his proudest moment
2404000	2406000	was when the U.S. wrote
2406000	2408000	the extracurricular law
2408000	2410000	in the Treaty of Wangxia.
2410000	2412000	Because China
2412000	2414000	is an uncivilized place.
2414000	2416000	The judges in their countries
2416000	2418000	do not have three powers.
2418000	2420000	The county magistrates
2420000	2422000	do not have three powers.
2422000	2424000	How can the county magistrates
2424000	2426000	be the judges?
2426000	2428000	In Taiwan,
2428000	2430000	can He Wen-je be a judge?
2430000	2432000	No.
2432000	2434000	Administrative and judicial
2434000	2436000	should be separated.
2436000	2438000	China is an uncivilized country.
2438000	2440000	If you commit a serious crime,
2440000	2442000	you will be imprisoned,
2442000	2444000	you will be tortured,
2444000	2446000	you will be beaten.
2446000	2448000	If our people
2448000	2450000	are the most advanced species,
2450000	2452000	how can we obey the laws of the barbarians?
2452000	2454000	Therefore,
2454000	2456000	obtaining the extracurricular law
2456000	2458000	is a civilized victory.
2458000	2460000	It sounds like a good idea.
2460000	2462000	However,
2462000	2464000	historians have found
2464000	2466000	that before 1868,
2466000	2468000	we could not find
2468000	2470000	any Chinese history
2470000	2472000	against the extracurricular law.
2472000	2474000	This is actually
2474000	2476000	a very strange thing.
2476000	2478000	If China is so powerful,
2478000	2480000	why does China never object
2480000	2482000	to all the negotiations?
2482000	2484000	China thinks it is good.
2484000	2486000	Why?
2486000	2488000	If you want to extracurricular law,
2488000	2490000	we will give it to you.
2490000	2492000	This question
2492000	2494000	is related to a very popular research topic
2494000	2496000	in recent history,
2496000	2498000	which is the multidimensionalism
2498000	2500000	of the empire and the law.
2500000	2502000	In fact,
2502000	2504000	the majority of human history
2504000	2506000	is dominated by the British
2506000	2508000	and the Germans.
2508000	2510000	In fact,
2510000	2512000	the majority of human history
2512000	2514000	is dominated by the Empire.
2514000	2516000	What is the Empire?
2516000	2518000	The simplest definition
2518000	2520000	is that
2520000	2522000	under a regime,
2522000	2524000	there are many different
2524000	2526000	ethnic groups
2526000	2528000	and activists.
2528000	2530000	For example,
2530000	2532000	the Qing Dynasty
2532000	2534000	was an empire
2534000	2536000	with Han people,
2536000	2538000	Tibetans,
2538000	2540000	Mongols,
2540000	2542000	ethnic minorities
2542000	2544000	and Xinjiang people.
2544000	2546000	The next question is
2546000	2548000	that we all know that
2548000	2550000	there is a law called the Qing Dynasty Law.
2550000	2552000	But did the Qing Dynasty Law
2552000	2554000	apply in Tibet?
2554000	2556000	Did the Qing Dynasty Law
2556000	2558000	apply in Xinjiang?
2558000	2560000	In fact, it did not.
2560000	2562000	Although the Qing Dynasty Law
2562000	2564000	applied to most empires,
2564000	2566000	the Roman Empire
2566000	2568000	also applied the law to the Jews.
2568000	2570000	In the Qing Dynasty,
2570000	2572000	the Mongols still applied
2572000	2574000	the traditional Mongolian law,
2574000	2576000	while the Tibetans still applied the Tibetan law.
2576000	2578000	Only the Han people
2578000	2580000	applied the Qing Dynasty Law.
2580000	2582000	This is understandable.
2582000	2584000	When a country is very large
2584000	2586000	and is an empire,
2586000	2588000	how could it be possible
2588000	2590000	to force a Mongolian
2590000	2592000	to marry in a Confucian way?
2594000	2596000	This is also a question of
2596000	2598000	the cost of rule.
2598000	2600000	In order to maintain the operation of an empire
2600000	2602000	and the coordination of the ethnic groups,
2602000	2604000	you must use different laws
2604000	2606000	to treat different people.
2606000	2608000	This is now called
2608000	2610000	the law pluralism.
2610000	2612000	Does Taiwan want to do the same thing?
2612000	2614000	Should the indigenous people
2614000	2616000	apply the indigenous law
2616000	2618000	or not?
2618000	2620000	From the perspective of China,
2620000	2622000	in 1842,
2622000	2624000	the British said
2624000	2626000	that they wanted to
2626000	2628000	apply the British law in China.
2628000	2630000	Think about it.
2630000	2632000	What's wrong with
2632000	2634000	the Mongolians
2634000	2636000	applying the Mongolian law
2636000	2638000	and the British applying the British law?
2638000	2640000	At that time,
2640000	2642000	foreigners could only
2642000	2644000	move around
2644000	2646000	when they came to China.
2646000	2648000	Basically,
2648000	2650000	it did not affect the original life of the Han people.
2650000	2652000	Therefore,
2652000	2654000	there is nothing wrong with
2654000	2656000	giving you a piece of land
2656000	2658000	and having your own law.
