start	end	text
0	18000	Welcome everyone to today's Terra Talk, we are very honored to invite our speaker, Mr. Huang Shengfeng, to tell us about today's topic, Taiwan's international law positioning, the past, the present and the future.
18000	27000	I am very happy, because we have a long time in fact, there are no humanities or social science-related speeches.
27000	36000	Today, it is easy to invite Mr. Shengfeng, and Mr. Shengfeng is now in Edinburgh, he is 12 o'clock in the middle of the night to speak for everyone, so thank him very much.
37000	50000	First, let me introduce the background of Shengfeng. Shengfeng is the founder of Taipeng International Law, the founder of the Taiwan Voter Alliance.
50000	70000	He previously studied law at Taipei University and the Law Department of Taipei University, and then studied international law at the University of London, and now studies international law at Edinburgh University.
70000	80000	He is going to talk to us about the topic of Taiwan's international law positioning, the past, the present and the future.
80000	93000	A small reminder, if you don't turn on the microphone, you can't hear the applause, so let's turn on the microphone together, and thank Shengfeng for bringing us today's speech.
100000	112000	Hello everyone, I am Huang Shengfeng. Today I am very happy to have this opportunity to share with you some of the results of my research so far.
112000	120000	My research topic is Taiwan's international law positioning, the past, the present and the future.
120000	134000	At the beginning of the speech, I would like to share a sentence with everyone. This is what Albus Dumbledore said in Harry Potter.
134000	138000	Sometimes we must choose between what is right and what is easy.
164000	177000	In the end, it created today's situation. When we want to solve some problems in the future, we must continue to face many choices.
177000	188000	I don't know if the Taiwanese will choose the right choice or the simple and easy choice. I think this may determine our future.
188000	196000	At the beginning of this speech, I hope everyone can keep this sentence in mind.
196000	205000	Later, when I talk about the content, you can take this sentence out from time to time and think about it.
205000	215000	At that time, what did the Taiwanese think or what choices did the Taiwanese make in the end? What should we do in the future?
215000	220000	There are three main topics I want to share today. The first is the background knowledge of international law.
220000	226000	The second is the past and present of international law. The last is the future.
226000	240000	The background knowledge of international law is because most of the people who come to listen to my presentation today are not legal background.
241000	248000	So they may not know much about this aspect. I want to do some basic background explanation first.
248000	253000	Then I will start to talk about our internal topics.
253000	257000	First of all, we need to understand what international law is.
257000	266000	International law is the basic rule of law between political entities.
266000	269000	What is the political entity on international law?
269000	275000	Basically, it includes the so-called sovereign state.
275000	283000	The second is the so-called international organization, such as the United Nations, WHO, and WTO.
283000	285000	These are also political entities on international law.
285000	291000	The other is the implementation of autonomous units, such as Taiwan or Somaliland.
291000	298000	I put Taiwan in the implementation of autonomous units, not in the country.
298000	312000	This means that at least so far, under the definition of international law, Taiwan has not yet been recognized as a sovereign state.
312000	314000	Of course, everyone may have different ideas.
314000	320000	But from the perspective of international law, Taiwan is not yet.
320000	322000	Of course, I will say why it is not.
322000	331000	In addition, international law is the principle that determines the rights and obligations of the political entity on international law and its right to carry out its obligations.
331000	334000	The scope of international law is actually very wide.
334000	343000	Generally, when people hear international law, they sometimes feel that it is related to a place, a country, or diplomacy.
343000	349000	In fact, the scope of international law is very wide, including political, economic, military, and human rights.
349000	353000	For example, international relations, diplomacy, and business.
353000	359000	Then there is economic, import-export trade, currency exchange, financial transactions, and securities transactions.
359000	365000	In fact, today some people say that international law does not seem to have any effect.
365000	375000	In fact, if we want to implement import-export trade, or even if we want to study abroad,
375000	380000	or when you go sightseeing and need to exchange foreign currency, this is also related to international law.
380000	389000	Even now, some people may be in the United States, and then you can buy and sell securities and goods from other countries.
389000	393000	These financial transactions are all related to international law.
393000	401000	Then, for example, the military part, such as hand-to-hand combat, stop-and-go, how to end the war, military occupation.
401000	405000	Then, for example, the restrictions on nuclear and biological weapons.
405000	412000	For example, recently, the US withdrew the Semiconductor Missile Agreement.
412000	416000	These are all related to the military.
416000	423000	Then, for example, the human rights part, such as the right to freedom, the right to self-determination, the right to life, the right to transport, and the human rights law.
423000	438000	In fact, basically, we can say that as long as you have a connection with other countries, no matter what form of connection it is, it will be related to international law.
438000	446000	Hearing international law, there is often a reaction that international law is bigger and more powerful than fist.
446000	451000	However, it must be emphasized here that international law is not only bigger than fist.
451000	457000	Because if it is really bigger than fist, I believe that the biggest fist in the world now is the United States.
457000	462000	But even if the United States has such a big fist, it can't stop it.
462000	466000	That is, the wife of Palestine, she was born in front of the United Nations.
466000	472000	The United States is only one vote in the United Nations, in the General Assembly, and in the Security Council.
472000	478000	So it can't decide everything, although its fist may be the biggest in the world.
478000	485000	In addition, for example, China, of course, can't prevent the International Court of Justice from making a judgment against it.
485000	493000	Of course, at this time, some people will say that although it is said that it is not conducive to its judgment, China is still my heart and my tree.
493000	496000	But we have to think a little bit, that is, yes, that's right.
496000	508000	Although the Philippine was against the South China Sea part of the International Court of Justice, and then the International Court of Justice put China on it.
508000	518000	Later, the International Court of Justice made some of China's claims that there was no legal effect, that is, it did not have those rights.
518000	529000	Although China later decided not to recognize these things, other countries made such a decision because of the International Court of Justice.
529000	538000	So other countries, such as the United States, claimed that since the International Court of Justice believed that the right to claim did not exist,
539000	544000	then I followed the rules of the International Court of Justice, such as the International Ocean Law, and I exercised my freedom of navigation.
544000	548000	There are other countries, such as the United Kingdom, who are also exercising their freedom of navigation.
548000	561000	When other countries make a decision because of you, such as the International Court of Justice, and then let other countries obtain other basis on the International Law to exercise their rights, this is the effect of the International Law.
562000	570000	So what the International Law represents is to tell everyone that there is more than just a fist in the international community.
570000	578000	Because even if you have a fist as big as China, and then it is not willing to recognize the decision made by the International Court of Justice,
578000	585000	but other countries can still act according to the judgment made by the International Court of Justice.
585000	591000	At this time, even if China is dissatisfied, it can only look aside.
591000	599000	In this regard, I would like to let everyone know that the strong can set the rules, and the weak must comply with the rules.
599000	612000	The International Law is actually a decision made by the great powers and the strong to discuss and make a political decision.
613000	631000	The main purpose of the International Law is to allow different countries to solve disputes in a civilized and legal way, rather than a rapid war.
631000	642000	So in this case, we can know that the International Law is to some extent a bit like a structure on the balance of danger.
642000	649000	So in this case, even if it is a big country, it will feel that it is necessary to comply with the International Law.
649000	655000	Because if it does not comply with the International Law, other big countries may not comply with the International Law, and then it will be a mess.
655000	661000	In the event that everyone gives up their strength, it may be the end of the world.
661000	668000	For countries that are not strong, the strength is not so strong.
668000	676000	In fact, it is more important to understand what the rules are made by these big countries, and then to make good use of these rules.
676000	682000	Because in this case, you are not saying that you are bigger than the fist, you are a small fist against a big fist, you will win.
682000	688000	But if you follow the rules of the International Law, the rules of the International Law are a rule created by the power.
688000	696000	When you follow the rules created by the power to deal with other powers, you are like standing on the shoulders of a giant.
696000	700000	Although you may be a small person, you are standing on the shoulders of a giant.
700000	712000	The International Law is actually very useful, and in fact, for the weaker object, the greater the impact of the International Law, the stronger the meaning.
712000	714000	In fact, here I want to mention a simple example.
714000	727000	For example, after the founding of the People's Republic of China on October 1, 1949, it took 22 years and 24 days for it to become the representative government of China in the United Nations on October 25, 1971.
727000	733000	On October 25, 1971, the United Nations General Assembly Resolution No. 2758 was passed.
733000	742000	According to that resolution, the representative of China in the United Nations is the representative of the People's Republic of China.
742000	759000	So we all know that although the People's Republic of China came to Taiwan because of the civil war, and the so-called mainland China was controlled by the People's Republic of China.
759000	769000	But even though the power is so different, the People's Republic of China also took more than 20 years to enter the United Nations.
769000	777000	So it's not that it's really bigger than the fist. If it's really bigger than the fist, it should have entered earlier, and it wouldn't have waited more than 20 years.
777000	791000	Then again, like Palestine, it was after the independence of Palestine was announced on November 15, 1988. It took 24 years and 14 days for it to become a member of the United Nations.
791000	803000	So we find that whether it is a strong, stronger foundation of the People's Republic of China, or a very weak Palestine.
803000	812000	But after they were established, it took a long time for them to enter the international community, for example, to enter the United Nations.
813000	819000	So we know that whether it is strong or weak, the international law has a certain impact on them.
819000	827000	I am here to talk about the United Nations, because whether it is the People's Republic of China regime or Palestine,
827000	833000	they entered the United Nations today in accordance with the regulations set by the United Nations itself.
833000	840000	Of course, the regulations set by the United Nations International Organization also follow the regulations set by the international law.
840000	850000	So basically everyone follows the regulations of the international law. No one says that I have a big fist today, so I can listen to me directly.
850000	856000	Or that I am very weak, so everyone has to pity me. In fact, there is no such thing.
856000	867000	So I think that the international law has the greatest effect on the weak, which is to increase the competition with the strong, and then the political and legal defense.
867000	881000	In fact, this is especially important for Taiwan. I think that many people who come to participate today may have a nationality from other countries, for example, you may have a nationality in the United States.
882000	895000	Maybe you don't feel so strongly about this, but if you say that the nationality you have today or the place you are in is a relatively weak place in international politics or international relations,
895000	902000	in fact, you will feel that if everyone is just a fist, there is not much effect.
902000	911000	But if there is an international law as a backer, when you go to fight for some rights with others, you will have the opportunity to get what you want.
912000	915000	Can I ask a question?
915000	925000	You just said that there are three kinds of political entities in the world, the state, the WHO, and Taiwan or Somaliland.
926000	935000	Then you just had a statement that all interactions between countries must abide by international law.
935000	945000	I want to ask that the object of the international law is actually the country, that is, the ABC of the three A or ABC?
946000	947000	ABC.
947000	949000	So all three are required?
949000	950000	Yes.
950000	956000	Because I just said that the basic interactions between political entities in international law are regulated.
956000	960000	So the political entities in international law include those three things.
961000	963000	OK, thank you.
969000	979000	I think everyone has heard of the four elements of a country, namely territory, people, and government.
980000	982000	Then there is sovereignty.
982000	1000000	For example, if you were educated in Taiwan, you would probably know the four elements of a country, namely territory, people, government, and sovereignty.
1000000	1005000	But I want to tell you that this statement is wrong.
1005000	1017000	The reason is that sovereignty is something that a country will have after it is formed.
1017000	1023000	So it is not a basic element that constitutes a country.
1023000	1028000	It is something that you will have after you become a country.
1029000	1037000	So if you say that sovereignty is an element that constitutes a country, this is a bit of a logical question.
1037000	1044000	Basically, it should be said that it is not the so-called four elements, but the characteristics that a sovereign country should have.
1044000	1051000	That is, in the Montevideo Convention on the Rights of the Nation, it talks about territory, people, and government.
1052000	1059000	In addition, there is the so-called diplomatic ability, which is the ability to communicate with other sovereign countries.
1059000	1064000	I particularly emphasize the ability to communicate with other sovereign countries.
1065000	1075000	And the important thing is that the sovereign country must treat you as a sovereign country.
1075000	1086000	When you communicate with the so-called official position, your diplomatic ability is truly recognized.
1087000	1092000	So in fact, a country, a very interesting thing is that the so-called sovereign country needs to have characteristics,
1092000	1099000	In addition to those entities that can be seen, such as territory, people, and government,
1099000	1105000	The other part of the diplomatic ability is actually directly linked to the so-called recognition part.
1105000	1112000	In fact, of course, some people say that you are or are not a country today, and you do not need other countries to recognize you.
1112000	1120000	But now the question is whether you are a country or whether you can play the role of a country.
1120000	1126000	In fact, it depends on whether other countries treat you as a country.
1126000	1137000	So whether or not you are recognized today is the key to becoming a country.
1137000	1145000	But to be recognized by other countries, to recognize that you are a country, is to allow you to operate like a country,
1145000	1151000	Or like a country, a basic prerequisite for connecting with other countries.
1151000	1157000	So in fact, when we have the so-called territory today, and the people have the government,
1157000	1165000	Then, with the diplomatic ability to be equal to other countries, you will have a so-called sovereign thing.
1165000	1175000	In fact, the form of sovereign performance is that it can control or manage the land and people internally,
1175000	1180000	Then you can have diplomatic relations with other countries.
1180000	1186000	So in fact, sovereign countries need to have these characteristics.
1186000	1194000	Basically, we can say that if it is a country, it will have these characteristics.
1194000	1200000	But having these characteristics does not mean that you are a country.
1200000	1205000	This is a bit logical, that is, if P is Q, if it is not Q, it is not P.
1205000	1213000	But you can't say that if P is Q, then if it is not P, then it is not Q. This logic is wrong.
1213000	1218000	OK, here is another basic knowledge.
1218000	1224000	That is, we have to distinguish between the so-called country, the government, and the regime.
1224000	1232000	The so-called country is a political entity with international law that dominates the national legal personality.
1232000	1239000	The regime is a political group with practical power and governance ability.
1239000	1247000	So if there is a group of people today and they form an organization,
1247000	1254000	Then that organization has practical control and can govern a certain place and govern a certain people.
1254000	1263000	We can say that the organization built by this group of people is a so-called regime.
1263000	1269000	Then there is another so-called government. The government is a government that can represent the country, that is, represent the country externally.
1269000	1278000	Then internally, it can govern the people and the land, and it is a regime that conducts diplomacy externally.
1278000	1282000	The distinction between this place and this place is very important.
1282000	1290000	Because if we put these three things together today, we will often have problems when we judge some problems.
1290000	1295000	Especially when facing the situation in Taiwan.
1295000	1303000	There are a few points here. The first is that a country can only have a government that represents the country, the so-called government.
1303000	1307000	The representative government is a regime that can represent the country.
1307000	1316000	So we know that the representative government is a regime, but this regime has another special nature, that is, it can represent the country.
1316000	1325000	In a country, there may be several regimes at the same time, and these several regimes are in the so-called representative government.
1325000	1331000	If there is such a situation, it is the so-called representative power struggle.
1331000	1336000	The most direct example is China, which is related to Taiwan.
1336000	1345000	From October 1, 1949 to today, the representative power struggle between the People's Republic of China government and the People's Republic of China government.
1345000	1349000	I also wrote the government here. In fact, we all know that they call themselves the government.
1349000	1354000	In fact, it is the regime of the People's Republic of China and the regime of the People's Republic of China.
1354000	1357000	They are fighting for the position of the Chinese representative government.
1357000	1364000	Which one wins will become the so-called Chinese government, the Chinese representative government.
1364000	1371000	The other is Venezuela. Venezuela just happened this year.
1371000	1376000	We know that the government of Maduro, and then there was a government of Guaido.
1376000	1380000	Guaido is a leader of the ruling party.
1380000	1385000	He thinks that the election of the Maduro government was problematic.
1385000	1389000	He does not recognize the election result.
1389000	1396000	In addition, Maduro's previous governance had a big problem.
1396000	1401000	There was a very big financial problem in Venezuela.
1401000	1404000	Guaido felt that he could not do it.
1404000	1412000	He appointed himself as the temporary president and established the so-called transitional government.
1412000	1421000	The interesting thing here is that the United States was the first to recognize that Guaido's transitional government was the representative government of Venezuela.
1421000	1425000	The Maduro government is not the representative government.
1425000	1439000	The interesting thing here is that other countries can choose which regime is the representative government of another country.
1439000	1446000	After their choice, they will follow their choice to deal with the government of this country.
1446000	1455000	For example, after the Maduro government decided to recognize Guaido's transitional government in the United States,
1455000	1461000	it ordered the U.S. diplomats to leave Venezuela.
1461000	1471000	The U.S. government's response is that we now recognize that Guaido's transitional government is the legitimate government of Venezuela.
1471000	1475000	Since the U.S. government is not the legitimate government of Venezuela,
1475000	1481000	the U.S. government's request to the U.S. diplomats to leave Venezuela is illegal.
1481000	1483000	The U.S. government does not recognize this request.
1483000	1486000	So the U.S. diplomats continue to stay in Venezuela.
1486000	1491000	This is actually a very interesting situation.
1491000	1497000	We know that countries have various characteristics.
1497000	1502000	Some of these characteristics are necessary, while some are not.
1502000	1511000	Let's see how these characteristics will change after the change.
1511000	1513000	First, let's talk about nationality.
1513000	1516000	Every country has a nationality, which is its name.
1516000	1520000	Of course, it can be changed, but its change will not affect its legal personality.
1520000	1532000	For example, if my name is Huang Shengfeng, and if I change my name to Lai Qingde, I will not become the former director of the Executive Yuan.
1532000	1535000	The same goes for countries.
1535000	1540000	After the country's nationality is changed, its national legal personality will not change.
1540000	1547000	A recent example is that Swaziland was renamed Swaziland in 2018.
1547000	1552000	Another example is that the Qing Dynasty changed its name to the Republic of China in 1912.
1552000	1555000	I say that the Republic of China was renamed.
1555000	1564000	You may think that the Republic of China was not founded by Sun Wen to overthrow the Qing Dynasty.
1564000	1571000	In fact, the Republic of China was founded by Emperor Xuantong of the Qing Dynasty.
1571000	1576000	Emperor Xuantong of the Qing Dynasty issued a decree of abdication in 1912.
1576000	1582000	In this decree, he announced that the Qing Dynasty would be changed from an imperial system to a republic system.
1582000	1587000	The Qing Dynasty would become the Great Republic of China, which was allied with the Han Dynasty.
1587000	1592000	Emperor Xuantong of the Qing Dynasty appointed Yuan Shikai as the temporary government.
1592000	1603000	The Qing Dynasty changed from an imperial system to a republic system.
1603000	1607000	The Qing Dynasty changed its name to the Republic of China.
1607000	1617000	The Qing Dynasty was later replaced by Yuan Shikai's temporary government.
1617000	1624000	Some people may not believe it, but I want to make it simple.
1624000	1633000	In the 6th year of the Republic of China, the so-called Xuantong 9th year,
1633000	1637000	there was a thing called Zhang Xun's abdication.
1637000	1644000	If you have read the history of the Republic of China textbooks, you will know the so-called Zhang Xun's abdication.
1644000	1651000	Zhang Xun's abdication means that the Republic of China changed from a republic system to an imperial system.
1651000	1655000	So Puyi ascended the throne again.
1655000	1657000	Let's think about one thing.
1657000	1663000	If the Qing Dynasty was overthrown today, if this country was overthrown,
1663000	1670000	and the Republic of China was a new country, how could you change it back?
1670000	1675000	It's just a simple change of a system, and then the name was changed and changed again.
1675000	1680000	If you are building a new country today, how could you change it like this?
1680000	1681000	In fact, it's not.
1681000	1686000	Because the Republic of China itself is the Qing Dynasty itself.
1686000	1689000	It just changed the system and changed the name.
1689000	1695000	So when Zhang Xun abdicated, because it was the same, it was able to return to its previous state.
